Comment,Negative,Neutral,Positive
There are 3 phases: 20 minutes Mockup lecture  5min Q&A 20 minutes Research Presentation  5min Q&A 1hour Interview with questions There will be a month to wait before getting feedback,0.9397738,0.060037747,0.0001884421
The interview process was good and smooth the interviewer asked me to relax and prepare myself before start. And even told me to let them know if I need extra time to answer the questions.,0.0019808838,0.96984947,0.028169686
the process is good and a bit long with many behavior questions. and questions about culture. two people were interviewed. overall it is friendly. they wanna someone to start as soon as possible,0.0008403293,0.9978668,0.0012929732
The whole interview takes about 30 minutes. I remember a question about Te Tiriti o Waitangi Another question is please introduce your own strengths. The University of Auckland is a very good employer.,0.005383424,0.9780733,0.016543271
Fair process in which I was kept well informed. The interviewers did their best to make me feel at ease which I really appreciated. There were two rounds of interviews and I was ultimately successful in getting the job.,0.0037014787,0.09608605,0.90021247
The interview was a speedy process. The recruitment officers all asked standard interview questions along with interview questions specific to the field of study. They all had a professional manner.,0.0017677465,0.009936593,0.9882957
Started with a group interview was somewhat of a weird scenario to try and make you uncomfortable. Group interview with 3 members of staff afterwards was focused on team skills and communication,0.0041594827,0.9956584,0.00018221566
Very nice and lovely interviewers. Basic behavioural questions and some questions about motivations and salary. Interview in 40 mins with 2 people. 2 rounds interview. Phone interview first and then Zoom interview.,0.00052889384,0.0048764218,0.99459463
Group interview with more than ten candidates who were all very energetic and good at interpersonal skills. The process started with introductions and discussion of prior experience. Then about strengths and weaknesses.,0.0007061478,0.9529202,0.046373636
It was a very formal interview and very professional. The interview was conducted by two interviewers both with very good attitudes and the questions asked were all job related， Patiently listened and carefully answered when asked questions,0.0010964267,0.0121170655,0.9867865
this was for a contract role Straight and structured process  Phone Screening Panel Interview (Hiring Manager Portfolio Lead and Business Owner) and Programme Sponsor Interview . Two rounds of negotiation  contract signoff and offer acceptance,0.00028438185,0.99729234,0.002423292
The interview process was quite long it went on for a few months before they came back to me with an offer. This process included lots of different stages. Phone screening online assessments. Assessment centre and interview this included a group introduction and role play,0.9959364,0.003943376,0.000120238525
Fast and efficient interview process with relevant to role with some questions on competency and outlining the main benefits of your skills to the role; also questions on ambition for the role,0.0019143507,0.013883721,0.9842019
There are two questions. Each question gives 1 minute and 30 seconds to answer.  When one question finishes then it moves to the next question automatically. You cannot go back to the previous question if you finish the question.,0.0049010944,0.994686,0.0004129103
Interviewed in a nice new building the interview itself was upfront about the job expectations casual interview talking about what the day would look like. The only problem is it became evident the job description was not the most accurate so I was shut down pretty quickly.,0.7632007,0.23573628,0.0010630226
An online meeting is scheduled by HR.  Then it is an online meeting with the development team and HR. You would be asked about conventional questions such as previous experience how you handle stress how you work with coworkers etc.,0.0014852358,0.9982949,0.00021988714
Long process but was ok. Conducted over zoom during the 2020 pandemic. First was individual interviews then group interviews. Two interviewers per person over a period of about two weeks. This meant that there were a lot of people applying.,0.0009859295,0.9985084,0.00050560763
I was asked to complete a simple technical tests. Then I completed couple of phone interviews where I was asked about myself and number of technical question on Jave programming language.,0.0004929538,0.9988649,0.0006421067
Applied through the UoA website. In 3 days of the vacancy closing I was notified that they wanted to interview me. 2 days after the interview I was offered the position.,0.0004693294,0.9988066,0.0007240251
Quick and easy. No formal interview just EOI email and CV. Was recommended this tutoring role by a supervisor and an offer was given shortly after.  Easiest method to obtain a TA role is through networking.,0.000369236,0.00070470065,0.998926
Easy process direct questions regarding HR. star technique questions. Overall good interview and professional environment. Easy process direct questions regarding HR. star technique questions. Overall good interview and professional environment,0.00035455637,0.0012502238,0.99839514
It's basically just email conversations with your potential supervisor. If he/she agrees to take you as a student you just need to follow the general application procedures of the University.,0.00095675973,0.9987004,0.0003428347
The interview is about 30~40 minutes long and is mainly carried out by the interviewer's lead.  The panel involves two the executive and the manager. Not enough questions asked for you to appeal yourself so impress your employer with a resume.,0.9984189,0.0014067782,0.0001742519
Meet with interview panel who asked me to prepare a presentation and some open questions. Got feedback and reference check very quickly and offered a place. Very friendly interview panel.,0.00040021076,0.0005220543,0.9990777
 First had a Phone Interview with a AUT HR personal  HR processed a Reference Check  In person interview with the manager. Basic questions about my experience/seeing if you are a good fit for the team.  Was given a offer which i accepted shortly after,0.00063002383,0.9989477,0.00042227667
Group Interview where you arrived at the building met the other people who were also applying for the job and the recruiters were very friendly and the interview process was not too much pressure.,0.0016284849,0.03975958,0.95861197
Had 2 interviews a group one with 9 other people and an indivifual one for about 1520 minutes.  Group interview had questions like why should we choose you what skills do you bring. It also had team activities to do with others.,0.0004298384,0.9991027,0.0004674791
Got interviewed by two people. There was a long queue had to wait an hour from my scheduled time.  when we entered the small office they quickly asked me some behavioral questions,0.99869555,0.001139424,0.00016497186
Simple questions  why do you want the job and what do you think you will learn from this? how flexible are you? Will you be on time? how busy are your classes? etc etc,0.0067652306,0.9928075,0.0004272873
Two people one from upper management and my direct manager. Casual style of interview without technical questions. Basically to get an idea of character and more details about other jobs held elsewhere in order to see if fit with the rest of the team would be good.,0.0016223735,0.99818087,0.00019682964
Walked into the room sat down drank some water moved my legs looked out the window and then had a chat.  Then I slowly got out of my seat stretched my legs had a sip of water and walked  out.,0.00041420048,0.99826896,0.0013167777
Nominated by faculty and then confirmed by email. Very friendly environment to intake the interview. Very meaningful job to assist international students as to settle in a new country. Normally the interview hold in own student center in the faculty.,0.0002279266,0.0004297681,0.99934226
Interview process was easy but I was called to a different campus than where classes were to be held. I sent my CV via email and they screened it out of maybe 40 odd applications. They said they would call me by the evening indicating whether I get the job or not but I did not receive any response to my follow up emails or calls which was a bit odd I guess.,0.0015106228,0.9982717,0.00021769994
There wasn't really an interview for my department (Science) you just had to have a high GPA  probably above 7.5 and someone gives you an email invitation to apply for the role  Next you're asked to input the hours you're free to work which roles you'd prefer to work (Lab demonstrator marker etc) and the papers you can teach.  That's about it although we were told that getting this invitation doesn't guarantee a role  it really depends on the demand of each paper. After that it was silence on their end until I got the job.,0.003120024,0.99665976,0.00022027417
The two head managers were extremely welcoming and friendly. We met in an interview room and talked about past experience that may be relevant to the role. We then proceeded to discuss the role itself and some of the common scenarios that pop up and how I would respond/react to these situations,0.00026726126,0.0026841543,0.99704856
Interview panel of 4 people.  Behavioural Questioning approach.  Each person on the panel had their list of questions to ask.  The interview was one hour long.  They wanted indepth answers but there was insufficient time for great depth considering the number of questions asked.,0.9985014,0.0013434523,0.00015513573
Interview was conducted by 2 people it lasted about 20 minutes long.  They asked pretty basic questions such as tell us something about yourself can you multitask and can you handle angry customers.,0.99648005,0.0033787985,0.00014109704
that is a quite easy interview. I applied online and wait two weeks to interview in person. ask me some technique questions and behavior questions. after another 1 week I got the offer. I think it was a quite efficient recruiting process.,0.0071315416,0.82790875,0.16495976
An online application was required. I waited several weeks and had assumed I was unsuccessful before being called for an interview.   The panel was teo people who were professional and friendly. A positive experience.,0.0022399884,0.022782577,0.9749774
At first I worked as an intern during my final semester at university. I was offered a paid position after completing the internship and expressing my interest in continuing the research. There was no formal interview process per se because my supervisor already knew how I worked and what I was capable of from the internship.,0.00052289513,0.99863714,0.0008400342
I apply the job of undergraduate teaching assistant and I directly went to see our undergraduate teaching tutor in his office. He just asked me how long i wanted for the job and my former experience in teaching undergraduates.,0.0007755577,0.99895823,0.0002661067
Panel interview psychometric testing group interview with team.   Unfortunately none of it was very well handled and they sent me an email meant for another candidate.  The meet the team interview was really awkward.,0.9986381,0.0012551628,0.00010678141
Online application based on minimum GPA of about 6. Previous tutoring experience is essential either at the University or outside of University. Applicants with higher grades generally favoured. Can apply for first or second semester generally civil/engsci students preferred first semester and software/electrical/chemmat preferred second semester due to papers taught each semester,0.00036133055,0.99907684,0.0005617522
The interview invite came in the form of email which was uncommon but it gave me the address and directions to the campus and that was helpful. The interview itself was brief about 25 minutes in total. I faced a panel of two (my managers) and they had a list of set questions they selected from.  The atmosphere was quite relaxed and most questions were basic. The managers also gave me a detailed description of the job and the work environment. The whole experience was quite pleasant.,0.0018910237,0.116505764,0.88160324
Phone interview. At discretion of line manager rather than hr. The usual strengths and weaknesses questions but more in line with experience. Phone interview proved difficult due to the time difference. Two interviewers both researchers rather than a hr representative.,0.9974033,0.0024797693,0.00011692339
One on one interview 30% technical questions 70% about my previous job,0.00052656716,0.9990503,0.00042313608
I was internally recruited into the roll from a previous sports roll within another division of the University. I was required to submit my CV to the new hiring director take part in an initial 45 minute interview as well as submit a proposed business plan for activities for the roll for the coming year,0.0018549268,0.99795437,0.00019069019
there were essentially no interviews required just that you have to be a student from the uni. Obviously your grades can't be too bad I suppose. I suppose you get to know most of the staff already by the time you are ready to do some tutoring.,0.00075196725,0.9984914,0.00075666734
For a software engineering tutor role there was no interview; they requested by email that interested applicants indicate which roles they were available for and tutors were selected seemingly solely on the basis of grades.,0.16757433,0.8320589,0.00036680797
The interview process is very structured to a point where they don't get to the core of who you are as a person. I think they should be more flexible and adjust questions accordingly.,0.99652404,0.0033116832,0.0001642915
The interview process was fairly straightforward. It was an inpersonface to face interview and we basically just went through my CV my motivations for the job and past work experience.,0.00044108828,0.99859756,0.00096139195
Very detailed and engaging lots of questions answered thoroughly and complete transparency. Comfortable and professional without being intimidating. Salary expectations confirmed and workload explained. Met other staff and was shown around the office.,0.00074101996,0.0014134297,0.99784553
The interview was straight forward. I interviewed with the hiring manager and their colleague the interview lasted about an hour. There were a mix of some behavioural and situational questions. All the questions are pretty standard I was not surprised by any questions.,0.0012115285,0.9935922,0.0051962044
Very relaxed a chilled out relatively quick interview with two friendly people. Asked fairly standard questions focused on getting to know you and your personality. Probably only lasted a maximum of 10 minutes.,0.0011180505,0.9678756,0.031006364
The interview consisted of situational questions on how to deal with 1styear students and engagement in tutorials. It was also to understand my personality to see if I fit the role.,0.00031252144,0.998971,0.0007165799
Informal interview that then led to a behavioural interview and then a final coffee catchup.  It was all as you would expect it to be and the hiring manager put you at ease. I'm guessing this varies from faculty to faculty/other departments.,0.000488331,0.99834037,0.0011712519
smooth and easy to discuss  with interviewer      smooth and easy to discuss with interview also the process of hiring was smooth.They have preset of questionarie for technical interview and were going through the list of pre defined question.,0.0028312071,0.2007614,0.79640734
I was asked several standard interview questions. I had an interview with the manager and main office coordinator. Overall it was a very relaxed interview which made it easy for me to give thoughtful answers to their questions. The casual environment and demeanor of the interviewers made me less stressed.,0.0037943064,0.8062471,0.18995857
The interview was for 1 hour and covered Behavioral and BA related questions mostly on reporting experience and the type of projects.  There were a panel of 3 people  a Director Manager and Business Analyst.,0.00023630951,0.9986518,0.0011119137
Just have to submit an application no real interview required. Also hiring based on academic grades. Not much to say about it really.  Also probably depends on department. Most departments require post grads to do tutoring engineering/computer science do allow people that aren't post grads to tutor.  Good luck,0.0006374345,0.99838173,0.0009808155
