Comment,Negative,Neutral,Positive
Applied online and was interviewed 7 months later overall the interview was good and not difficult . it was done online and there were 3 people on the panel. most of the questions were behavioral iterview questiosn,0.0008753281,0.97912747,0.019997194
I was coldcontacted/recruited for an interview for a contract position in a new department that was slated to last only two months after the date of the interview. Prior to the interview I had to sit a writing test and pen an indepth feature article where the specs weren't completely clear.,0.998334,0.0015353854,0.00013072389
Come primo step ho fatto l'applicazion sul loro sito ho letto molto mi sono informata usando il materiale che ho trovato quindi ho inviato curriculumlettera motivazionale e ho compilato la loro domanda online. Poi è iniziata la selezione vera e propria ho fatto una prova su Excel e Power point e una volta  superato questo step ho fatto due colloqui con Business cases.,0.0003027976,0.9968546,0.0028426691
The interview was made of a first written assessment on the topic of the internships followed by a phone interview with the hiring manager. After the second step I received an offer of internship.,0.000325043,0.9985002,0.0011747071
Now im in the process...first they sent me invitation that i was picked from great ammount of applications. Then i passed 2 hours written test in computer (60 questions) 1 opened question(situation and report about it). Now im waiting for other tasks.,0.0008392786,0.9982686,0.0008920861
I applied online through the WFP website. After 3 weeks I was asked to do an interview by zoom. I met with 4 people in the Panel. It was a challenging yet very interesting interview. They asked me about the application and some background history. They asked why I want to work for the WFP. I received an email one week after saying that although my interview was very good I didn't get the job because of the lack of experience in the UN system.,0.03892233,0.9589582,0.0021194555
Overall a pleasant experience. Great hiring manager. Very clear efficient and professional communication. A telephone interview took around half an hour interviewers called exactly on the arranged time and were friendly and polite throughout.,0.00073534745,0.0010629019,0.9982017
At first the ask you to do a task in 3 hours and half  at home and than they call you for an interview in their headquarter to ask you some questions,0.9760232,0.023742013,0.00023482181
The first stage was a 120 mins written test which had 4 questions. The second and final stage was a 45 min video interview with a panel of 4 WFP personnel.,0.00047865944,0.9987196,0.00080190494
The invitation to Interview was an email that had been forwarded which I felt could have been avoided to make it feel more personal. I had two interviews pretty normal competency based questions around teamwork and leadership skills. I applied for the position in December  first Interview was in April and the next one in May so a rather lengthy process! After 3 weeks I asked for feedback and was advised they would get back to me after 2 more weeks. I asked one more time after that and I have still not heard anything back from them. I will leave it at that. I understand that there are a lot of candidates for these positions but I still think they should have the courtesy to inform you if you weren't successful after your interviews or just update the online status... I am left feeling rather disappointed.,0.9911349,0.008649788,0.0002153089
Colloquio di persona presso la loro sede. Durata complessiva circa 1 ora. Domande sull'esperienza lavorativa sulle motivazioni. Spiegazione complete del ruolo e delle responsabilità. Presente il responsabile IT e HR,0.0005066546,0.9840072,0.0154862385
I applied online. Got a call from rome headquarters to confirm about my availability after 2 days. After a week  got an email for a skype interview. Two people from the department that would assign the interview took interview for about 25 mins. They introduced themselves and also about the job and responsibilities of the intern.,0.00061068684,0.99901474,0.0003745296
I submitted an application and had to also include a sample of a report I wrote. I was then called for a panel interview with senior managers and HR. The questions were quite technical and based on a series of experience I had in the past related to the job description.,0.91643393,0.08335629,0.00020979601
Envoi d'une candidature en ligne (CV et lettre de motivation) puis prise de contact par email pour un entretien téléphonique. Entretien d'environ 30 minute avec deux personnes. Due diligence  compétences personnelles et profil.,0.0007428357,0.99342245,0.0058346563
Sono stato chiamato per un colloquio di tirocinio. Sono stato invitato all'edificio del WFP a Roma. Sono stati molto professionali e  molto puntuali. Ho ricevuto una risposta negativa. Ma penso che sia ancora importante. Alcune organizzazioni non danno mai una risposta se è negativa.,0.0007358707,0.99801683,0.0012472824
There was a written test that was to be completed in two days plus one phone interview with two panel members. The questions were mostly competency based and the written test focussed on technical skills,0.00040270863,0.999137,0.00046034603
"After 34 weeks from the online application I received a written test (24h to submit it) where I had to prepare an article for the intranet and a graphics. After other 23  weeks I was invited for a panel interview (via Skype) which was competency based. After other 23 weeks I was invited for a second ""meettheteam"" interview again via Skype.",0.00071721553,0.9982821,0.001000674
I passed the Computer Skills Tests and the English Proficiency Tests at FAO and the person who chose me was in need of someone who had passes the tests to make sure she could receive the help she needed,0.00044039031,0.9989008,0.00065890735
Meeting with 3 interviewers. Normal interview questions with nothing unexpected really. They did ask what I knew about WFP so be able to eloquently talk about what WFP does and why your interest in this specific UN branch.,0.00029393507,0.99881434,0.0008916608
I submitted my application in April 2012. I was contacted in August 2012 with an email inquiring whether I was still available and interested. The interview was scheduled one month later. I received a reply within one week.,0.00042105853,0.9989741,0.0006048348
Very quick process. I applied online the next day I was called for a phone interview and 3 days later I got the job. It was a very positive experience.,0.00054731744,0.01033431,0.98911834
The interview consisted in two steps. The first was a written text (1 hour long) and was divided in 2 parts: in the first part was asked to draft a contribution agreement between WFP and a State the second part concerned a legal advice regarding a WFP officer,0.00048516382,0.99900997,0.0005048356
I was interviewed personally at WFP Headquarters. The interview lasted 1 and a half hours and I was told I would get a reply within the next few days. Not only did I never hear from them again but when I wrote an email asking about the results of the selection process nobody cared to answer. Complete lack of respect and consideration from Human Resources they were very unprofessional. Not at all what you would expect from a humanitarian agency of its calibre.,0.99901783,0.0008308813,0.00015127071
The interview was a skype one The interview was divided into two parts:  in the first one general questions have been asked  in the second one case study (you are a WFP member you have to decide how much food and how much people send to Cairo Region you cannot use a calculator) the interviewer was nice,0.0006040428,0.9983217,0.0010742318
The interview was great I was interviewed by three consultants and the second interview was the Head of Office. Questions were not hard and it was a pleasant experience. I was asked questions by all three consultants about what I would do in certain situations and what are my goals.,0.0013278446,0.03320601,0.96546614
Lots of mail and two Skype interviews with a very fast process. All of this process was unproductive due to their strict guidelines regarding interns and to the lack of attention of the recruiters (no appropriate interviews with a brief and rude mail to explain the negative feedback): it looked like they needed an intern (maybe for the summer) but they're looking for a perfect candidate.,0.99871004,0.0011251448,0.00016475038
"I applied online in November and was called for a phone interview in December after which I was asked to write a report summarizing the  interview I had. A few weeks latter I was invited for a technical text which was sent to me via email and I had to submit my response within 24 hours. This was the most intensive UN (technical) text I have ever written (I have written more than 10 of them for other UN organization). Basically I was given a report based on which I had to prepare my audit plan. I was then invited to Rome for a Face to Face interview after which I was supervised to write a 2 hour management test mainly to test my soft skills and how I am able to prioritize my work in the real work environment. After this I had the opportunity to be interviewed by the Inspector General. 8 of us made it to this stage.  A few weeks latter they came back to me saying the position has been offered to a more senior candidate. However because they were very impressed with my performance through the whole process they would offer me a lower level position (which was one level lower than what I had applied for) if I would accept it and depending on my performance on the job I will be considered for that higher level post if any became vacant in future. well I was very disappointed but it sounded like a very good opportunity for advancement in my career and it was in the field I had longed to get back to so I accepted. Additionally they had given me a very good impression of WFP throughout the whole process so .... it sounded like an organization I would love to be a part of. Finally and lastly I was invited for a French test since I had listed French as my second language. My phone number was given to a testing company to call me and their number was also given to me. Because I had already read on this site about someone's experience where he was called an hour latter than I agreed I decided to call the  testing company myself when they were 10 minutes late. It was an oral and listening test to determine my level in French. The evaluator was speaking at normal speed so it was not very fast. some of the questions asked were: tell me about yourself what will you do this weekend where do you normally go when you want to be alone where would you like to go on pension describe how to make tea how will you describe the global economy to someone what will you say to a friend who invited you to a party but you would not be able to attend because of other commitments etc. In all I think they asked about 20 questions but I am not very sure and it took exactly 30 minutes to complete the test. I googled how to prepare for a language test and I found many helpful sites. One of the most helpful websites had an article called ""How to prepare for a foreign language oral or speaking exam and succeed and do well"". All the tips given here were very helpful. There was also another site with an article called ""How to prepare for your foreign language oral exam"". Soon after writing the exam I received the intent of offer email with some forms to sign.  I have not received the contract yet but hopefully I will receive it soon and I am enthusiastic about the contributions I can make to the audit team.",0.22235729,0.7763231,0.0013196276
Was asked to do a written test one month after I applied. I passed the test and was asked to do a phone interview with a panel one week later. Then was offered the position one week later.,0.00073902315,0.9982967,0.00096430234
The atmosphere was nice. I applied online and I've been called after one month. The phone interview had a duration or 40 minutes more or less and it was a panel interview.,0.00056727795,0.9928082,0.00662449
Years after I had applied I finally received an email where they wanted to schedule a 30 minutes interview which would be followed by a written segment.  I found useful info on how to prepare for the interview on the UN website.  The written segment was an analysis/critique of two of the three main funding systems of WFP,0.0006119153,0.055844314,0.9435438
1) Online CV and a few questions to be filled 2) A phone interview from the head of the team in which I was supposed to talk about my motivation for the job and answer how I would write the report if I were assigned to study a company/donor. 3) Last stage is a written test that can be done remotely but has to be sent within the designated time interval in which I was given a company profile and had to find the relevant information regarding any misconduct/lawsuits of the company and to write a short report.,0.9942694,0.0055846586,0.0001458848
Applied online and got an email that I would have a phone interview in a month (and this was already a month after I'd applied).  After interview I heard back within a few weeks.  The whole process took about 3 months. They looked at my college classes to make sure that I was properly prepared for this type of interview.  Before the interview I was given a take home assignment to complete that would be discussed in addition to the interview.  The assignment was a little confusing but I managed to complete it almost entirely correctly and they were impressed that I was able to figure it out.  During the interview they asked about my past experience and I if I already knew about the computer programs that would be used during the internship.  Overall they were very nice and the interview was pretty straight forward.,0.0025262702,0.9965054,0.0009684151
I applied online and the process took 2 months. Upload my CV on the website and after couple of months I got an email and we set a phone interview. I had to present myself demonstrate how my experience and knowledge match the duties and also explain why I had applied to that position and company.,0.94002634,0.059708674,0.00026505822
In my case the process involved an HR officer and a supervisor and took one hour facetoface.The people were nice and approachable and the situation was more like a conversation. They did use a competency based approach whereby you had to talk through situations your ways of dealing with them and the results.,0.001983617,0.9607021,0.037314303
Upload my CV on the website and after a few day I've been called. The interview was average behavioral  questions and the atmosphere was peasant. At the end of the interview they asked me if I wanted to join the organization,0.99808717,0.0017911944,0.000121704004
I applied online for an advertised vacancy. They were quite quick at advising me of reaching the shortlist which is unusual for the UN. Most of the HR processes were surprisingly quick.  First I had to do a language test in a WFP official language other than English. Or you have to provide evidence of some kind of certification of your language level. I had no such certification so I signed up for a test.   Little information about the test was provided beforehand. Basically though an external firm was given my phone number and a time to call which had been agreed with me.  They called almost an hour late however. The test was conducted purely over the phone so it could only focus on listening and speaking ability  the former particularly not being a strong point for me. The tester would ask a question and you would respond to it. Many of the questions were hypothetical (what would you do if you were outside and it started raining and you had no umbrella? how would you describe the sea to someone who was blind?) and others practical (what will you be doing in 10 years? what did you do on the weekend?). The idea is to make you use various pieces of grammar (conditional future etc) and also to test if you understand the questions. The language test lasted probably around 20 minutes.  I struggled a fair bit but the level required obviously depends on the job and the job I was going for probably did not require a high level. I am at about B1 level in this language and managed to get to the interview stage.  I then was invited to interview in person in Rome at their HQ with the option of a phone interview instead if I preferred. I went to Rome. I organised the transport and hotel myself but I was later reimbursed (keep your receipts!).  There were 3 people in the interview  pretty standard in the UN system. The interview started 510 minutes late although one of the panel members turned up only after another 10 minutes or so.  I got the impression that the panel members were not serious and that this was not an open recruitment exercise. Two of them constantly checked their Blackberries during the interview with one even writing up an email (presumably) during it. This is annoying enough in a meeting but during an interview it was insulting and lacking in professionalism.  The rest of it went OK taking about 4550 minutes consisting of Q&A from both sides. There were no especially tricky questions but I got the clear impression there was a hole in my CV that meant I would not get the job. I assume that HR must have done the shortlisting rather than panel members.  My overall impression was poor due to the Blackberry checking. I was left with a sour taste in my mouth regarding the organisation.  As a final sign of this the position was then readvertised on the internet without the organisation even having sent me any feedback on my interview. I guess that acts as the rejection email in their eyes!,0.9977125,0.0021325066,0.00015496495
