Comment,Negative,Neutral,Positive
Assessment divided in two parts: functional and general you must submit a questionnaire then complete the task and assessment eventually there is going to be a election day in which all the committee will vote for your election and upgrade,0.0027551854,0.9969842,0.00026059986
It's really easy you have to send the application then there's the interview in which you state your program for the following semester. In the end there's an election inside the committee to choose between the various applicants,0.0060320767,0.99256766,0.0014002398
It was a 3 steps interview. Very interesting and with challenging problem solving quiz.  It was mainly based on knowing my technical and interpersonal skills . My job interview was about the It job position and having an engineering background helped me quite a lot for overtaking the quiz.,0.00084514613,0.014038496,0.9851164
Mi è stato chiesto di esporre le mie motivazioni personali e professionali nel candidarmi nell'esperienza raccontando esperienze di leadership e i valori in linea con il programma. Inoltre mi è stato chiesto cosa potessi aggiungere io come valore aggiunto per il progetto.,0.0006817807,0.9972909,0.0020272946
Some questions related to yourself future goals who is your mentor your skills past experiences everything is informal and very easy. Just be yourself and try to explain why you would like to join AIESEC.,0.00039536192,0.9985121,0.0010925551
The interview was very good managed and it wasn't difficult. It happened on Skype and they told me their answer just 4 days after the interview! And of course I've been selected,0.004909379,0.22990006,0.76519054
Case study email sample writing English speaking interview simulation of situations review of the cv experiences at university.  Area of preference level of English knowledge of a second language level of knowledge of the company and the core values the different areas,0.00028590416,0.9988972,0.0008168864
Very easy  general questions They asked me questions in order to get to know me better. Their aim was to understand my international perspective and my skills to be involved in the organization,0.0005739678,0.9864956,0.0129304025
Informal interview purely motivational. After completing the interview it may take a while for them to answer back as they usually have only 2 recruiting sessions per year. When the session does come you will be asked to participate in a weekend of induction and then you can start working as an effective team member.,0.0015030191,0.9978951,0.00060180714
Aiesec people are friendly so the interview process is very relaxed. They ask you very easy question about your skills and expectation for your future insiede the organization. My interviewer was very kind and she answered me to all the questions I made about them. no stess. I got a feedback immediatly the same night of the interview. I raccomand to apply for some position in aiesec because the atmosphere is very young and friendly.,0.0038144072,0.34288234,0.65330327
test taken in person in 2019 in the early session. Possibility to take it up to 3 times and then if you don't enter you are done. once you enter everything is smooth,0.0004061997,0.9982768,0.0013169759
Ho sostenuto un colloquio a inizio Ottobre e mi hanno detto che mi avrebbero fatto sapere la settimana seguente. Ho scoperto oggi dopo un mese e diverse mail di follow up che non sono stato preso.,0.00058381195,0.9975157,0.0019004504
Domande sulle proprie esperienze precedenti (università triennale e se presente magistrale e contemporanee/successive esperienze lavorative di stage progetti scambi o corsi di certificazione se presenti sono un plus) quali sono le proprie aspirazioni professionali e quindi il perché della tua scelta.,0.00045609206,0.99635786,0.0031860073
la ammissione per il corso di laurea triennale presso la università bocconi consiste in una prova scritta composta da domande di logica e matematica e comprensione del testo e inglese,0.0004451748,0.99517787,0.0043770242
domande conoscitive per stage in ricerca solo approfondimento personale non quantitativo/numerico. Professore metteva a proprio agio e il colloquio è durato una 15 di minuti. Fattibile sia per studenti triennale che magistrale,0.0008592369,0.9901771,0.008963659
Video Interview dove si chiedevano alcune domande al riguardo della motivazione per entrare al programma magistrale e si faceva riferimento alle esperienze trascorse che potessero essere in linea con il tipo di programma che si andava a svolgere,0.0004897777,0.99717855,0.0023317204
Onestep interview process for research intern position. Mainly a cultural and motivation interview the technical part was only about how much confident with excel and general statistical concepts I was. Got the offer 2 days after via email.,0.00032834077,0.9986848,0.0009868647
Colloquio in persona presso l'università Bocconi con diverse domande motivazionali ad esempio descrivi te stesso e i tuoi pregi e i tuoi difetti. Dopo circa una settimana ho ricevuto l'offerta di lavoro via mail.,0.00049106614,0.9964616,0.0030473392
face to face interview with Professor in charge of the Research Centre.  Mostly behavioural questions but also some techical ones.  Data analysis skills is stongly recommended. Showing a good academic track record is important.,0.0053646965,0.9796616,0.014973698
motivation letter cv reference letter bachelor degree english certificate 7 minute presentation video written test/gmat. We had to fill an application online and then go to the university in milan to do the bocconi test. they said someone could have been called for a personal interview. the day of the test we also had to do a english test it was not planned but it was easy,0.0014994222,0.9977658,0.0007347803
I was before contacted at the phone for a first interview. Then I had an interview face to face with the hr  the week after and finally the last interview with the hr and the manager.,0.00037998272,0.9990301,0.00058987783
why are you intersted to work for us? how you can contribute for our organization ? how could you do the best for us? why have you choosen the bocconi than other universities ? why should we hire you than others? are you sure that the bocconi universities is the best choice for your career? please oculd my explain me the why?,0.9678698,0.031822268,0.00030798372
molto disponibile il datore di lavoro che mi ha messo subito a mio agio e mi ha consentito di esprimermi nel migliore dei dei modi non avrei potuto sperare in un'esperienza migliore,0.00061619276,0.9975823,0.0018014344
facile non mi hanno chiesto nulla ed esaminavano le candidature solamente con la media degli esami. veramente molto easy consiglio a tutti di farla. pagano bene ed è tutto già tassato dall' università,0.00050094514,0.9966804,0.0028187514
Colloquio conoscitivo colloquio tecnico di una short list e final interview con responsabile.  Tutto il processo svolto a distanza tranne la final interview che invece è svolta direttamente in sede.,0.00049771526,0.9960407,0.003461588
Il colloquio si è svolto online con due membri della faculty. La parte iniziale è stata svolta in italiano poi si è passati all'inglese. È stato un colloquio prettamente motivazionale; non sono infatti state fatte domande contenutistiche.,0.0005431696,0.9969381,0.0025187365
Caricare form con domanda di ammissione shl online e colloquio motivazionale  Dove trovo trenta parole io mica lo so. Mi hanno chiesto ste cose e basta in che senso devo essere più dettagliata?! Mollami,0.00031276423,0.99798006,0.001707243
long and with no details the interviewers didn't used the camera during the process. It was quite difficult to understand what they were looking for. Too many interviews and no explanations,0.998713,0.0011590882,0.00012788859
Stimolante trasparente e competitivo. Un grado di selezione molto alta per la ricerca del candidato più idoneo. Circa cinque candidati e commissione eterogenea. Preparazione al colloquio per titoli e per valutazione originalità e coerenza del progetto.,0.00053649844,0.9926165,0.0068470547
I applied for the role after one/two days I received an email for a Skype interview. In the mail there was written the day to meet and also that the interview woul be held in group and not one to one.,0.75314337,0.24653883,0.00031784023
Very indepth. The first half was focused on getting to know me with a specific interest in my longterm goals.  The second was a livetest of my competences in problemsolving interpreting the law and general IT,0.00031311435,0.99893624,0.00075071555
They called me by telephone to decide an appointment.  I then had just a face to face interview with the collaborator of the coordinator and the screening of my cv plus some questions on my background,0.0041961297,0.99565554,0.00014837527
Selezione per titoli e colloquio sulla crescita e aspirazioni. Doppia selezione ma devo dire semplice e veloce.  I selezionatori mettevano ad agio  Non saprei altro  Molto semplice ed intuitivo per tutti,0.0004401397,0.9978642,0.0016957534
Dopo aver presentato la domanda (con CV proposta di ricerca ecc) sono stata selezionata per il colloquio presso la Luiss che si è tenuto circa 3 mesi dopo la presentazione della candidatura.,0.0003572525,0.998231,0.0014118027
My personal skills and career objectives were the core of the interview questions. they asked me what i would have expected from the job and how I thought I would have contributed. I presented myself and the skills I developed. The screen lasted 3 months before I got an answer. the application required my cv and motivation letter.,0.017213285,0.9825936,0.0001931242
Grande colloquio in cui sono stato molto apprezzato. Personale qualificato esperto e competente. Consiglio a tutti di provare a fare application presso il polito. Torino bella città e offre moltissime opportunità,0.0017520366,0.425997,0.572251
Si tratta di un concorso pubblico con valutazione titoli ed esame orale riguardante le tematiche dell'assegno con bandi all'interno del sito universitario. La laurea è requisito per partecipare al concorso,0.00065200136,0.9960108,0.0033372268
Smooth and short interview procedure. They give a 15 mins for the interview and ask some general questions. Also they ask a couple of technical questions regarding the project which the candidate will work on.,0.00471965,0.9636179,0.031662453
Richiesta conoscenza generale degli argomenti della borsa nonché dimostrazione di motivazione. È richiesta una descrizione dettagliata della tesi magistrale. Il punteggio di ammissione dipende anche da pubblicazioni voto di laurea.,0.00046229054,0.9961047,0.003433002
Conoscitivo giusto qualche domanda perché ero un ex studente. Ad esempio: perché vorresti continuare a fare ricerca? Cosa ti piace di questo gruppo? Sei una persona capace di lavorare in team? Ti piacciono o ti affascinano le sfide? Come ti vedi fra 5 anni? Perché non hai optato per un percorso in azienda?,0.0004766116,0.998458,0.0010653768
Plenty of interesting projects there but the internships are not paid. It's better for dedicated students who want to pursue a PhD. Very good professors and good advancement for science,0.0009143484,0.003607803,0.99547786
Domande generiche riguardo agli studi e sui principali argomenti della chimica organica e inorganica. Particolare attenzione per esperienze di laboratorio pregresse conoscenza della strumentazione e delle principali misure di sicurezza.,0.000515094,0.9935163,0.0059686117
I set on a chair and they ask me what i was doing there so i declined the offer that they made but i was not so confidente about myself so i came back to ask again tho get a new offer and they said no again,0.06701388,0.9327372,0.00024896362
Ho dovuto far trasparire la mia passione e le mie conoscenze nell’ambito del progetto di cui poi mi sarei andato ad occupare. Sono state valutate principalmente la motivazione e le esperienze pratiche apprese nel mio passato,0.0005499844,0.99568945,0.003760485
Chiamata tramite zoom mi ha chiesto un po' di me e per quale motivo volessi fare la tesi e per quale motivo il professore avrebbe dovuto scegliere me come tesista,0.00043214412,0.9975063,0.0020616304
It was good although language was a problem . Since I was a student in this university it wasn’t something too difficult for me they definitely prefer hiring from students,0.0011421216,0.9970521,0.0018058007
Graduatorie svolta in base ad esami svolti in precedenza conoscenza della lingua inglese gradita obbligatoria disponibilità di svolgere il numero di ore stabilito. Assegnazione mediante conferenza con piattaforma zoom. Ambiente rilassato,0.00034500955,0.9950795,0.004575465
The interview is held by three Professors of the department you applied for. The interview consists in a short presentation about your plan for your past studies the reasons why you want to get a PhD and how you plan your research activity.,0.00031564338,0.99903655,0.0006478502
The hiring process was very fast. The first interview was inside the university with some professors who asked me about my future intentions passions and technical questions related to my PhD experience.,0.0053327857,0.8042236,0.19044356
i test d'ingresso comprendono domande di matematicafisica e comprensione verbale. I test possono sostenersi più volte durante l'anno fino a settembre. La difficoltà dei test è sempre la stessa. Si supera il test se raggiungi almeno il 50% di risposte corrette,0.000520219,0.9978161,0.0016637817
The process consists in two phases the first one is an online procedure where you are requested to submit your full CV (in a provided format) and select 10 to 15 publications (the number varies according to the sector) that will be evaluated. After that the candidates have to undergo an interview where they explain the reserach field the originality and innovativity of their findings the plan for future research activities. Also an important plus is past teaching experience and project management.,0.0010217895,0.9775808,0.021397458
You are scheduled to have an interview with many other students. So you might have to wait before others finish up their interview. The interview is in general taken in two languages at least. English and Italian. They check your fluency with those languages and ask you to tell them if you speak any other languages.,0.19009824,0.8095449,0.00035690053
It was only a selection based upon grades and university CFU. It was supported by EDISU Piemonte. At the end of the process a chart was compiled and published online,0.0002905208,0.9961229,0.0035864678
The secretary staff checked out the past course work performance and research experiences for screening purpose. Then the department arranged some meeting with professors talking about various research topics and possible funding sources.,0.00039970793,0.99896884,0.00063157064
After my MSc I applied online for a funded PhD position in the department of mechanical engineering at Politecnico di Torino. About 3 months later I was shortlisted for an interview. The panel mostly wanted to know about my academic record and also discuss the motivational statement that I submitted online during the application process. Just know your stuff and why you want to carry out research and you should be fine.,0.0007118663,0.99896884,0.0003193092
You can answer to a public call by submitting your cv and other documents through an online form. Then if you get selected you are invited to attend an interview face to face if you are in Turin or Skype if you are foreigner.,0.0002853628,0.9982217,0.001492989
Hiring Process: Public call Interview Public Ranking  Interview: Background Technical questions,0.0003252754,0.9987759,0.0008988168
Based on your experience and graduate scores and nothing else. If you are oriented to research and you want to work in an specific project they are working on you will be hired,0.00070765126,0.9987105,0.000581855
We submit for open positions and then they choose the one to interview. It can be a Skype interview or personal basing on availability. Then the remaining process is done by the secretary for preparing the nulla osta which is considered as the work permit.,0.0005422323,0.99879754,0.00066025637
Interview are competency based. The questions include a question to introduce yourself your skills and how your experience contributes to the job. Then a set of 3 4 competency questions related to the skills required for the position.,0.00050120073,0.998755,0.00074379705
Competency based interview with request to illustrate specific examples of projects I recommend using the STAR model to answer  specific examples are expected. Explain your role and responsibilities and how you solved specific challenges,0.0005620003,0.99872583,0.000712159
The interview went well but they never got back to me to tell me I didn't get the job or to give me any feedback. This caused me a lot of stress and they never replied to my emails.,0.99792373,0.001918308,0.00015796591
Colloquio troppo complesso per il livello di posizione (stage) inoltre le persone che hanno fatto il colloquio non volevano rispondere alle mie domande riguardo la posizione. Li ho trovati scortesi nel complesso.,0.0007145156,0.9973573,0.0019280775
Very good process with constat updates and feedback provided after the interview. The whole process took around 4 months from an initial screening through a written test until a final oral interview conducted via zoom.,0.000671936,0.001152734,0.9981754
The process was okay but required me to do so much work. They got back on time to tell about my interview outcome. I feel like it is unfair to give someone that amount of work only to decline them a position.,0.9925795,0.0072344793,0.00018604298
I had a 1 hour interview with 3 employees. The interview was full in English but unfortunately they didn't give me a feedback. The interview was the classics questions and answer the job interview with examples using the star method.,0.9918281,0.008051912,0.000119951685
The interview was structured as a comprehensive panel session comprising of four to five competencybased questions a format that aligns with the standard practice observed in interviews conducted by the World Food Programme (WFP),0.0006092916,0.065102175,0.93428856
It took around 1 month for them to contact me through my personal email. The interview was over zoom. They asked specific and general questions. Around 12 weeks later I was sent an offer.,0.003958134,0.9958126,0.00022919496
apply online the got a Phone interview with the hiring manager to discuss the job and the requirement for the job process is one month and you have to fill up a online cv,0.9940196,0.0058330996,0.00014728981
They contacted me for an interview after 4 months and I was told what I was being interviewed for (there were several positions within the division) at that moment. It was a panel interview which felt like an interrogation. I did not get a positive response but it took them another month or more to tell me that through an automatic decline message.,0.9974445,0.0024290173,0.00012656502
This was the best interview I have ever done! The individuals on the panel made me feel so welcomed and valid they gave me credits for my answers and seemed genuinely interested to listen to me. In total it took 30 minutes.,0.0002944472,0.00039557123,0.99931
Basic questions about skills experiences and the Organization itself. The interview lasted about 20 minutes. No feedback and very unprofessional communication have not heard back even after asking for an update.,0.9990212,0.00083751336,0.00014140319
Processo di colloquio ben strutturato. Unico colloquio gestito con metodologia STAR. Giusto mix tra tecnico e skills organizzative e sociali. Condotto alla perfezione. Uno dei migliori colloqui a cui abbia mai partecipato.,0.0003889844,0.987631,0.011979998
"Incredibly slow process as it's usually the case with prestigious institutions such as the UN etc. Totally nonpersonal email where I was invited to complete a written task. After nearly one month past completion I discovered by myself on the career portal that my recruiting process was over. One week later the person I was ""in touch"" with sent me a formal rejection email. Really demotivating. There was no interview but the writing text wasn't easy  which is understandable for this kind of institution.",0.9986778,0.001176059,0.00014608944
I applied for a junior consultancy position in midNovember. At the end of December I had an assesment in which I had to record myself answering several questions. At the beginning of January I was contacted for an interview a week later. At the interview I was told that I would hear about the process in two weeks but a month has passed and I still haven't heard anything. I am very interested in the position I have sent an email to follow up but I have not received a reply. I have read in several blogs that the process can take quite a long time but as I was told it would take two weeks to receive news I understand that it is because I have not been selected. Has anyone had a similar experience?,0.9951407,0.0047561172,0.00010316569
First i send my CV motivational letter and other documents. One month later i received an email to make a PP presentation. The first interview was one week later with the HR team and the last interview with the Head Officer.,0.0008668959,0.99853325,0.0005998585
Good rapport with competency based questions. There were 3 panelists with the hiring manager. They seemed impressed. I was contacted by the team assistant and my profile on the recruitment platform changed to “congratulations you passed to the interview stage”. I wrote a test a week before being invited for interview.,0.00095718005,0.024287736,0.9747551
I was invited to a Teamsinterview with the Head of the unit and two other communications specialists. It took 30 minutes and I got 4 technical questions all about my competence and experience. The people were very nice and friendly.,0.0011273002,0.033957686,0.964915
The interview was simple. I applied for a FIT Pool position and was offered an interview after 4 months of applying and after an online assessment. The interview questions were behavioral questions simply asking to define myself my past experiences and why I am motivated to apply for this position. I was also asked about my strengths and weaknesses and what I would have done to avoid a conflict situation with my colleagues.,0.00067740545,0.99899596,0.0003266871
1) Send CV and cover letter via the online platform 2) written assessment based on technical knowledge necessary for the role 3) panel interview with potential colleagues and a representative from the admin / HR department.,0.0014807393,0.9972422,0.0012770038
A 30 to 40 minute telephone interview which surprisingly mostly  focused on competencies as opposed to technical questions and previous experience. Also  brief CV overview.  At the end of the interview there is a possibility to ask questions which is what I believe can make a difference. It is a chance to show that you know what you are applying for and what to expect. At this point it should also be mentioned that the selection process is very competitive approximately 800 applicants for one position. So what will really get you the job is your initial application.,0.038712822,0.9558914,0.005395761
I was interviewed after presenting a design assignment by the current visual designer whom I’d be working with if hired. Questions made were very much design oriented. Didn’t passed on to next step due to the results of my assignment. Each step takes a fairly long time to obtain feedback from.,0.9981993,0.0016747821,0.00012603807
The interview process consisted of a written technical examination and upon passing a panel interview via Skype. Questions centered on past relevent experience competencies and overall fit within the team.,0.00023619636,0.9986249,0.0011389301
The recruitment process included a written assessment a language test and two rounds of interviews (a video interview through HireVue and a live panel interview with three Partnership Officers and a member from HR),0.0003598411,0.9987565,0.0008836432
It has represented a long process. They send you the Written test to do in a proctored environment and then oral interview after different months from application. It could last less.,0.99847883,0.0013831161,0.0001380813
Ho mandato la candidatura online. Dopodiché ho sostenuto due prove scritte: una attitudinale in cui mi hanno fatto domande in stile colloquio e una tecnica con 3 problemi. I tre problemi erano: scrivere un negotiation brief analizzare dei dati su Excel e creare un powerpoint per una campagna di raccolta fondi. Infine sono stato invitato al colloquio.,0.0006495845,0.997837,0.0015133922
Dopo aver effettuato l’application online sul sito sono stato contattato e ho sostenuto un colloquio conoscitivo e tecnico con i responsabili della funzione ricercata per la posizione in questione,0.00042444246,0.9981041,0.001471503
Compilazione form World Food Programme con inserimento dati personali ed invio di Curriculum Vitae e Lettera di presentazione; la compilazione è molto complessa e richiede un notevole impegno di tempo,0.00038220346,0.9968453,0.002772492
The Interview consisted of five to six competency based questions involving past experiences strengths and weaknesses. After the technical assessment there is a video interview assessment then the final interview. Questions such as my motivation technical skills were not fully focused on as much as the competency aspects.,0.9649717,0.03486919,0.00015911134
Technical written test of two hours with specific questions on the region  followed by panel interview of 45 minutes. Overall it was a pleasant experience and the impression was that even those candidates that did well but were not selected would have been considered for other positions.,0.0028198436,0.91454476,0.08263535
