Comment,Negative,Neutral,Positive
Poor pay and limited growth opportunities,0.9992143,0.0006238934,0.00016178713
Inspiring leadership team great cause positive working environment,0.00017219738,0.00017204635,0.9996557
Lack of clear career path,0.9990645,0.00079541985,0.00014011536
Amazing environment generous and fun people,0.0001898354,0.00019161719,0.99961853
There are no cons working for/volunteering with Starlight,0.9986331,0.001233156,0.00013367341
Vibrant  Fast paced  Lovely team mates,0.00015421196,0.00024725508,0.99959856
Tough on your mental health,0.9986507,0.0011990237,0.00015018367
 Excellent training  Great employer/employee relationship  Consistently updating your skills  Usually working within a great team of people,0.00030443544,0.0002447498,0.99945086
 Job can be very mentally and physically demanding.,0.9990113,0.0008263392,0.00016229367
Starlight's culture is so supportive and positive  it's like nowhere else I've worked.  Everyone is encouraged to work to their strengths and to grow them so that you really do end up doing great work and the L&D opportunities are excellent. Everyone is completely aligned to our mission: we go to work every day because we want to make sick kids happy  there are different teams / divisions but everyone is on the same side .  Also I love that I can work flexibly it really makes a big difference to my life.,0.0003402824,0.0006060046,0.99905366
With no govt funding we rely on the donated dollar  so you just do not see cash being splashed around like in a corporate environment.,0.9989229,0.0009058052,0.00017123316
Starlight Children's Foundation is one of the best places I've ever worked at. They have such a friendly welcoming environment. You arrive and leave work with a smile on your face. Would highly recommend to anyone wanting to even volunteer.,0.00025280175,0.0002614736,0.99948573
The hiring process was a bit long and there are a lot of training modules to go through but it is all for the benefit and safety of the kids and their program.,0.9945485,0.0051809847,0.00027053664
> Powerful purpose  brightening the lives of seriously ill kids & their families. Every day has meaning. > Focus on digital engagement innovation agility and growth > Fast paced > Collaborative environment > Inspiring leadership > NFP tax benefits,0.00034504273,0.0004532678,0.9992017
> The push for growth is exciting but not easy!,0.75058377,0.24261035,0.006805966
Positive culture friendly professional and lovely people,0.00015873848,0.0001783513,0.9996629
There weren’t any notable downsides during my time at Starlight,0.000439685,0.9970234,0.0025369357
Efficient well paced and good staff.,0.00055995275,0.00069396547,0.99874604
Not very organised in performing tasks,0.99890244,0.0009583639,0.0001391579
Collaborative team tight knit friendly,0.00014613285,0.00036957118,0.9994843
No cons on working only thing would be limited surfing season,0.00031873488,0.99904245,0.00063884066
Exciting work feel good campaigns,0.00024477454,0.00029466825,0.9994605
Not the best culture and access to professional development,0.9990959,0.0007300481,0.00017403961
Good location company vehicle relaxed environment,0.00022568415,0.00024572542,0.99952865
Low pay not much opportunity to progress,0.9991636,0.00068991544,0.00014654628
Great to work in a place that gives back to the community.  Ability to salary sacrifice as working for charity.,0.00033347597,0.00024843754,0.99941814
Lack of communication and transparency from senior leadership.,0.9991009,0.00074482564,0.00015423501
Great location to work at (Bondi),0.00015592806,0.000194591,0.9996495
Internal politics between state and national and cultural issues created a challenging environment,0.998268,0.0016086539,0.00012331878
Flexible shifts Excellent location  Great coworkers,0.000210341,0.00019103663,0.9995987
Some longer travel required Unpredictable work locations  Shift based on weather,0.99864835,0.0011955692,0.00015607302
Bondi office location looking at the beach,0.0004026519,0.086466104,0.91313124
Old rigid operations governed by old white men,0.99606967,0.0037891835,0.00014113462
You engage with the community. Learn valuable skills. Save people lives.,0.00043384248,0.00076390785,0.9988022
You need to volunteer a bit of your time in exchange of having a tremendous experience with incredible people,0.018310815,0.43905076,0.5426384
Great job at the beach while at uni,0.00027013218,0.00041118928,0.9993187
Only 3hr shifts per day unless your really lucky,0.08836217,0.768376,0.1432619
Great cause to work for.,0.000479558,0.0004486997,0.9990717
Lack of strategy from the top down,0.9990583,0.0008045389,0.00013721288
fun and loving caring team,0.00015942618,0.00024344555,0.99959713
nothing bad about this company good to work with,0.0167713,0.1081058,0.8751229
Great personity and great skills also,0.00060271536,0.001687387,0.9977099
Didn't have any and is great person,0.00071988127,0.99773115,0.0015489034
Great culture diversity inclusion flexible,0.00031694854,0.0005172031,0.9991659
No cons I have a great team,0.0028853684,0.9852657,0.011848957
Management was great.They have birthday leav e too . work life balance was good.,0.0037561485,0.2829451,0.71329874
It was really hard to get a raise. Employee retention wasnt good.,0.9991404,0.0007123529,0.00014720851
Nonprofit with salary packaging. Relatively laidback depending on your manager.,0.8515372,0.10023613,0.048226617
Employment services provider so a little morally corrupt,0.99829143,0.0015742374,0.00013435514
Flexible hours enabling parents with young children to work around school drop off times etc.  Caring respectful of its good employees.  Demands high performance and generally gets it.  Lots of people love working at SYC for the people who work there friendships developed general culture and working environment.  Also plenty of opportunity for growth for the right people.  Company has high aspirations for growth this provides tremendous opportunity for its employees.,0.0003180117,0.00030008185,0.9993819
Sometimes makes errors of judgment in its management style so not perfect (what company is).,0.9989203,0.00092960056,0.00015017894
There is the additional tax free income which definitely boosts your pay packet. The CBD location is convenient and the refurbished building is pleasant to work in.,0.00030583295,0.00035721544,0.9993369
The few pros are completely overshadowed by the complete and utter lack of leadership overwhelming micromanagement the lack of flexibility for everyone that is not in an executive position and the poor rates of salary (which completely overshadows the benefit of additional tax free salary). The big brother environment including timed 30 minute lunch breaks suffocates even the brightest of spirits and sends the most enthusiastic staff member into a lengthy bouts of depression. The young bright sparks are trampled on by outrageous levels of insecurity of senior management and even the suggestion of finishing early on Christmas Eve was trampled by the CEO. The awful work environment is only compounded by the very difficult subject matter upon which the organisation is based on. The majority of staff have lost compassion and speak of the people they're helping with disdain. Going through the motions seems to be a prerequisite of successful employment here followed closely second by sleeping with your boss to obtain a position (no pun intended) of leadership whilst maintain a complete and utter lack of competence in your profession.   The general tone? Negative soul destroying as uttered by current and past employees alike. Those that are still there only remain because of little choice in a challenging work environment. Do yourself a favour. SYC? Need not apply.,0.99870014,0.0011073315,0.00019254193
Fantastic team that is full of super friendly people including management.,0.00019091237,0.000204907,0.99960417
Things take time to change,0.001125096,0.9982911,0.0005838507
Flexible working hours interesting work,0.00026344732,0.00026648183,0.99947006
"No tutor development no tutor support no respect for tutors. No job security. No career path or development. Tutors are not even seen as being part of the business ""family"" yet it's the tutors that make the college all its money. Poor pay: I received only one pay rise in nine years and I received it after arguing for it.",0.9991406,0.000689742,0.00016955043
Friendly and welcoming environment. Everyone is treated equal regardless of status. There is a strong focus on work culture and staff are very supportive.   It was a wonderful place to work.,0.00024102825,0.00023521412,0.99952376
Very few! As a notforprofit salaries are lower than industry averages and there are no commissions or bonuses.,0.9989415,0.0009182515,0.00014025198
Interesting work not too stressful mostly happy customers good hourly rate,0.0013104972,0.0047749425,0.99391454
Parking options at office are limited,0.99912983,0.00070671324,0.00016341693
Likeminded people fun environment exciting productions to work on.,0.00016142135,0.00023670694,0.9996019
Low pay unwilling to trial new methods,0.99907434,0.0007942233,0.00013140464
Gets to meet a lot of people. Attend a lot of career events,0.0019303096,0.5096846,0.48838508
Did not encounter any issues while working here.,0.00084715744,0.9985245,0.00062838005
Good pay WFH Boss is kind,0.0006630127,0.0008345461,0.9985025
 No cons alot of administratvie tasks.,0.00066270225,0.9988501,0.00048708785
Online flexible working good pay work from home avaialble,0.0003540058,0.00029868333,0.99934727
Tasks are repitive alot of admin staff,0.9978656,0.0020024122,0.00013209613
 accelerated entry to the teaching profession  accelerated career within the teaching profession with many alums going into leadership roles within 23 years of completion of the program  emphasis on best practise teaching training  access to a huge network of interesting hardworking intelligent and passionate young professionals based across the country  access to ongoing highquality coaching with an emphasis on personal development selfmanagement and leadership throughout the program  gain a masters degree in 2 years while earning a salary,0.00022671363,0.00021375077,0.99955946
 the salary isn't great compared to some grad programs  in Victoria it's a bit over $50000  Many associates find the university assessments which are a requirement for completion of the programme to be quite frustrating. improvements have been made to these in successive years but they continue to be a bit of a sore point.  the workload is quite heavy  the emotional workload can be enormous particularly in the first 612 months though this is also an aspect that seems to enable some very significant growth in associates,0.9976514,0.0021840471,0.00016460792
The Teach For Australia training includes so much more than what a normal Masters of Teaching qualification shows you about the world of education. It trains you how to plan and do your best in some very difficult circumstances > socioeconomic disadvantage in education.,0.7773569,0.21962442,0.003018646
It requires you to  devote a lot of time to be able to keep up with both work and studying the Masters (part of the program). It can make it difficult for people to have a social life. During the two years you are under training it is very hard to have a balance but I believe it is worth it afterwards as you develop many skills.,0.95930797,0.03992151,0.00077050395
Good people to work for,0.0002843283,0.00025014233,0.9994655
Fair way out of bendigo,0.0033022894,0.99592775,0.00076994195
working on research project that you are interested,0.00033128928,0.9960731,0.0035955866
very under paid graduate student,0.99902797,0.0008515741,0.00012054276
Good companyGood managersGood pplGood future,0.00028773406,0.00045208333,0.9992601
SmallDoesn't share muchNo bonusNo benefits,0.99885154,0.0010214824,0.00012691639
a very caring multicultural and supportive research institute with many opportunities,0.00018501782,0.00019446532,0.99962044
Payment is not very competitive,0.99902225,0.0008198464,0.0001579404
Great building in Newtown. Organisation stands for a good cause.,0.00018933079,0.00022733696,0.9995833
No staff promotion below market pay lack of transparency HR don't deal with issues raised appropriately. Focus on hiring external talent rather than developing their own. Lack of innovation brought in by senior staff.,0.99904376,0.00080527423,0.00015086101
great working environment and provisions for WFH,0.0002733908,0.00027120946,0.9994554
there are no cons for this job.,0.9945412,0.0052773207,0.0001814675
Positive atmosphere employees are valued,0.00026857512,0.00033900634,0.9993924
Hard to move between jobs,0.9983491,0.0014783344,0.00017262199
Nice office 'feel good' work with international collaboration,0.0001924558,0.00023090378,0.9995766
Salary package (basesuperannuation): Research Assistant $65000 Senior Research Assistant $69000 Research Associate $73000 Research Fellow $94000 Research Program Manager $125000  Difficult to get permanent position. Mostly 1 year or 2 years contract and will be renewed depending on funding.,0.998599,0.0012825695,0.00011846888
Great team of people doing amazing work,0.00033443898,0.0003200596,0.9993455
None its a great place to work.,0.008820914,0.9232636,0.06791551
"Recognition system if you're ""in favour"". Ability to move into other departments. Good affiliations with overseas universities. Flexibility to work from home.",0.00021513169,0.00032031396,0.9994646
Temporary workplace cramped will be changed later this year. Department heads taking credit for work performed or ideas that come from the department.,0.99487174,0.004941226,0.00018702113
Flexible working hours which is great  possibility to work from home. Good salary benefits  smart salary packaging. Friendly co workers easy to get along with most. Great location (CBD).,0.00020949177,0.00018511912,0.99960536
No or little opportunities for development. No mentoring program for new/young staff. Rare promotions outside of management staff. Moving to Newtown in December 2016.,0.99901843,0.0008546528,0.00012699948
 Flexibility    Autonomous culture; ability to follow passions to fuel organisation growth   Work with really smart & engaged people   Global HQ in Australia; work with diverse people around the world   Tax free component of salary as a Not For Profit in Australia,0.00021495584,0.00020846279,0.9995766
 Hard to point out anything.,0.00052902714,0.99861133,0.0008595864
Friendly team wellorganised admin functions Nice coffee machines weekly morning tea Great people to work with,0.00018728529,0.00017242495,0.9996402
can't think of anything,0.00033442225,0.99926597,0.00039968
Flexible Working atmosphere. Good team.,0.00020934777,0.00020820016,0.99958247
Travelling can be bit of pain.,0.99893266,0.00091667206,0.0001506549
Great work environment competative salary,0.0017109568,0.0011439113,0.9971451
Scientific research on the whole is poorly funded from the goverment down.,0.9990532,0.00079693476,0.00014986997
Specialised microscope and animal research facility available. Dedicated tissue culture specialist and media prep. Large team of clinicians for collaborative work Able to publish as a RA (lab dependent),0.00024990807,0.00036501983,0.999385
Lower pay compared to university counterparts Regular travel in between USyd and HRI,0.99848986,0.0013198922,0.00019023109
resourceful affiliated with SydU and RPA,0.99861693,0.0012153491,0.00016774176
salary scale is murky and not transparent. levelingup is not well defined,0.99901474,0.00083886366,0.00014638604
Great place to work lovely people,0.00020575506,0.0001978123,0.9995964
No significant cons to list,0.00026983986,0.9990258,0.0007043642
for more study and for knowledge and for experience.,0.00038662218,0.9986572,0.00095610175
more experiences make a man perfect and  better,0.0030242824,0.98910224,0.007873504
 good pay for minimal work,0.30143872,0.25766066,0.44090068
 nothing much to say for this,0.0003347389,0.9985813,0.0010840055
Good team atmosphere  small company  not for profit,0.008179799,0.007681817,0.9841384
Overworked understaffed constantly unstable hours if you are casual,0.99911374,0.0007267414,0.00015942768
Great manager amazing and friendly staff. Never made me feel like I'm just a volunteer.,0.0011158043,0.0009283055,0.9979559
None really. They're all very sweet.,0.00040994407,0.99845266,0.0011373478
Handson ministry is usually available which is what attracts you to the role.,0.000477278,0.9919984,0.007524375
Heavy administration levels and social work with insufficient training. Required to take on theological education at a tertiary level but not social work or administration? Makes no sense. Heavy conservative pockets. Makes nice sounding claims about LGBTQ inclusion but still won't allow us to perform samesex marriages.,0.9972951,0.002428357,0.00027650534
Best place to work because I love to care old people.,0.0003632867,0.0004655832,0.99917114
I don’t think any down words that I have got.,0.0005757355,0.9986891,0.00073519663
Great team environment every day different,0.027036434,0.751157,0.22180653
The large volume of work,0.16872019,0.8250862,0.0061937463
The Salvation Army is a great place to work if you have a strong sense of purpose and values. Whilst it is a Christian organization there is a strong belief that carries through on inclusion and diversity. The Salvation Army's support for Aboriginal Reconciliation is another strong point,0.0004144944,0.0005852794,0.99900025
The salaries are lower than similar roles in the market. This is somewhat ameliorated by having access to good NFP salary packaging benefits,0.9943224,0.0050138286,0.00066380296
You get to see the charity work being done in the community Social events are good for team building,0.00018734504,0.0002043957,0.99960834
Backstabbing coworkers especially those in workplace cliques so they could advance and move up the food chain Toxic culture where everyone lives in fear of their colleagues HR won't support you if you complain The organisation lost its Christian ethos when nonChristian people run the show and get promoted,0.99877554,0.0010725936,0.00015181623
Lots of opportunities to do good work on an individual. Some programmes are doing great work while others have poop practice,0.01217684,0.7365331,0.25129008
Massive organisation with bureaucratic management structure,0.99717855,0.0021682258,0.0006531943
Great community and team spirit.,0.0002656616,0.00031157423,0.9994228
Dealing with difficult customers are a pain.,0.9989882,0.0008684547,0.00014325792
Best team culture career progression lot's of job variety,0.003530631,0.013843481,0.98262584
I honestly have nothing bad to say!,0.00042801147,0.99900913,0.00056281226
Nothing Horrible! Very outdated micromanagement style. HR only job is how to micromanage people and if you leave just 1 min early you will get warning next day.,0.98761964,0.012165916,0.00021450597
Everything The whole existence Just no,0.00040354062,0.9990538,0.0005426886
Good culture with manageable workload,0.00029562708,0.0005063831,0.999198
Poor training and induction process,0.99896705,0.00088532484,0.00014769434
Friendly people and stable hours,0.00019508957,0.00036024034,0.99944466
Pay is not the best for the industry and tasks are very repetitive,0.99914074,0.0007067278,0.00015245134
Big organisation so it can be easy to move sideways to different programs,0.002396168,0.99290997,0.0046938905
Don't put effort into keeping good staff so a lot of staff don't stay long. Some programs are better than others at this.,0.99787426,0.0019418192,0.00018387036
Nice people. Good environment. Good lifetowork balance. Free cert 1,0.00020222992,0.00022954101,0.99956816
Gossip. Bad hourly pay regardless of your job.,0.9987503,0.0010902727,0.0001594436
Amazing work to provide for people in need across Australia and across the world,0.00039495938,0.00037578546,0.9992293
Toxic environment egotistical upper management massive staff turnover pay scale not competitive,0.99920875,0.00062092085,0.00017036122
Salary is about the only thing and salary packaging,0.9683069,0.03135361,0.0003395323
Management is the worst of any company. Will micromanage and believe the needs of the company come before the mental health of employeers,0.99909747,0.00074582954,0.00015679232
had a supportive manager flexibility in shifts so I could attend Uni at the same time,0.0022113058,0.0024765448,0.9953121
nonee that i can think of,0.0002725891,0.9991441,0.0005832528
The staff and customers are great to work with,0.00037768553,0.0003742924,0.99924797
On ly working today to three days,0.00051963824,0.9986526,0.00082779245
lifework balance is good aspect,0.000678424,0.97414666,0.025174856
salary is just be fine,0.0005898551,0.9987153,0.000694978
Purposeful work and some great friendly people in the team,0.00017435229,0.00017968194,0.99964595
Blame culture (in some departments) Military style org structure means that decision making is quite opaque Fundraising team leadership quite toxic,0.9989692,0.00089580327,0.000135034
Good team caring environment chances to move within organisation.,0.00025337815,0.0002484809,0.9994981
Pay lower than other not for profit organisations.,0.9989311,0.00091486727,0.00015394196
Not for profit at all,0.997572,0.0022190665,0.00020891996
Office is in at Blackburn,0.00039366505,0.9965029,0.0031034413
Good management at lower/medium level.   Being listened to.   Gives benefits when appreciated.,0.0011997403,0.0011785702,0.9976217
Very slow processing times.  Higher management does not know what they are doing.  No experience within higher management positions (in specific divisions).  Overworks employees and throws all the work to lower/medium tier management.  Does not value the expertise within the team.  No growth.,0.999175,0.0006698375,0.00015506518
Great team culture enjoyable projects flexible hybrid work lovely office supportive and kind management feeling that your work is contributing to improving people’s lives.,0.00018038586,0.00018234589,0.99963725
Takes a long time to learn the breadth of the organisation as it’s so huge.,0.9973024,0.0024774976,0.00022011143
Great atmosphere and good team,0.00027562695,0.00027122698,0.9994531
No prons are there as such,0.00039462734,0.998895,0.0007104759
Great people learn good skills flexible hours opportunities for career progression great work life balance,0.00024078418,0.0001927942,0.9995664
Very good place to work so I can’t make anyone,0.042961713,0.71481484,0.24222344
Coworkers and customers were nice had a great experience,0.00058978284,0.0024615566,0.99694866
The role was a voluntary one so it was not paid,0.9827927,0.017053839,0.00015349998
Salary sacrifice option nothing else,0.0025371686,0.99703985,0.00042302057
Toxic culture which starts at the top !!!,0.9989114,0.00091742165,0.00017117779
Ok to work Here no organisation,0.0005899197,0.99885035,0.00055978796
No organisation  Leader is a teller not a do person,0.99856335,0.0012999814,0.00013665282
Great people to be around,0.00022697376,0.00035035436,0.99942267
Long hours Not much of a con,0.0013952001,0.99831545,0.000289268
Good team work friendly environment,0.00017410517,0.00018204907,0.9996438
High case load for CM,0.020654269,0.97902757,0.00031811377
Great retail experience with people coming from various backgrounds.,0.00023126062,0.00028915878,0.9994796
No real progression pathways for volunteers.,0.0006927422,0.99886024,0.00044702407
Bad experiences Management is terrible,0.9988858,0.0009666965,0.00014753058
Bad management behaviours poor HR respond not listen to concerns.,0.9990539,0.0007930849,0.0001529969
Staff wellbeing is the priority at the same time providing the best care and service to the people in need. Never had any company I worked before treated the way salvation army does.,0.9787033,0.018547134,0.002749621
Nothing to mention as the organisation looks after us well,0.00051247305,0.99902165,0.00046587933
A really nice manager Rachel whom was transitioning so we called him (her) Rachel.. Really nice person...Great environment ability to learn and express your skills...Good talking environment. Good manager at Beenleigh Amy...nice lady....,0.00014928082,0.0002562456,0.9995945
Cons...no air conditioner in a hot area and not much in the way of fire safety in the building...,0.99840456,0.0014282695,0.00016719011
Very friendly staff fulfilling work experience gain for retail.,0.00022138451,0.00022308447,0.9995555
have not found one yet,0.00042582134,0.99927276,0.00030136853
Ethics and values are respected,0.088345036,0.42730573,0.48434928
Time management is needed in the sectors,0.19999273,0.7984047,0.0016025483
Salary packaging  Cares about employees Good work culture,0.00036125525,0.00035801623,0.99928075
Too many department requirements  Huge caseload and work,0.99917597,0.0006335245,0.00019044206
Not having to work sundays,0.030560575,0.06354657,0.9058929
Not the best pay annual salary for the amount of work goes into this job No backup or support for store managers  Bad bonus system,0.99918324,0.00064320595,0.00017355027
Great environment great team management is easy to get along with,0.00032302144,0.00025344957,0.9994235
you will be required to work saturdays,0.0009421332,0.9987457,0.00031215162
getting to give back to the community,0.00029400334,0.00038716578,0.99931884
there are no cons really,0.00047131695,0.99877816,0.00075048144
 never the same twice friendly staff experience with all kinds of people,0.96805656,0.03148219,0.00046120537
 not many cons can be grubby at times which is to be expected,0.00056953676,0.998833,0.00059744914
supportive generous with training and ups killing,0.99851114,0.001345721,0.00014304237
not in UK or NZ,0.00038204037,0.9989766,0.0006414247
Salary packaging only good thing,0.0040247617,0.75786525,0.23810998
Exorbitant KPI's no managerial support extreme pressure,0.99909806,0.0007283796,0.00017351117
