Comment,Negative,Neutral,Positive
Non competitive environment which values personal growth,0.99867296,0.0011105364,0.00021657681
A lot of promises not finalised,0.9979942,0.0019048204,0.00010098063
A positive supportive work environment!,0.00016838106,0.00017814459,0.99965346
Salary could be better in this workplace!,0.25671184,0.7417305,0.0015575832
Supportive workplace regarding mental and physical health Employee development encouraged Issues were handled with respect by HR,0.00028928724,0.00023614879,0.9994746
Direct manager was poor communicator Excessive amount of training required to get into the laboratory Widely varying practices for different laboratory groups leading to confusing organisation of shared spaces. Multiple platforms required to log training and other administrative forms.,0.99876606,0.0010860278,0.00014786968
Very rewarding you never get bored fantastic cause to be working for excellent people,0.00083428004,0.00045839828,0.9987073
No cons at all. I loved it.,0.00084570626,0.9971449,0.0020093224
Great team working together for united outcome. Positive and caring place to work. Moving the dial for kids with cancer.,0.00019025285,0.00020052724,0.9996093
Growing very quickly so sometimes our processes struggle to keep up,0.9952909,0.0045155035,0.0001936646
Working for a good cause,0.00033707608,0.00041915508,0.99924374
Cant match salary expectations if you're in the service stream,0.99824893,0.00158556,0.00016549723
the fabulous people very meaningful cause world class modern facilities flexible and friendly work environment  connection to UNSW  monthly events and volunteer opportunities,0.00016500539,0.00017514432,0.9996599
technology and systems. not on the train line.,0.99779946,0.0020434754,0.00015704565
Collaborative environment with passionate scientists,0.00016415141,0.00018260478,0.9996532
Weak management not giving room for much growth,0.9991327,0.0007203341,0.00014699763
Great colleagues and good culture,0.00020243596,0.0002419558,0.99955565
Continuing change in the VET sector which is outside of Chisholm's control,0.9949344,0.004918872,0.00014668712
A few committed colleges and appreciative students,0.00040157198,0.00059610297,0.9990024
Abusive and bullying management and human recourse dept. Performance incentives to management line their pockets at the expense of everyone and everything else. Outdated resources poor assessments. Non compliance,0.99917907,0.0006525194,0.00016840841
 The people here are so lovely friendly and supportive  great team environment.   The learning design processes and systems are very organised and practical.  The work is varied and interesting as you work on different training packages for various departments.   Allowed some wfh even before COVID.   Flexible with work life balance including start and finish times wfh purchased leave etc. Everyone really cares about learnign and providing the best experience for students,0.00025749503,0.0002926211,0.9994499
 When I was there we only had short term contracts but I hear this now has changed for the better.   Some delays in getting things happening as so many stakeholders to consult in the organisation.,0.9961075,0.0037540412,0.00013844256
People students role location size,0.0015533777,0.9914232,0.0070235007
Board culture IT resources management,0.0013360716,0.99403965,0.0046243076
Good collegiate relationships.Professional development oppotunities,0.00021074644,0.00021993031,0.99956936
Disorganised unsupportive management. Ongoing enrollments affect possible outcomes.,0.9991289,0.0007211214,0.00015011206
New strategic plan is now in place providing clear direction for the next 3 years. Work life balance An opportunity to genuinely impact the lives of others A fabulous group of people who are committed to making a difference.,0.0001937897,0.00018992677,0.99961627
I don't have any to list.,0.00028888308,0.9991867,0.0005244228
Training and support opportunity to upskill,0.0011354946,0.0022819159,0.99658257
Compliance and regulatory limitations on teaching,0.9962076,0.0036195184,0.0001728817
Good culture  Plenty of work Pays well,0.00025767076,0.00039305244,0.9993493
Constantly being micromanaged by seniors and other employees,0.9990926,0.00076286995,0.00014458234
Good team and work culture sometimes,0.0017515264,0.011429254,0.98681927
Communication  Workload Inconsistency  Ever changing process,0.00061859586,0.9925027,0.0068787737
lovely team to work with,0.00022160636,0.00022067694,0.9995577
exec not accountable no experience beyond TAFE,0.9989126,0.0009468365,0.00014067887
You get to work with great and talented people. Teaching staff are experienced and passionate about helping people learn.,0.00024966273,0.00023942193,0.9995109
Dictatorship rather than leadership with a bully culture. If you question anything you get a target on your back. Staff are not encouraged or  supported to progress unless you are a 'friend' and a yes person. No direction no processes to follow staff have to rely on long term staff to share knowledge  if they are still around! Do not embrace logical strategies spend money unnecessarily on consultants with no outcomes. Don't ask to go part time expecting you can increase your hours in the future it won't happen!,0.99892896,0.0009129151,0.00015809579
Great bunch of people to work with. Good support and career Growth opportunities,0.00020505044,0.00017568324,0.99961925
Slow working environment. Decisions and approvals can take a long time,0.9991572,0.0006728157,0.00016991161
Good Working Space to come to everyday.,0.00025079257,0.0002225485,0.9995266
A lot of micromanaging more than necessary.,0.99892884,0.0009113849,0.00015979468
some autonomy but that's about it,0.00057100534,0.99753773,0.0018912327
hopeless management heavy educational institution with a total lack of vision or understanding of where they should be going and a total disregard for connecting to their trget cstchment,0.99884355,0.0009933135,0.00016311248
Plenty of autonomy in the role and well supported by managers.,0.0031972984,0.0038444698,0.9929582
Sometimes a lack of priority for projects.,0.9987196,0.0011258955,0.00015449687
great time great afterwork options,0.00025777705,0.00029052058,0.9994517
very small creative margin though that may be because of the manager,0.66746765,0.33222896,0.00030335702
Great backup and training . Alot of extra benefits Stability.,0.00052051,0.0010200163,0.99845946
Pay rate but it's average industry rate.,0.99861956,0.0012122915,0.00016820275
Fellow staff members and front line staff,0.00059458247,0.99882704,0.00057830196
This company groups multiple Kids (up to 4) with severe behaviour in the same house. Instead of every kid having a separate house and being nurtured they would rather have our building and one roster of workers for multiple kids and have those kids be impacted by others in the house and turn out for the worse. This company constantly talks about self care but if you ever try to ask for time off and reduce your hours you will have to go through hell with management. The amount of funding this company gets from the qld government but can't even afford a Christmas party for their staff along with literally doing everything to save money despite being a non got profit is extremely disheartening.. dont ever expect that executive management or the ceo will ever come to your work place as your nothing to them and they don't have time for your place. There are smaller companies out there that put the kids first and have houses for each kid where the results and behaviour are alot better and have better outcomes. Don't work for this company.,0.9984452,0.0013841495,0.00017072336
Great staff and families you get to work with!,0.0002925397,0.00024102544,0.9994665
This organisation is tragically ill equipped to be responsible to be an employer of people! The entire management team are so ego driven and self absorbed. They have surrounded themselves with people who will always agree they reward bullying and victim blaming. They are irresponsible with the most precious asset they have being their staff. The culture is so toxic and the “senior managers” know that it is that way but just ignore the blatant evidence. Managers in positions that just do not give a care for children and young! Speaking up only gets you targeted!!! Complaints not responded or easily dismissed as “disgruntled staff!! There is no point applying for the CEO position that is already decided!!! It is a boys club and there is absolutely nothing Christian about this “care organisation”.,0.9989526,0.0008734412,0.0001738851
Salary modern equipment and office space relatively relaxed about hours.,0.000612345,0.00095358177,0.998434
Unfocused undirected with lots of infighting and undercurrents. Unfortunately not many employees support the Christian ethos of the organisation. Many supervisors are not fit for their roles and plainly bully their way around. Appears there is a lack of duty of care...,0.99897385,0.0008758174,0.00015044559
Wider team is a pleasure to work with.,0.00021708746,0.00026350608,0.99951947
Workloads are unrealistic and appropriate support isn’t provided. Salary is low for the amount of work and pressure you deal with. Bullying by upper management is swept under the rug,0.99914074,0.00067995687,0.00017930499
Reasonable pay and Benefits. Onsite parking.,0.0007614944,0.0004961427,0.9987424
Terrible culture of bullying poor leadership people in positions they aren't qualified or experienced to do. My worst work experience in my whole career. But most sadly it's not a Christian organisation so if you are a person of faith look elsewhere.,0.998648,0.0012098192,0.00014224883
People are always nice there,0.002537984,0.9446862,0.052775864
Hours are long  pay,0.9990658,0.0007689027,0.00016534462
Good team environment with staff working on floor.Good work life balance,0.0002551636,0.00021611014,0.99952877
Very high workload higher than most aged care.Poor staff ratioHigh staff turn overLow support from higher upsHigh stressDon't feel valued from organisation,0.99919814,0.000634204,0.00016765781
Care staff are good and perform well,0.009684782,0.10806761,0.8822476
Registered Nurse work load too much  working without breaks and never finishing on time.,0.9990841,0.0007404819,0.0001754566
Flexible and offers great work life balance,0.00030681532,0.0003888269,0.9993043
Nothing to complain about . Been really good,0.00054634194,0.99876344,0.0006902378
People are great to work with,0.0003089974,0.0005752135,0.99911577
Expectations of hours are high considering no overtime paid.,0.99890924,0.00094643846,0.0001442835
Good culture and work environment,0.00020736903,0.00020758549,0.9995851
Too much red tape in running projects,0.99906653,0.0007494109,0.00018413797
It feels really good to work for an organisation that is committed to continual improvement. There has been a lot of positive change and momentum and I am looking forward to seeing where we are going.,0.00019026836,0.000272392,0.99953735
Can be slow moving so it is difficult to feel accomplished,0.99898857,0.0008719238,0.00013949304
The company has a great culture and is accommodating,0.00028568148,0.00030245082,0.9994118
Youth working can be a taxing proession,0.9980028,0.0017944743,0.00020272183
Good people nice facilities caring people hard workers great service,0.00030703392,0.00025719395,0.9994357
Was short staffed hot area small town some bad staff not big facilities,0.9988036,0.0010585053,0.0001378387
The organisation has a really great mission vision and value set and when these align in practice leads to making a real difference in the lives and communities of those we engage with. The leadership are definitely passionate and committed and the staff,0.00025242742,0.000293939,0.9994536
The nature of the work can be inherently challenging due to working with the most vulnerable in our communities.  With such a large and diverse organisation having a consistent positive culture and leadership standard across all teams and areas can be a real challenge though I do feel we have the people and resources to move towards putting this in place.,0.9713301,0.027790954,0.00087903085
Remuneration and conditions Diverse opportunities depending on department Some very good people employed there,0.0013064344,0.0016736055,0.99701995
An underwhelming strategic plan Lack of clear disciplined and consistent executive leadership Core values that are at odds with day to day pursuits,0.9990736,0.0007739582,0.00015243905
I feel I belong to a worthy organisation with an inspirational vision that is clearly known by everyone. also the strategic plan is strong and clear making it easy for employees to see where their contribution fits.,0.00030246878,0.00056855596,0.999129
sometimes it seems challenging to get traction on important initiatives. Budget processes could be more streamlined with consultation at the level where programs are to be implemented and expenses met.,0.99293244,0.00683081,0.00023668716
Diverse Not For Profit across Aged Care Early childhood Child Protection and Affordable Housing Interesting work at a corporate level Social consciousness Giving back Values  Unconditional love; Being good stewards Acting with integrity Brand new corporate office with free parking at Kenmore Dont need to have a faith to work there.,0.00035112572,0.00030707417,0.9993418
Pays in the lowest 25th percentile compared to other large NFPs and competitors Hard to facilitate change Not enough emphasis on the employer brand versus the mission and the corporate brand Pockets of extreme religious overtures,0.99898106,0.00086924015,0.00014972573
The team I worked in was incredible it buffered the negative and scared culture that CofcQ foster,0.011966545,0.032400567,0.9556329
Absolutely no support or empowerment displayed by management to progress in your career,0.99896693,0.0008847238,0.0001484198
The culture at Churches of Christ is fantastic and I love how the organisation respects a healthy work/life balance. There are also plenty of opportunities for career advancement and room to move across departments.,0.00023297187,0.00027347138,0.9994935
There are limited public transport options if you are working at Kenmore.,0.9990491,0.00079412176,0.00015667264
The people our mission the qualify work that is done in vulnerable parts of our community.,0.04121107,0.77494884,0.18384014
Rate of pay. Tight labour budgets at the service level.,0.99918264,0.0006467171,0.00017065501
Great benefits / flexibility not in the city,0.0030458116,0.0041244267,0.99282974
there are no cons at this stage  depends on management at the time,0.00056749134,0.9988506,0.00058186724
Rewarding work great team good salary & benefits,0.00073592114,0.00041995876,0.99884415
None that I can think of,0.00026717153,0.99922824,0.0005046154
Great group of work colleagues.,0.00027217972,0.00031574274,0.99941206
Executive Group can be over reactive.,0.9988876,0.0009443627,0.00016802404
fun will have good time,0.0021444296,0.91365784,0.08419768
some bad days in office,0.996079,0.003785558,0.00013536688
Great office in Sydney Small energic team,0.00019830406,0.00022401317,0.9995777
I can't think of any,0.00031456898,0.999286,0.0003994293
Great place to work no worries,0.0005717373,0.0005479807,0.9988803
None That i can think of,0.00026258684,0.99922264,0.0005147996
Nothing to add at all here really. Other people I worked with are lovely but over worked,0.00058559445,0.99911875,0.0002955732
Male centric place. Boys club,0.97123057,0.028398862,0.0003705516
Work life balance  Pay Shift rotation,0.0005365686,0.9982408,0.0012225985
Can only do max 76 hours a fornight Some managers do not consider workers feedback,0.9989911,0.00086841156,0.00014047716
The participants are the only reason most of us are here,0.0015716148,0.88529897,0.11312943
Managers stay at home during covid on 75 grand a year or more Do not attend participants houses to do thier job. While the very underpaid covid exposure soldier's ( support workers) take the risk of contracting covid to ensure our participants wellbeing over Christmas and well before. We have children under 12 and grandchildren that are not eligible to be vaccinated yet and our own health but we don't matter to CLO. Staff shortages managers are supposed to full in shifts but no to precious to really care and support our disability participants. It's atrocious,0.99893063,0.0009138888,0.00015548759
Ok work environment. Not bad for new support workers & careers.,0.0024703299,0.96962345,0.027906198
Management onboarding process really poor no good care for workers,0.9991573,0.0006903807,0.00015233584
Opportunity to work in different areas of the organisation and pick up a wide repertoire of skills and increase your ability to work under pressure and versatility albeit whether you want to or not.,0.0006248603,0.0039221975,0.9954529
"While I solemnly declare the above is true is correct the organisation has only survived this long by immovable professional ethics and integrity of its staff forcing them to work in conditions with pay noncommensurate with experience even if you were more qualified than your manager. Prepare yourself to work to the bone living your life under the constant pressure of 6month rolling contracts and the fine print at the bottom of the contract reminding you that you are dispensable by politely that ""subject to funding"". I've been a professional in the human services for over 19 years but I left work every day bitter angry and often after 8pm in tears of exhaustion and frustration. I have framed the two emails that I got in 14 months saying ""thank you"" as if it were a sighting of a UFO. I worked night after night and on weekends which management was aware of given the emails after 7 or 10 pm and waking up to a work/life balance one from management in the morning. Picture a place were entire departments resign en masse and staff of diverse backgrounds making complaint after complaint about racist behaviour and words only to receive the ""insufficient evidence"" quasiautomated response. Further picture the same place where even temp staff refuse to work at and those who do lasted a week at best. I am yet to converse with a fellow colleague who resigned without emotional scarring a place where meeting your targets was to your own detriment as it was construed as you are cruising and watch in horror as it doubles and triples and soon after you are cordially invited to a Performance Management meeting asking why. No job has ever been harder since for which I bear gratitude but the bitterness and lashing out that my resignation elicited left a sour taste in my mouth chronic back pain from the worse than Ikea chairs and desks and the loss of confidence and selfesteem that followed me to my new role akin to PTSD. CLOnistan. I miss my colleagues every day and leaving there was like leaving prison after forming life long bonds with your fellow inmates.",0.9983063,0.0015416218,0.00015210481
There really aren’t any pros to this company,0.9964945,0.0032409432,0.00026455524
Employed for a particular role that never eventuated so was stuck working a role that I was not employed for ‘while waiting for the project to start’ the project never started office politics not a ‘team’ environment everyone is out to blame others and get other people into trouble (I observed other staff purposely setting up other staff to get disciplined) the money is poor communication with the company is very poor and critical information is shared via email when a phone call would be more appropriate very very low standards of care for clients very poor inductions for staff and high expectations for new workers that aren’t familiar with the dozens of forms which vary greatly between clients. Not a support team management aren’t supportive would advise people not to work here it is so poorly run. You get very very little client info I worked with clients that had significant forensic mental health diagnoses and was only given their address and name no background information no behaviour information you get thrown in the deep end with no idea what you’re walking into which puts everyone at risk,0.9990657,0.0007825559,0.00015173975
great peers varied work experience see clients gain skills and experience opportunities,0.0006631154,0.0026387388,0.99669814
When working for CLO it is made clear to support workers that you are a pawn they can move around to sites without consultation.   Unbelievably poor management and consultation procedures for staff that directly affect their lives income and family.    Are more focused on completing required NDIS paperwork/procedures than delivering person centred support.  Will continuously place casuals with clients that have anxiety over meeting new people or working with particular genders then permanent support workers are left to clean up the emotional mess.  Coordinators are stretched too thin and do not have adequate time for client related matters.  They often work well beyond their allocated hours without pay.  Training and professional development is poor. Training for a particular subject is a 23 hour affair read of a powerpoint by unqualified people to talk on each matter.   Professional development paperwork occurs just so they can tick a box saying it was done.   If you are planning to  work passive shifts please consider other companies that pay you much better for your time.,0.9985259,0.0013221854,0.00015182997
Awesome work environment and staff,0.00032204352,0.00026905767,0.99940896
No issues with the company so far,0.08718318,0.9108155,0.0020013035
Good at times and very good care,0.0051158457,0.09704229,0.8978418
Management is very bad and needs a lot of work,0.9988726,0.0009861602,0.00014118275
Great colleagues and variety of work,0.00046036532,0.00042189736,0.9991178
Poor remuneration lack of leadership bureaucratic compliant culture.,0.9991622,0.0006779936,0.00015989726
teamwork positive culture succession planning variety of shifts close to Rhodes,0.00020786063,0.00029101662,0.9995011
long way from where I live public transport can be tricky Parking,0.99899477,0.0008450222,0.00016022718
Entrepreneurial charity innovative approach to addressing welfare and social inclusion issues,0.00021620854,0.00021561884,0.99956816
Working with an innovative model does create ambiguity that means the way forward isn't always clear nor who is responsible for solving problems.,0.9948331,0.004990094,0.00017681872
The With One Voice program has the potential to change lives and bring so much joy to the community. Every one apart of the organisation are passionate abut changing lives and making a happier healthier community.   Working on such an amazing charity has given me so many fantastic opportunities and has helped me develop new skills.   It is a privilege to be apart of such a talented and devoted team. They are all willing to take the time to assist you with anything you need they encourage you and are generally lovely to work with.   Without the constant support from the Board Drive and focus from the Founder the organisation wouldn't have been able to achieve and succeed as much as it has.,0.0003651694,0.00041786782,0.9992169
It can sometimes be a stressful and busy environment but that's because everyone in the team is very passionate and wants to achieve the absolute best to help the with one voice program succeed.,0.06419903,0.6116389,0.324162
This awesome charity helps disadvantaged people to have hope and to set goals in their everyday life. The work the organisation does is truly lifechanging and a lot of lives have also been saved. I have been inspired to make a difference in people's lives through the incredible With One Voice choirs. This is all about building healthy and caring communities and it's great to see these inclusive programs starting all over Australia.,0.00020218894,0.0002138337,0.999584
There's never enough time or money to achieve everything  as with all charities there is a constant need to raise funds which puts pressure on the team and Board.  Still if you work for a charity you do it to make a difference in people's hearts and lives.,0.9986939,0.001116414,0.00018980872
I had the pleasure of interning at Creativity Australia. I enjoyed the work environment and the location of the office. It is a 2 minutes walk from the tram and the beautiful Shrine of Remembrance. The team has a great energy and the office space inspires collaborative work.,0.00023023176,0.00030481737,0.9994649
The team is quite small which limits the amount of work and learning opportunities.,0.9991136,0.00073648343,0.00014986246
Creative Cooperative FastPaced Passionate communityminded,0.000136154,0.00037980135,0.99948406
Resourcing a charity is always challenging,0.9989636,0.0008801557,0.00015629211
Awesome projects to work on,0.00020440557,0.00024094674,0.9995546
Outdated technology and equipment set up,0.9991673,0.0006693349,0.00016343367
 honorable mission  nice people   very diverse team,0.00021550694,0.00034534416,0.9994392
 I have done an unpaid internship,0.00036475153,0.99881566,0.0008197081
friendly sophisticated and harmonious working environment,0.00018055108,0.00019645324,0.99962294
many new faces can be seen within a month,0.00063199026,0.9974081,0.001959931
Working in the Reentry setting working to assist inmates with their transition back into society. Majority of  coworkers are very helpful team players. Retirement plan.,0.00033646097,0.00070210133,0.99896145
