Comment,Negative,Neutral,Positive
Strange culture which doesn't empower people in any way and opposite is true  all managers there would be happy if employees would never leave their boxes and do exactly what they have been told to not more. Opinions ignored or I would say even worse nobody would ever care to ask about any opinions. All decisions made by small closed group of managers and pushed down onto devs. Critical minded people not welcome. Engineers look scared they afraid to express opinions scared to not agree. Most of them would leave office to chat! Where will you see that?!? Technically they trying to catch up in terms of technologies but quality of code and architecture of existing applications is very low and that would be hard to change (and nobody actually trying I mean they make it look like they are but not really) because of reasons above. And of course meetings are loved here they take full day for some so all those managers and architects can report their time onto something (useless). It's quite strange as there were some smart people there (many left) but it never was really working mostly because of wrong culture. They really mostly operate in survival mode unable radically improve things. If you are contracting be even more careful as they don't respect contracts at all  it can be terminated any time not depending on your performance mostly because of poor planning.,0.9985257,0.0013322387,0.00014210328
"Familyfriendly culture  Flexible working hours: results based management in some teams Impressive digital capabilities  Company is focused improving the lives of health consumers Opportunity to make an impact if you're very driven & able to rise above the ""government is the client"" factors Really really smart people work here & are found in pockets across the company.  They thrive because the client doesn't meddle with the way they work.",0.00026841133,0.00027120672,0.9994604
Internal IT is terrible & don't even know how to use Windows properly let alone all the new Macs. Too much tolerance for poor performers creates animosity between teams.   Some high performing teams have isolated themselves to stop bad culture impacting them yet that creates more siloing across the company over time. Perks are effectively ZERO (haven't been taken to lunch by the boss once in almost two years what a joke.) company has no notion of celebrating success that doesn't involve you buying your own beer after work. People investment is basically nil: you have to find a way to leverage your job opportunities or go backwards in your career.  The HR team has full time people appointed to achieve not much except sending some managers on a course or two. Company culture too often apes the government & uses those shareholders as an excuse for having poor/no vision for the company direction & what we need to be investing in for longer term. Want to take a team meeting over lunch or coffee?  Prepare to pay for everything yourself as the company is obsessed with not spending on employees... yet wastes loads of money in other areas through poor efficiency focus and lack of retention planning (constant stream of recruitment fees leaving the building).,0.99899155,0.00084686937,0.0001616343
Having worked in much larger organisations I found moving to Healthdirect Australia a welcome change. The Outsourced Partner Manager role managing key supplier relationships allowed me to interact with most of the organisation. This role is a combination of supplier management operations management and project management all at a senior level.,0.00069052004,0.011186677,0.98812276
The 12 month contract goes way too quickly for my experience.  Working for a company NGO  NFP dependent on govt. funding did not give me the security i was looking for in long term employment.,0.9990883,0.00075894385,0.00015285604
I've been working in HealthDirect for almost a year. The team and culture of the company has been fantastic. My team leader has been very encouraging and supportive and the people I work with make this job. I have been able to work flexible hours within reason which gives me the freedom to start early and finish early beating peak hour traffic. All in all a great place to work in.,0.0003213131,0.00029641882,0.99938226
Sometimes there is uncertainty with contracted roles i.e if they will be extended for another year,0.32394,0.6757324,0.0003276409
Good location in the city,0.0002098107,0.00022842715,0.9995617
"Innovation is seen as a threat to  existing senior staff (""we have always do it like this""). Things HAVE to be done the way the architect says no new suggestions permitted. Any new skills are ignored as it may make management look bad. Massive staff turnover this says it all! Over 200 staff to look after 4 websites!!!",0.9989152,0.0009455387,0.00013935607
Supportive leadership team family style culture where people genuinely care about each other. Real values led company not just on paper.,0.00022698469,0.0002918994,0.99948114
Working with Gov can be frustrating and a low level of risk appetite.,0.9991623,0.0006721205,0.0001655678
Best architect ever and friendly people who help me grow and learn a lot. Room for growing on your carrier and using best practices. Discount on the gym(inside of the building). free drink and events every month free fruit,0.00022349197,0.00019752028,0.999579
The political situation(which created by managers) makes work environment uncomfortable,0.9989893,0.0008590096,0.00015172307
People really like what they are working on and have a common goal.  Teamwork and collaboration are good.,0.0008510338,0.007521583,0.99162734
Some of the internal processes are frustrating but there is a focus now on fixing these.,0.9969891,0.0028731413,0.00013786595
Flexible hours. Good sporting teams and interesting work.,0.00022828586,0.00021928782,0.9995524
Management favours those in senior positions who are allowed to get away with abhorrent behavior at the detriment to other staff who usually give up and leave.,0.9980071,0.0017735452,0.00021942957
Family like atmosphere with a flexible and understanding management. The whole team is passionate about improving the services that Australians use to make informed health decisions.,0.00045272688,0.0003655572,0.9991817
More social events would have been great,0.00089209777,0.99830353,0.0008043652
cutting edge and great work environment competent team mates and managers,0.0003657776,0.00032763404,0.99930656
too many managers and some times lack of internal communications,0.9990959,0.00074175297,0.00016233264
The delivery of great product for health consumers and the general public,0.00023119677,0.00022199696,0.9995468
sometimes hard to see where the company is heading,0.99865305,0.0012215378,0.0001253061
very engaged and passionate workforce at all levels of the organisation,0.00049293955,0.00045859028,0.9990484
challenging and stakeholder relationships (pro and con),0.0006302484,0.14344852,0.8559212
First interview was very relax and friendly.,0.003620516,0.80343366,0.19294582
From first contact to organise the technical interview took 8 weeks.,0.9974381,0.0024272152,0.00013466063
Opportunity to make a difference in the lives of Australians. Fast growing organisation.,0.00022563215,0.00020442158,0.99956995
Government bureaucracy and political agenda stifled successful outcomes at times.,0.9990922,0.00076090463,0.00014689121
nice people community based initiatives latest technologies,0.00016902246,0.00028270567,0.99954826
Semigovt.. other than that all good,0.00046013502,0.9987827,0.00075713877
Good people willing to help,0.00019477837,0.00020420503,0.99960107
No enough room for growth,0.99879813,0.001074103,0.00012774894
The University setting fosters a great sense of belonging.,0.00018047697,0.00020945982,0.9996101
The University setting needs to attract more quality students.,0.2882918,0.7072407,0.0044674478
flexible due to yearly KPIs scheduling of work is very flexible relaxed environment,0.00021687029,0.00033180695,0.99945134
slack colleagues lead to lack of work motivation as KPI is counted as a whole team,0.9990909,0.00075553515,0.00015353435
Easy money for part time work,0.005822576,0.009140275,0.98503715
Very repetitive and boring work.,0.99915063,0.0007019428,0.00014745632
Very good helpful friendly happy nice I love it,0.00018692749,0.00032379714,0.9994893
Never a bad place always the place to be honest and giving,0.033458274,0.64846426,0.31807747
Amazing working environment and people. Even the executive are fun!! The commission depends on how many sales you've made in a month. it can reach from $300 to more than $1500 per month.,0.0004366971,0.0007335987,0.99882966
No opportunity for career growth. either you become a senior qualifier or become a sales agent,0.99875283,0.0011428882,0.00010433959
Great culture work life balance and WFH flexibility,0.00033006343,0.00065159606,0.9990183
Lots of red tape due to working with government progression can be challenging as managers have been there for quite a while.,0.9990645,0.0008010956,0.00013448446
Longstanding friendly team brought on under prior leadership,0.00086478883,0.0017943027,0.99734086
Lack of courage in senior leadership. Team speak up about grievances and you can feel the lack of support. No role progression due to extremely flat structure.,0.9990507,0.00080666743,0.00014267568
Diversity of industries making a difference in R&D innovation,0.0003585604,0.0004468472,0.99919456
Always a focus on accelerating innovation.,0.99398535,0.005851884,0.00016283603
Absolutely loved my time at Hort. I was hired by a temping agency for a short term receptionist role. Was only meant to be there 4 weeks until they found a full time hire but I insisted on extending for over three months. Loved the people the office space the culture. Everything! Sometimes receptionists are talked down to but they made me feel so welcome & like I was a part of their Hort family. Would go back in a heartbeat.,0.012681483,0.03412192,0.95319664
North Sydney is a bit of a pain to get to but that’s it!,0.88726395,0.112187736,0.00054833025
Good culture and leadership very supportive flexible working,0.00019541099,0.0001824085,0.9996221
Lots of politics can be removed from actual farming practices and not the ones who do the work,0.9834025,0.016384102,0.00021352609
I work here quite a lot.,0.00036702436,0.9984553,0.001177665
Would like to move on.,0.0005208301,0.99897873,0.00050046295
Fantastic people Opportunity to learn and try new things Flexible work arrangements Work with a purpose Not for profit benefits,0.0002653381,0.00027138184,0.99946326
Small business means moving up can be difficult Business is siloed so getting a big picture of what's going on can be hard. The problem with silos depending on what part of the business you are in your experience could vary.,0.99802244,0.0018568242,0.000120730314
 Great clients to work for and many friendly Staff to work with.,0.00024378892,0.00021832496,0.99953794
 Watch out for Team Leaders that have no management skills that will profit off your work taking credit. If you out shine them. They will lie and have you dismissed.   The Salary is below normal for the Roles on offer.,0.9989195,0.00091297965,0.00016759346
Friendly and knowledgeable team plenty of challenges and chances to show your creativity by solving them. If you have a novel idea and can defend it in the development team it can go in with no nontechnical objections.,0.00078126026,0.0019141764,0.99730456
Budget constraints leave some nice features on the back burner even if it means more rework in the future. Lack of focus as a company  a lot of units operate in completely different areas.,0.99478525,0.0050028595,0.00021193037
Great Ethos. Great client base and awesome coworkers,0.00022501768,0.00021889496,0.9995561
Awful management based on bullying and dominance,0.9991092,0.0007400211,0.00015079236
Flexible work arrangements Nice work mates,0.0004671791,0.0019315917,0.9976012
Male dominated workplace.  Disorganised senior management. Disrespectful culture towards women. Lack of knowledge or expertise in social justice projects.,0.9991341,0.0006943044,0.00017161272
Good products great people to work with,0.0002596582,0.00022737257,0.9995129
unfortunately company has bad management,0.99909055,0.00075467356,0.00015480221
Good pay awesome company understanding and listened . Who wouldnt want to stay .,0.00074448495,0.0012256802,0.99802977
Flexibility hard to get ahold of bosses.,0.9989806,0.00089167967,0.0001276186
Good solid leadership. Good organisational and company values.,0.00028783403,0.000294411,0.9994178
None amazing office culture. relaxed environment,0.00043655568,0.0005781355,0.99898535
Very rich school. Academic focus.,0.008807108,0.97165954,0.019533372
Really bad culture. Expect bullying from admin and 0 support. Expect a lot of extra work outside of contract hours.,0.99905485,0.00076338486,0.00018178781
good work during most of the time,0.002782804,0.7500684,0.24714875
when it is raining it is hard to work,0.99898607,0.000867639,0.00014625667
Work from home Great management  Lots of fun,0.00028243914,0.00031037803,0.9994072
Salary could be a bit more,0.0012380515,0.9982046,0.0005573259
very easy to get and no troubles,0.021384181,0.55199003,0.42662576
not really any cons with this,0.0004893004,0.9988551,0.00065563974
Ok to be interested in hotel,0.0004076296,0.9986117,0.0009807346
Nothing is more than a year,0.0007250661,0.99872893,0.0005460501
Good work life balance Great team atmosphere,0.00036875933,0.0005104642,0.9991208
Dry and stuffy office work generally,0.9728978,0.026795588,0.00030669387
Good team spirit and team culture,0.00020578867,0.0002288466,0.9995653
Low salary and old platforms to work with,0.9991875,0.00064901,0.00016344571
Hospitality industry/people can make a great office environment. Opportunities for PD and transfer to other department.,0.00024069661,0.00026199527,0.9994973
Salaries don't rise often and require a great deal of pushing to get what you're aiming for.,0.99888307,0.00095429824,0.0001627134
Great potential and actual pportunities to expand and diversify,0.00063037063,0.0017513555,0.99761826
Poor corporate management and lack of vision,0.9991345,0.0007125688,0.00015292258
Couldn't ask for a better place to work. Everybody works hard and we are surrounded by support. Even the director CEO or different departments would make time if you asked.,0.04300636,0.07951702,0.87747663
Can't think of any at all.,0.000290007,0.99928755,0.00042257912
Work place is good and people are so nice.,0.00042430378,0.00091890735,0.99865675
customers are so impatient and less work shifts,0.99914527,0.0006688757,0.00018581323
Friendly and professional people who care about you as an individual and not just as a resource. Employees have a passion for their work and focus on outcomes for staff as well as clients.,0.0002860885,0.00026985683,0.99944407
A lot of differing operational systems due to growth by acquisition of other organisations.,0.9824357,0.017443484,0.000120799945
Working from home and close to home Great team,0.00026159448,0.00034435533,0.99939406
Manager micro manages everything and no trust with the employers,0.9988424,0.0010119795,0.00014559331
Great team of workers that were concerned for the youth.,0.0007437611,0.0005104804,0.9987457
Training was not very extensive which made job difficult.,0.9990338,0.0008292551,0.00013695053
Working at Life without Barriers has been nothing short of a nightmare with chaos and dysfunction reigning supreme. While there are a few positives such as market salary rostered days off and hybrid working they are overshadowed by a plethora of challenges that plague this organisation.,0.9975414,0.002287031,0.00017157428
"Challenges Faced: Siloed Teams: It's astonishing how disconnected the various teams are within this company. The left hand has no clue what the right hand is doing leading to a frustrating lack of collaboration and coordination. This silo mentality hampers progress and creates unnecessary hurdles at every turn. Poor Planning and Communication at the Senior Management Level: The senior management fail miserably in their duties. Their inability to plan effectively and communicate clearly is mindboggling. This lack of direction and guidance trickles down to every level of the organisation resulting in confusion wasted time and missed opportunities. Lack of Accountability and Support from Senior Management: One would expect senior management to be pillars of support and accountability. Unfortunately that is not the case here. Instead they shirk their responsibilities and conveniently shift the blame onto others down the chain. Their lack of support leaves employees feeling abandoned and disheartened. Overworked and Stressed Workforce: The workload is unrelenting and overwhelming. Employees are constantly pushed to their limits resulting in extreme stress and burnout. It is no wonder that talented individuals eventually leave disillusioned and exhausted by the constant demands placed upon them. Neglected ICT/Finance Systems: The company's refusal to invest in modern ICT and finance systems is a major hindrance. Outdated and inefficient systems only add to the workload creating unnecessary manual tasks and reducing productivity. The lack of investment in this crucial area is baffling and counterproductive. Senior Managers Lost in relentless Meetings: Senior managers seem to spend more time in constant overlong meetings than actually taking action. Endless discussions without concrete outcomes further exacerbate the issues faced by the organisation. This lack of action is a clear indication of their ineffectiveness and detachment from reality. Lack of Performance Reviews and Team Engagement: The absence of performance reviews is indicative of a management team that lacks the courage to confront issues headon. They are uncomfortable engaging with their teams and addressing problems constructively. This avoidance only perpetuates existing problems and stifles growth. Blatant Deflection of Responsibility: Rather than taking responsibility for their actions or decisions management prefers to pass the buck down the chain. This behaviour not only undermines trust and morale but also hinders progress and resolution of pressing issues. Repeated ""RightSizing"": The company's habit of conducting ""rightsizing"" exercises is both disruptive and demoralising. Permanent staff members are either made redundant or forced to reapply for lesserpaid positions. This constant instability and uncertainty breed a toxic work environment. Lack of Actionable Vision and Strategy: Despite the lip service paid to the importance of vision and strategy senior management fails to translate these buzzwords into actionable plans. The lack of investment in critical areas coupled with the absence of a clear direction hampers growth and stifles innovation.",0.9990644,0.00078215497,0.00015347403
Clients and some good staff,0.0009972698,0.0031798221,0.9958229
Lots of organisational change. lots of emails but not much face to face communication and engagement. No longer assisting support workers to up keep qualifications relevant like first aid. Cost cutting across organisation via restructure. Lack of quality supervision,0.99904114,0.00081249233,0.00014631872
Strong mission and vision Connected and passionate team Real world impact,0.00022224938,0.00026663643,0.9995111
Under resourced High turnover of executive staff Actions don't always match policy/words.,0.99909246,0.0007541764,0.00015345684
 supportive team  nice office flexible to work from home,0.00021983312,0.00018924665,0.99959093
 high staff turn over meant you were constantly speaking to people who were new at their job and still learning,0.9980033,0.0018706763,0.00012597596
Company car and ability to work from home were the only positives,0.32778114,0.670616,0.0016029008
The most toxic culture I've worked in. Not even just on a team level but also a whole office level,0.99900156,0.00084229076,0.00015614103
Friendly staff Flexible work Great opportunities to build relationships to with clients,0.00016245461,0.0001645567,0.999673
Sometimes the rostering team are a bit disorganized and may accidentally double book a shift or book a shift when you are unavailable.,0.9987042,0.0011416262,0.0001541329
working with all different young people,0.0005134315,0.99749905,0.0019875255
Want allow you to do overtime rather give it to agency workers,0.14858794,0.8507036,0.00070850766
The kids development Pay okay,0.0007331394,0.99808806,0.0011787507
No supervision No empathy Zero regard for staff mental health Poor policy,0.9989503,0.00089174474,0.0001580705
Salary packaging and flexible hours,0.020238796,0.025410842,0.95435035
Rife with favouritism and nepotism,0.9990275,0.0008043925,0.00016812948
good job if you want to just collect pay check,0.0051896954,0.99303246,0.001777846
management is not that great too much politics,0.99860364,0.0012608913,0.00013552932
Supportive team leaders other support workers have been there for years and years so are a great source of support about clients all the small team benefits with all the security of being in a big org. Appears to be opportunities for career progression for newer staff as well as more senior staff. Great support all round and pay rate is well above average.,0.00037055227,0.00028102414,0.99934846
Software systems are awful to use i’ve never had such a pain in the butt tool to use as Kronos. Support workers aren’t paid for travel time between clients only mileage.,0.9991417,0.00069271936,0.00016550535
Work from home opportunities. Role autonomy.,0.00048693095,0.0007671725,0.9987459
Flat team structure not much room for growth.,0.9991547,0.000698705,0.00014659711
Amazing place to work at,0.00026882646,0.0002663773,0.9994648
No cons at this workplace,0.9989723,0.0008598179,0.00016792567
Helpful management good pay plenty of work,0.0011778213,0.0005922565,0.9982299
Under staff overtime overall good company,0.0024755695,0.98820716,0.009317344
Good team support always paid great creativity and training. Good support for young persons and families involved.,0.0002804392,0.00021160144,0.9995079
Poor work/life balance coercive in getting staff to overwork and burn out. Management can be forceful and unsupportive. Funding allocation needs review. Very in crowd out crowd within teams. On floor staff performing managers duties. Overloaded team leaders. Employee grievances overlooked or dismissed without being addressed. Confidentiality is not always private and confidential.,0.9990575,0.00078817725,0.0001542926
"Reliable workload makes fulltime opportunies viable. Great team to work with very friendly. Pay is ""good enough"" but needs to be increased in line with increased costs of living.",0.0060418113,0.008557396,0.98540086
A restructure left our entire core business gutted. Employees were not fairly or properly consulted prior. Faithful employees have left for better opportunities and inexperienced staff remain. Demand a higher remuneration on entry LWB are desperate to attract and retain talent. Protip: Don't fold on your values if you need to retain staff during a pandemic.,0.99763584,0.0022285434,0.00013558015
Supportive environment corporate team are very professional and welcoming. Lots of people to turn to if you have a challenge you need help resolving and copious amounts of resources. Everyone in corporate is there for a common purpose and truly lives and breathes the values which is rare in such a large organisation. A feelgood company to work for.,0.00029132987,0.00026856104,0.99944013
Due to the sheer size of organisation can be very structured and process driven. Quite a bit of red tape at times. Lacking in benefits no paid parental leave. Due to amount of funding and wealth of organisation they could focus on these essential benefits that all employees should have access to instead of constantly striving toward growing wealth and expanding services. Get it right with those in your immediate duty of care and then expand out to offer care to others.,0.9984041,0.0013636332,0.00023231481
Good nonprofit salary packaging and Rostered Days Off,0.0010296735,0.0014469023,0.99752337
Overworked and minimal culture/ benefits,0.9985085,0.0013584415,0.0001330996
Great children and young people. Nice office and work vehicles available for private use. Staff are nice.,0.000227356,0.00022180252,0.99955076
No support from management. I worked there almost a year and only had supervision once. Hardly ever even sighted my manager as she arrived late left early and was busy in between. High needs children my case had mostly disabled children or extreme behaviours. The structure isn't supportive. Between the case workers and senior management there is no one.,0.99902713,0.0008273545,0.0001455136
LWB seeing my potential and offer job roles that could leading me to learn and improve my working skill,0.96799827,0.03178899,0.00021276035
Time management and could be heavy workload sometime,0.99850816,0.0013608224,0.00013100669
Great work/life balance RDOs! Excellent COVID response.,0.00034514294,0.0006165538,0.99903834
Bureaucratic disjointed processes. Immature management.,0.99906856,0.00076233305,0.0001690843
They exist and are desperate for staff,0.9983411,0.00154275,0.000116137744
Shift filling is a convoluted nightmare where external agency staff get all the shifts Upper management are power hungryClaim to support people goals to work in different sectors. If you try to change sectors prepare to be treated less then dirt and have it denied. Only upper management are allowed to change sectors,0.9983675,0.001482621,0.00014997691
Salary employee benefits large org so opportunity for growth RAP plan is amazing!,0.00020420647,0.00019443494,0.9996014
work/life balance is not always there sometimes its not what you know but who you know lots of tiers of management,0.996564,0.003324283,0.0001117935
