Comment,Negative,Neutral,Positive
Smaller size also means while salaries are good there are fewer positions to fill unless project positions are there Organization needs industry heavyweights People do not know PSI beyond FP in Pakistan that too only in Sindh and Punjab despite PSI has deep expertise in entire heatlh portfolio of work including public sector,0.66281885,0.33654755,0.00063363154
The work itself is decent,0.0008106508,0.9946155,0.0045739086
micromanagement and office politics happen a lot,0.99901056,0.00082696095,0.0001624275
the work is very meaningful,0.0001896192,0.0009072951,0.99890304
the salary range is low,0.9990753,0.00076091354,0.00016376717
Good organization friendly environment learning opportunities,0.00016634776,0.00017088637,0.99966276
Nothing is bad here at PSI. I am just trying to leave because my family is in Islamabad and i wants to go there.,0.00037856918,0.9991841,0.00043736352
A fair amount of exposure and learning opportunities,0.0002984447,0.00045055643,0.99925095
Micromanagement exploitation low salary packages office politics unhealthy attitude towards leaves overtime unpaid work and lack of boundaries,0.99918634,0.0006389714,0.00017472527
keep it up good work,0.012307554,0.17187734,0.8158151
Excellent works. This company help alot,0.00085689937,0.0010077944,0.9981353
Good pay masters Diversity and growth,0.001151469,0.0012754847,0.9975731
Till now I have not found any,0.0006742638,0.99909186,0.00023388785
It covers indoor health insurance plus u have GP fund when you resign or retire,0.021801682,0.41513565,0.56306267
It doesn't allow complete postpartum period medical leave inspite of the fact that the government bounds every govt and pvt institute for three months leave. They deduct the points of the class teacher when the students don't fill online feedback which they have to do on their own at home. If u r on maternity leave the management count those as ur regular absence and deduct point of regularity at the time of increment,0.9987099,0.0011368473,0.00015322994
a good organization which does not fire its employees too often.,0.0021095637,0.0013188528,0.99657154
low pay........ less egronomics........ workplace politics at its peak,0.99896586,0.00087843195,0.0001557308
the company has a Good Environment,0.00033845878,0.00041498983,0.9992466
The offered Pay & Benefits are not market competitive,0.99876213,0.0010754212,0.00016249243
Salary is attractive Environment is friendly,0.00071068713,0.0026111708,0.9966781
Timings are long Saturday should be off,0.9978132,0.0020656723,0.00012111526
A good place to work as an educator.,0.0001946804,0.0001982369,0.99960715
You never get leave with pay.,0.9985707,0.0012786299,0.00015066682
the role offers flexibility to act,0.0012300442,0.068743095,0.9300269
lack of professionalism in most,0.9989208,0.00092336966,0.00015592083
This is great platform indeed to learn and to move forward,0.00020688557,0.00025251083,0.9995407
I also need some part time job due to my needs,0.0009828844,0.9985384,0.00047873828
It's one of the biggest and internationally renowned institution in Pakistan.,0.00044597505,0.0008391223,0.9987149
Overall it was a good experience but I feel there was a bit mismanagement in administrative affairs.,0.0014947344,0.99811614,0.00038918323
Good to start for beginners or if anyone wants to shift from school level or any other pvt college,0.0018076431,0.6616462,0.33654615
No career growthNo chance if enhacing your cvMost of the staff is Masters based. No Mphil or PhdJust spoon feeding to the studentsNot friendly environment,0.99906296,0.0007968601,0.00014021566
flexible work balance and good culture,0.00022948024,0.00024691422,0.99952364
no define career path and growth plan,0.00068858336,0.9987349,0.0005764893
Working Environment is very comfortable,0.0008855321,0.007652457,0.991462
They don't provide much of benefits,0.9991037,0.0007658735,0.00013045203
A place with healthy environment where you can learn knowledge and new skills,0.00018535384,0.00022683795,0.99958783
Competitive with less opertunities to increase eatning,0.99682343,0.0030546703,0.00012197154
Largest educational group in Pakistan  with presence in 120 cities Strict observance of office hours (Almost no late sittings  in Head Office) Medical Insurance for spouse & Parents,0.0027935833,0.0027900825,0.99441636
Missing basic job descriptions Everybody is your boss anyone can assign you any work even if he/she is not from your dept. No job Career path  if you want a stable job with 5% yearly increment this is the place for you.,0.99142915,0.008271737,0.0002991077
Salary in Time Good Working Conditions,0.0009895095,0.0007365903,0.99827385
No Good Raise No Respect No Bonuses No Extra Work Payment Very Less Holidays Rude Behavior Rude Employees No Self Respect No Free Time,0.99920577,0.00060885766,0.00018539876
one can enjoy the comfortable working environment and empowerment .,0.0003035385,0.00089054264,0.9988059
They are not good pay master and don't offer any benefit.,0.999175,0.0006747265,0.00015020162
its well managed institute with tight working environment,0.0028905384,0.0049306415,0.9921788
extra clerical work reduce the working capacity of lecturer,0.9991302,0.0006986696,0.00017117626
a group of companies opportunity to grow,0.00023343838,0.00020861601,0.9995579
due to continues work social life compromised,0.9974942,0.0023920983,0.00011369426
Leading institute which provides quality education.,0.00024059092,0.00023782789,0.9995216
Classes are not ventilated properly.,0.99909663,0.0007501256,0.00015327932
Salary on time no delays,0.15512277,0.07758771,0.7672896
involve you in many other tasks not belongs to you,0.022083009,0.9776103,0.00030671075
you learn if you want to an if guided & provided rightly,0.00045200228,0.99781173,0.0017363095
lack of facilities & lack of interest by some employees,0.99920744,0.0006238162,0.00016880665
Government Health Department in 3rd large city,0.0005610115,0.99778914,0.0016497995
low salary with poor management,0.99911124,0.00071041426,0.00017828585
Big campus with a lot of students Experienced staff who can teach a lot,0.0015465012,0.02988719,0.96856624
Lot of work sometime have to do extra work continuous network interruptions,0.9991335,0.00069128425,0.00017520341
One of the genuine international humanitarian organizations working in 16 countries including Pakistan.,0.00022812138,0.00027359062,0.99949825
I dont find any problem yet working with this organization,0.015773023,0.98361975,0.0006072432
Experience was good while working here,0.0014993483,0.09959479,0.8989058
No cons. Very good administration.,0.0023611265,0.98873514,0.008903789
savings community and take care,0.002337522,0.9935288,0.004133677
protocol eagle eyes saving place and our officer,0.00756626,0.42309406,0.5693397
Learning network across the globe.,0.000133964,0.0006164987,0.9992495
Work area restrictions in Pakistan.,0.91844046,0.08128496,0.00027461984
Very good organisation with skilled and trained staff,0.00034843673,0.0002755933,0.999376
Nothing it is a good organisation,0.0013059251,0.9959739,0.0027201883
A lot of opportunities to grow,0.00036372105,0.0004071137,0.9992292
There is nothing specific that I can mention,0.00027921953,0.9991216,0.00059919513
Save the Children is one of the leading non profit organization working for the child rights in 160 countries for the last 75 years. So I really like to serve Save the Children for the better future of children.,0.0032778066,0.03326755,0.96345466
I love my work..... so I don't think so,0.0007457206,0.99880195,0.00045229428
Learning Skills and experience multi cultural environment  Serving Humanity in far flung area which normally taken as beyond the reach of civilized societies.,0.7045954,0.2866329,0.008771723
Favoritism and Cultural Groups Dominance,0.0056417864,0.9938167,0.00054156303
Save the Children is the world leading organization i am working with save the children almost  4 years. working with save the children is very good experience and my desire working with save the children my whole life.,0.000355981,0.0006671103,0.99897695
no downside in save the children,0.0008064535,0.99827623,0.0009172407
its best place to work ... multi cultural . the best thing of SCI is that it values its employee treat like  a family,0.00019753174,0.00023201508,0.9995704
jobs are short tenure depend on project :(,0.99891484,0.0009525513,0.00013267969
Save the Children fights for children’s rights. It deliver immediate and lasting improvements to children’s lives worldwide.,0.0006115491,0.0007161129,0.99867237
save the children provide Short Contractual job.,0.2698627,0.7281649,0.001972325
If you are interested to work for a cause a value based organizational environment and exposure to the world  Save the Children is the organization.,0.0040338626,0.79807025,0.1978959
Forget about work life balance.,0.8608485,0.13862115,0.00053032476
i like team work there.,0.00055659836,0.9971097,0.002333721
nothing to write bcoz save the children never let dwon his employee,0.0010718858,0.9986507,0.00027734868
Great team. Good office environment.,0.00024047548,0.00022198347,0.9995376
Emergency responses expect 70 hr of work per week,0.5568501,0.44254035,0.000609561
Knowledge of Humanitarian response Livelihood Modalities made positive impact on BNFs Most of organization now prefer CfW modality in early recovery  project deign,0.0004925595,0.0026342685,0.9968732
Short term Limited resources  Access,0.99887997,0.000981869,0.00013816985
Professionalism Learning Opportunities Career development Training Satisfaction from work,0.00039868156,0.00053342205,0.99906796
Salaries and other benefits are quite low,0.9991371,0.00071167725,0.00015129756
Humanitarian organization High performance team culture,0.0010404087,0.0014936753,0.99746597
Over staffing of employees in some areas Less automation of systems,0.9989643,0.0008699242,0.00016576833
Very good working environment personality grooming workshops,0.00023587755,0.00024097615,0.99952316
Work Load in emergencies nothing more other then this one,0.0030518826,0.99659723,0.0003508942
A supportive & dedicated team work,0.0005737224,0.00053073175,0.9988955
communication gap between line management & top management,0.98019123,0.019572128,0.0002365808
nature of work is the best thing,0.00034237152,0.0010004359,0.9986572
late sittings and work on weekdays,0.99912995,0.0006700085,0.00020012431
Great systems in place . Employees are valued and have a strong say!,0.000564909,0.0003800194,0.9990551
Very much eye health focused but can expand the portfolio with a diverse team available at head office and in 30 countries of work.,0.004240868,0.99259806,0.0031611028
Excellent organisation with a lot of learning opportunities.,0.00027283948,0.00023150753,0.9994956
Time management skills are highly recommended.,0.628054,0.3621426,0.009803411
The working environment is good and the office building is wonderful.,0.0002840409,0.0003938229,0.9993222
Do not gossip with others.,0.0006917733,0.9984263,0.00088192394
Very fulfilling career travel opportunities great future prospects,0.00025104053,0.00024005293,0.99950886
way too much politics low compensation no work life balance lack of organization and standardized practices,0.99916995,0.0006623928,0.00016769512
good experience in the field,0.0003945014,0.0011855602,0.99842
no option for a leave,0.0054676365,0.99426275,0.00026949676
Can build a future in it,0.003379542,0.90151465,0.095105834
Need to hard work in it,0.006422406,0.987889,0.0056885225
It has best work environment. It gives us opportunities to learn. It is the best institute for carving the capabilities for future.,0.0002853833,0.00035243525,0.9993622
It is a contract based job.,0.99826694,0.001570086,0.00016296578
I was working in the project office of SDPI. And my review is only about the project office. Overall it was a really good experience learned a lot working environment was good salary was market competitive.,0.001803179,0.050157797,0.94803905
Once again my review is only about the project office that I worked in. First of all there was no specific hours of working. Most of the times we had to work overtime (1012 hours) without any compensation or appreciation. Second thing was favouritism towards some employees who would take multiple days off short leaves regularly and less work and still get more salary.,0.9989749,0.0008720055,0.0001531337
i search a resaonalbe and wel orgnization job tha is why,0.00022709968,0.9988237,0.00094920635
i dont know about them sory,0.00036296278,0.99899346,0.00064361206
One of the best org best HR practices,0.00025513727,0.00022394728,0.9995209
Compliance one of the big chalange for me I perform this rolle accordingly,0.00023287818,0.99723804,0.002529107
To introduce Islamic language Arabic,0.00034105353,0.9941917,0.0054672332
Best for ever for learning,0.0009887243,0.0074125445,0.9915987
exposure much and helping al in all,0.00038505875,0.98445547,0.015159548
no idea when are getting job,0.0004312111,0.9989467,0.0006220748
High growth great autonomy and exposure.,0.00045776056,0.0010414463,0.9985008
Development sector is shrinking; not the Foundation's fault though.,0.86147064,0.13829733,0.00023212064
Good learning and good atmosphere,0.00020310013,0.00025212448,0.9995448
You don't get much international exposure,0.98887724,0.010991869,0.00013085696
Good Human Resource and capacity building for the staff market driven salries,0.00020663721,0.00019205113,0.9996013
Didn't find any I'll share if I see any. Right now its so far so good,0.0005060491,0.9985726,0.0009214181
International Exposure Global Network Good Reputation,0.00018675491,0.0002595292,0.99955374
Regional mobility isn't easy tight salaries,0.9990466,0.00081117445,0.00014221796
Good workplace. Exciting learning opportunities (elearning inhouse trainings workshops). Extensive interaction with key stakeholders including public authorities.,0.00016173154,0.00016671402,0.9996716
Modest Salary packages. Relocation not available (country office).,0.9991696,0.00067143794,0.00015902311
Wounderful work Environment and self development,0.0004894384,0.0005545678,0.99895597
Hard work and Hardwork. You do the best of your best.,0.019610727,0.89483833,0.08555087
You learn a lot about gender equality agenda.,0.011932225,0.9876016,0.0004662006
Funding issues leading to job security and stability.,0.9989993,0.0008481676,0.00015256311
Learning Missions to various field locations Contacts development,0.00039004761,0.97444326,0.02516668
High level of stress and anxiety during emergencies and while meeting deadlines,0.9991248,0.0007097853,0.000165391
They are lenient in office timings,0.99900323,0.0008157923,0.0001810357
They don't treat equally treat their employee.,0.9987778,0.0010574402,0.00016473279
Good environment helpful and friendly people,0.00016991788,0.00018522904,0.9996449
Long working hours in field,0.99918336,0.0006656103,0.00015098257
Best Salary and healthy working environment,0.0007426416,0.00050867803,0.99874866
No any Consequences in my knowledge,0.00029549614,0.9992937,0.00041072164
UNICEF is a very good organization to work with.,0.00017910989,0.00022904441,0.9995919
However the time completion deadlines are tight,0.033798013,0.96596056,0.00024150935
Medical insurance for staff and family. Annual Leaves Paternity and Maternity Leaves,0.0011407466,0.9978929,0.0009664528
Slow Growth Saturation within the organization Movement from one cadre to another is difficult,0.9990004,0.0008636327,0.00013600195
Unicef is good work company,0.00025444303,0.00040486926,0.9993407
Unicef is v good company,0.00035552663,0.00342019,0.9962243
International travel and experiences means even the same job can be very different vas you move to another country,0.0028057878,0.9963941,0.00080004305
Some countries difficult to have spouse or family,0.9989079,0.0009681898,0.00012381299
Very Professional yet Friendly Environment,0.001148781,0.0033476865,0.9955036
Contract base job mostly which are sometimes yearly and sometime 6 months,0.00034141453,0.99901545,0.0006430437
UNICEF is a great place to work it could help in diverse understanding of the profit and nonprofit sectors and policy development It could bring a depth of experience and understanding to ones professional life. Furthermore it will improve interaction with government departments in settings ranging from conference appearances to office appointments to donorassociated meetings.,0.0010813235,0.0016222235,0.9972965
I dont think there are any cons for working in UN,0.0008737217,0.9987103,0.0004159733
Having offices around the glob and having lot of opportunities to work in different areas of the world and to help the deprived children and women.,0.001741852,0.0054294583,0.99282867
Transferring and promotion system in UNICEF is not very good.,0.99898857,0.00085616414,0.00015531802
Very good for employees providing health  and life insurance.  Mostly hire employees on a proper UN contract even for temporary appointments.,0.00030524904,0.00029375142,0.999401
Usually offer short term contracts.,0.0014106169,0.9966366,0.0019527503
Good employees management Handsome packages Renowned Organization My dream as well,0.0004886136,0.0019411666,0.9975702
being an employee at UNICEF i am very satisfies with my job.,0.0019607628,0.98891115,0.009128026
To work with international organizations with multi cultural teams,0.00050670654,0.030210817,0.9692825
Feel nothing to work with international organizations,0.99828184,0.0015753426,0.0001427874
Great place to work at.,0.00030895477,0.00028343144,0.99940765
Working conditions could be better,0.0012445402,0.99833775,0.00041778013
yes this is very good,0.0023062536,0.10742942,0.89026433
there are none such bad,0.00033838567,0.9991041,0.0005574654
I like it very much,0.0005348303,0.9965838,0.002881301
Nothing always available for you,0.0005696552,0.9991041,0.0003262038
From the help of glassdoor,0.00057314575,0.8476545,0.15177234
Plz support me im family supported person,0.0011119075,0.9973775,0.0015105294
Friendly  Knowledge sharing  Conducive environment,0.0001575605,0.00016378013,0.99967873
I am a volunteer here and being living in a  metropolitan city like Islamabad the stipend they are giving is very low.,0.99888223,0.00096167374,0.00015613281
Environment Openness Personal Development Exposure structure,0.0011194149,0.7604189,0.23846172
Pay scale Increments staff development global support,0.006428616,0.12462118,0.8689502
I spent four years at WaterAid and it was the best place I have ever worked at. The UK brand team has a great focus on creativity in storytelling. People are mostly appreciative of the work you do. I got opportunities to showcase my work internationally.,0.00020672414,0.00025866582,0.9995346
The culture slightly changes with new people coming in.,0.0005432075,0.99837637,0.0010804049
Good company to work in,0.00040162826,0.0003383917,0.99926
Work life balance is missing,0.9761177,0.023734316,0.00014796594
Agile development and welldefined policies,0.0010507324,0.0012051441,0.9977442
Less salary as it is not attributed to workload,0.9963965,0.0034367118,0.00016694394
Overall nice experience working with multinationals.,0.00034011822,0.0016756294,0.9979843
National Management making the working environment worse. and contract types are always disturbing with no promotions once seniors got FT's and Indefinite contracts.,0.99909616,0.0007540994,0.00014968571
Very good working environment motivated staff to achieve zero hunger.,0.0005205499,0.0003713558,0.999108
Funding gaps access is not provided for provision of food to the needy people.,0.9990864,0.0007538055,0.00015982964
Best organization provided the conducive environment for professional growth,0.000292848,0.00023552102,0.9994716
Humanitarian organization and during emergencies sometime its difficult to maintain the balance between the personal and work life,0.9981329,0.0017277943,0.00013935202
Great organization  Good benefits and package,0.00021591599,0.0001910441,0.9995931
No cons of working at WFP,0.998135,0.0017243116,0.00014062593
Good working culture and salary package,0.0010703492,0.0006295806,0.99830014
Nothing much except less career growth,0.0003779689,0.99922943,0.00039263477
Good organization to work with,0.00021442384,0.00021783874,0.9995677
Very beaurocratic process something tiring,0.99856585,0.0012711543,0.00016292583
They provide alot of allowance with salary,0.98975384,0.008158542,0.0020876634
You have to work broadly all over the world,0.0022471566,0.9972367,0.0005160087
I have done my job. World health organization is a very good organization,0.0009004961,0.0036876523,0.9954118
Good but to tough for new ones,0.00065131544,0.9981219,0.0012267049
Good salary along with less work,0.15375346,0.084467866,0.7617787
No career growth and contractual positions,0.9990183,0.0008447722,0.00013692059
I gained a lot of invaluable experiences. Working here brought me a sense if satisfaction because i knew i was helping people. It helped me interact with new people. It helped me view things from a different point of view. It allowed me to step out of my comfort zone.,0.00043886667,0.0030039356,0.99655724
Sometimes would have to work after hours. The office was far from where i live. The coffee wasn’t nice. There weren’t any separate male and female washrooms. The lunch breaks were short.,0.9989807,0.00085871277,0.000160491
Its an international organization with lots of potential,0.0005695406,0.0025096461,0.9969208
The work load and level of professionalism required is very high,0.99833655,0.0015068036,0.00015658134
One can learn a lot with sealed lips,0.00080688036,0.99859077,0.00060234906
In an organization and particularly in the emergency programme like Polio it’s the manager who can get a below average worker deliver outstanding and it’s a manager who can make an outstanding worker below average. Outstanding organizations provide conducive and professional environment to their employees and with grief and sorrow I wish to inform you that the same is getting worst in this organization. Favoritism autocratic culture and job insecurity is actively prevailing which is resulting in demotivating the employees. Dirty politics is going on. low competency females have given an un due edge because of their closeness to the programme manager. Managers think that they have hired the staff as their personal servants. Admin head leading the technical staff.,0.99773836,0.0019841525,0.0002774629
Serving the humanity health care eradicating polio (a menace on this world),0.97079843,0.02416644,0.005035153
Glossceiling very rare chance of promotion less aknowledgement,0.9987079,0.0011668279,0.000125302
I am a part of Polio Eradication Program my aim is neat and clean pakistan from Polio Virus,0.0017045408,0.82298696,0.17530853
WHO is not providing any benefit to us,0.99905187,0.00080269866,0.00014538098
Because the BCI Project is our Agriculture related with cotton crop,0.0003129579,0.99794215,0.0017448269
Still nothing is in downside,0.00040503158,0.99902284,0.0005721514
 Amazing international network which can be used to cater to your own learning and growth  PD & Safeguards teams are the best ones to work with  Access to the field as offices all across Pakistan,0.00021403625,0.00018219861,0.9996038
 A sausage fest at the senior management level   Lack of innovation due to staff working for 10 years who continue to recycle old archaic material   Prevalent sexism in the organization   Terrible HR there is no means to complaint and if you do they treat it like a family matter   Bullying by senior colleagues... very sarkari system  Toxic work culture where everyone gossips... you cannot trust people   Works with donors that are renowned to harm the environment... essentially helps green washing process,0.9989951,0.00084439333,0.00016047986
Good Organization in term of their objectives,0.0003601697,0.00069323595,0.9989466
Low Salary Packages for employees,0.99918884,0.000632763,0.00017840377
Conservation of natural resources and community development,0.1691399,0.04933997,0.7815201
No more funds for conservation of natural resources and local community development,0.9983089,0.0014714835,0.00021958804
Amazing learning opportunists but it has its limitations.,0.026572185,0.9713221,0.0021055953
The salary is not great they need to reevaluate it.,0.99861944,0.0012109424,0.00016967059
 Helping the environment  get to learn about different animals ( Depending on your project)   Great like minded people   Great experience moving forward,0.00014851704,0.00021102933,0.99964046
it was very difficult to get a hold of the management  most of the jobs were internally accessible i had to work my way up through volunteering to qualify to any paid job,0.9988507,0.0010007758,0.00014843156
Space to innovate and grow your job roles,0.005042973,0.98459804,0.010359053
Tall structure slow paced and bureaucratic,0.9986859,0.0011743952,0.00013969743
Nature conservation Casual style of working,0.00039133255,0.9966878,0.002920772
Claustrophobic procedures Poor management issues,0.99913675,0.00069320755,0.00017012686
This is good for work,0.0002871751,0.00052521605,0.99918765
But i don't want to work any more there,0.9891482,0.010734229,0.00011760279
