Comment,Negative,Neutral,Positive
Best Place To Work Here,0.00039829026,0.0004543781,0.9991473
There Is Nothing Bad there,0.0003986066,0.999022,0.0005794207
The culture is totally amazing,0.0011452431,0.018406712,0.98044807
There are no cons or what so ever,0.00041703612,0.99901664,0.00056626374
All Good in this society,0.0078990655,0.2401843,0.7519166
Nothing Is bad in this society,0.0011336618,0.9978004,0.0010658882
international collaboration teamwork facing and coping with real challenges,0.0017469279,0.9934596,0.0047934894
very competitive environment you have to compete at international level,0.9988374,0.0009958085,0.0001668716
It's good for new comers,0.0001437524,0.0003400139,0.99951625
Timings are tough for new comers,0.9939254,0.0059740227,0.000100631296
Good salary Five days a week,0.010212116,0.004258229,0.9855297
Distributed team very poor coordination,0.9990295,0.00083995797,0.00013049995
Open communicationSafe environmentStrictly follow the rulesTrained StaffProvide opportunities to communicate and explore your field around globe,0.00024410318,0.0002380893,0.9995178
They expand and shrink the operations which effects the job stability,0.998718,0.0011578791,0.00012418309
Organization committed to assissting some of the most neglected identities on the margins of conflict and postconflict societies. Very gratifying to work on issues with great positive social impact potential.,0.00041455458,0.0006160364,0.99896944
The HR mechanisms are confused and usually at loggerheads with other operational components like support. Costsaving incentives for certain departments translate into cutting down pays accomodation and other facilities that should come with the workload coupled with extremely low pay packages for resident staff.,0.9990081,0.00082684425,0.00016503027
Humanity Discipline management administration all areas are best,0.0061291233,0.95282745,0.041043438
There are some areas need to be improved but dont want to specify,0.0005764851,0.9991524,0.00027112238
Good salaries and packages with other benefits,0.0063010533,0.003458456,0.99024045
No job security and contract can end anytime.,0.9991314,0.0007275464,0.00014119573
Work Culture is outstanding. Leadership is too good. Benefits are awesome,0.00039091485,0.00053337385,0.99907565
Nothing Observed any thing like that,0.00029702595,0.9991036,0.00059937354
One of the best if not the best organisation to work for. Best working culture an organisation can provide. And best place for female staff members as it provides home like environment,0.00071518717,0.00067774,0.9986071
The work life balance is nit so good. If you are a good worker you'll have a lot to do,0.005424569,0.99423134,0.00034405175
Medical Benefits Leave Benefits Career Grow Salaries environment Gratuity Extra activities,0.0002485947,0.00041713208,0.9993343
Increments annually No provident fund,0.0011052677,0.9985133,0.0003814455
Good place  fastpaced  excellent  cooporative Collaborative Helpful,0.00014934014,0.00016812346,0.99968255
High pressure fastpaced deadline  time boundness  too much work,0.9988944,0.00091678207,0.00018881707
Islamic Relief is a faith based INGO. Best part of Islamic Relief is that everyone is willing to help each other.,0.00027034883,0.0010031328,0.99872655
I wish that i can work with islamic Relief in future because my contract was for very short period of time,0.99828535,0.0015982614,0.00011636006
faithbased organization charity focus Muslim charity good place to work at,0.00015943279,0.00018967123,0.99965084
career progression unstable weak retention rate No career growth for female in particular,0.99896705,0.00091019756,0.00012278753
Avery good brotherly  envoirment with a very strict accountability,0.0012789206,0.0026448094,0.9960763
It is faith based organization,0.00092618936,0.94289684,0.056176983
Job is related with my specialization.,0.00064859696,0.9980014,0.0013499109
Hamdard University is far from the main city.,0.99453557,0.0053234156,0.0001411335
Beautiful place. Good for learning and gaining experience,0.00025239374,0.00027412942,0.9994735
Not for the long term.,0.6989396,0.30057812,0.00048233726
They have given me a felxible working hour arrangement which enables me to attend to other hospitals,0.0010918815,0.0055891112,0.99331903
Low salary is a downside,0.9990682,0.0007783886,0.00015345456
provided pick and drop facility,0.0018094766,0.16326724,0.8349233
nothing to change  same work always,0.0006156136,0.9984547,0.0009296698
Employee friendly organization with great values,0.00019953815,0.00019959446,0.9996008
I could not find any cons yet,0.00040840582,0.9992899,0.0003017145
Very structured organization with good perks and benefits,0.00023059025,0.00038989654,0.9993795
Frequent field visit were required,0.004802408,0.9949421,0.00025548192
International NGO Professional & multicultural environment,0.0006515131,0.031128256,0.96822023
Job continue till project life,0.00046624854,0.9987018,0.0008319332
 Authority to Coordinator is immense at field level  Competitive Salary  Good Perks (OPD allowance insurance etc.),0.00035607634,0.0007424341,0.9989015
 The organization is still evolving at the field implementation level and the pace is not that constant so it gets some times confusing for the teams,0.9980849,0.0017818979,0.00013321148
Here is one word satisfactory.,0.00045868396,0.9980782,0.0014631564
I can not think of much beyond bonus structure.,0.00027744618,0.9991178,0.0006048619
The Advantage delegation will be held in the Agencies in August and Course Course action.,0.00022553686,0.9971859,0.0025885983
Neigateo's spectacular meeting was held the staterun registrar of its general interest was resolved.,0.0009193268,0.02670697,0.9723737
A 1200 beded hospital with excellent patient management and very coperative staff .,0.000576643,0.0006252319,0.99879813
Very busy hospital and have hectic duties,0.9990491,0.0007924397,0.000158399
it is a tertiary care teaching hospital affiliated with one of the most prestigious institutes of Pakistan i.e Khyber medical college. it is equipped with modern facilities. very competitive co workers. optimum pays and facilities for doctors.,0.0030464602,0.003791011,0.9931625
adminstration is still working out the proper way of  managing  the very high influx of patients in terms of cleanliness atitudes of lower staff to the patients and students.,0.99211806,0.007604341,0.00027762877
no other job available at that time,0.00092615956,0.99880874,0.00026514765
stupid and always late for salary,0.9991799,0.00065611914,0.00016402066
Those who ready to do work at minimum wage has no other source of income can do job there. if he is intensified by the unemployment in country.,0.9979061,0.0019557264,0.00013818186
Lack of Superior Skills Senior Management follows boss only boss oriented work culture no benefits no good pay load of work undefinable totally disturbed work life balance.,0.9991762,0.0006604428,0.00016327824
Ones best friend is oneself,0.0005298516,0.98141634,0.018053796
Thanks for dealing & giving me chance,0.008838878,0.15559804,0.83556306
I like to work in field with people and I want to improve my skill and want to communicate with people,0.0006787686,0.9988164,0.000504868
Always do best and prove our ability and I will try my best for it job and I can prove my self if I got chance,0.0045655747,0.99020326,0.005231088
Good and a great job to provide proper care to people!!!,0.00032466545,0.00023640199,0.99943894
Mistakes may creating a big problem,0.9984189,0.0014307487,0.00015037594
Easy nd perfect for me,0.0012345188,0.9928975,0.0058678966
Its really beautiful good job for me,0.0017354157,0.022722755,0.97554183
No corruption & Help the poor people,0.9949096,0.004731859,0.00035853309
Never salary Re wise,0.0010263885,0.99833554,0.0006381469
Professional atmosphere chances to learn,0.00032765276,0.9980398,0.0016326255
Very authoritative nonlistening senior management,0.9945253,0.005366438,0.000108183696
Will able to explore the life more easily.,0.001622944,0.733176,0.26520112
have no concerns to work with.,0.00059212587,0.9991868,0.00022110286
Keep up the good work team,0.008594129,0.040950004,0.9504559
Nothing to add here  great stuff,0.0004437797,0.9981421,0.0014140178
Health & Safety and Environment,0.0016543817,0.99589044,0.0024552697
there is some worker Salary Issues,0.44953868,0.55003095,0.00043040313
Great place to work with. Helping provide awareness for family planning.,0.000175219,0.0001735167,0.9996513
not being able to reach a small percentage of clients in field due to the country's culture issue.,0.99891055,0.0009653297,0.00012404438
International NGO 5 day work week,0.00057143625,0.9599047,0.0395238
Salary and increments were minimal  No bonuses  Bad politics Unprofessional management,0.9992078,0.00062505866,0.0001671444
It was long journey of 20 years' With this nonprofit organizations. but my Job Redundant due to shortage of funds because of Covid_19.,0.99905497,0.00079444196,0.00015057508
Previous management is almost changed so there is no charm to work here department and project wise political game is on to secure their job.,0.99855334,0.0012941972,0.00015244265
Flexible timing good salary and benefits,0.0010396031,0.0007215071,0.9982389
No job security favouritism and goupings,0.9991033,0.00074268493,0.00015404164
Friendly Environment throughout the organization,0.0001932834,0.00021722217,0.9995895
Downsizing all the time after every 4 months,0.99882954,0.0010519491,0.00011844753
Affiliated with an international NGO (Marie Stopes Society).,0.9988471,0.001015615,0.00013731096
They do abortions and operate partially under the lines of ethics. The management is run by a bunch of socialites who care nothing about the people they claim to serve. No regard is given to employees either. Poor benefits. Opportunistic people. Very high turnover.,0.9990465,0.0007724525,0.00018097863
Well developed policies and procedures,0.13950652,0.22226317,0.6382303
there is low Salary package,0.9197045,0.080003366,0.00029223267
A healthy working environment and from a learning point of view it is a good platform,0.00017338108,0.00018679468,0.99963987
Low salary packages and low monitory benefits,0.99906677,0.00074233284,0.00019096701
Muslim Aid since 2005 through its socioeconomic tangible and infrastructurebased projects are uplifting the vulnerable communities of Pakistan in the sectors of safely managed water and sanitation services access to education sustainable livelihoods health emergency response and resilience building.,0.00021436489,0.00030686244,0.99947876
Muslim Aid very good INGO,0.0005053751,0.99026805,0.009226656
Flexible environment learning opportunity  growth,0.00017950204,0.00018255149,0.99963796
Hi turn over of staff include higher management. Lack if consistency in policy snd regulations,0.9989497,0.00090243184,0.00014786371
Msf is an International humaintrain organization Msf work in EmerganciesMsf helping and provoiding medical facilities in poor areas . I am very to worked with Msf. They provoided National/International trainings to staff,0.0039235717,0.14741622,0.8486602
Msf need to find more places in karachi and start activities in  Karachi,0.00053807406,0.99880123,0.0006606563
not even a single benefit than salary on time,0.99896336,0.0008809836,0.00015562546
try to keep distance from dis org,0.00044847422,0.99868983,0.0008617593
nice food and good colleague,0.0002696425,0.00042172644,0.9993086
i can not think of one,0.0003299376,0.9992415,0.00042854567
in New school i complete my education carrier because i have lot of time to studies and enhance my potentials and spread my knowledge to other,0.0011824673,0.97241193,0.026405497
in school there are so many back bitters and dishonest persons who do not want to done his/her work but they always point out their subordinates,0.99896336,0.00088784704,0.00014873157
Best company in the city,0.0004282296,0.00042327412,0.9991485
No faults uptill now bro,0.00049040746,0.99834776,0.0011617434
 Worklife balance Perks at work Cool working envioronment,0.0006047224,0.16532026,0.83407503
Nothing at all I guess,0.00029474258,0.9990779,0.0006273352
Healthy environment balanced. Good learning opportunities.,0.00018052084,0.00019524412,0.99962425
Lack of appreciation. Fire people frequently.,0.9991153,0.0007323925,0.00015238335
Because He is Experienced Person,0.0007304917,0.944926,0.054343503
Struggling Honesty Time Spending Faithfull,0.22002351,0.77963954,0.00033700233
medical laboratory technologist in hospital,0.0007920977,0.9976762,0.0015317714
Technologist Technition computer assistance assistance in lab managment in lab,0.00037498612,0.99694985,0.0026752383
I heard very well about it across the globe,0.0002974834,0.9989147,0.00078780693
There is nothing downside for working here,0.0004186448,0.9989711,0.0006103044
The opportunities for growth are endless.,0.0005543223,0.0010433675,0.9984023
none. I've had an amazing career,0.0024703392,0.9919559,0.0055737523
Amazing management  A lot of opportunity for growth Great benefits and compensation,0.00035567005,0.00025042443,0.99939394
None I can think of,0.00027135984,0.9992467,0.00048200946
creative freedom in communications department,0.00047805373,0.0012411317,0.9982809
complex processes in HR and procurement,0.9944523,0.005367648,0.00018006894
Rights based campaigning  Passionate to bring women rights issues for policy reforms  International networks to advocate human rights,0.00028188407,0.0005281069,0.99919003
Too much lengthy procedures for approvals  Topdown management style,0.9991141,0.00071559596,0.00017036704
I found Oxfam as a good working environment,0.0002089485,0.00059830135,0.9991928
Staff turn over is a major issue,0.99895525,0.0008781074,0.00016660393
Oxfam provides extremely best flextime and exposure to countries,0.00063351856,0.0015173012,0.9978492
Oxfam is leaving Pakistan in 2022 this is heartbreaking,0.99807274,0.0018192773,0.000107940956
good workplace Good benefits good management,0.0004009316,0.0003260384,0.999273
Slow growth due to nature of the field,0.9989544,0.0009270317,0.00011851953
Bonus if you get some,0.0016444677,0.4700224,0.5283331
Too many to list here,0.00065752934,0.9989262,0.00041615768
 Good Working Environment  Good Health Insurance (Self Family & Parents)  Internal & External Trainings  Own Its Employees,0.00024451117,0.00024042741,0.99951506
 Low Salary Packages  For Some Slow Growth,0.99911326,0.0007309312,0.00015578826
Good place to work at specially for females. Market competitive perks and benefits. Management is very much cooperative.,0.00021294814,0.00019970183,0.99958736
So far none except that overall working environment can be made further better.,0.00070680014,0.9989773,0.00031592278
you have to meet educated people community.,0.00080812286,0.99802846,0.0011635083
No Carreer path for the employees,0.93226707,0.06748395,0.00024890463
Competetive salary that can easily be benchmarked with any MNC in market. Caring local management with few exceptions that can be tolerated though. Great diversity and fantastic work culture within most departments. Overall a great workplace.,0.00095320656,0.0008386413,0.99820817
Over complicated processes and too narrow authorities that shows distrust on management.   Talented and competent people often get compromised over politics of incompetent but cunning pople at both local and group level.  The Group's standard of suspicion and level of distrust on local management often results loosing trustworthy and competent people without even a reason known to local management.   Career of taltented and competent people got compromised and sacrificed due to unsettling and often complicated reorganizations by Group Management which often causes hiding competence over diplomacy and just long but unbeneficial experiences this is the very reason that none from Pakistan Office has moved ahead in career on any international position over more than 3 decades. Many top people have been there for ages neither they move anywhere nor people under them get any better opportunities.,0.99867624,0.0011778761,0.00014582809
Friendly environment & supportive team members,0.00017570442,0.00017879487,0.9996455
To be responsive and pay attention to details.,0.07681725,0.91811424,0.005068565
A good institute having best environment,0.00019896832,0.00020762386,0.99959344
New environment and new people,0.0037845192,0.70333034,0.29288518
Good food nice office and good medical facilities,0.0002939732,0.00026295934,0.9994431
No direction no strategy and overall bad management,0.9987979,0.0010641403,0.00013795074
A best company to work with one of the finest employers in Pakistan,0.0002623908,0.0002414343,0.9994961
Slow Growth opportunities as it is not a very big company sector is also not very big,0.9989054,0.0009809586,0.00011359362
Good company to work with.,0.00026187988,0.00024744752,0.9994906
Not progressing now a days due to Single national curriculum issue in Punjab and COVID,0.9987619,0.0011194502,0.00011875089
Working on books and educational materials,0.00025676674,0.0018199676,0.9979233
Toxic environment senior management hierarchy dinosaurs who have been there for decades just need slaves for labor. They are not going anywhere and they make sure that you don't either.,0.9989838,0.0008713574,0.00014481277
Worst working environment  Too much politics Treat harshly with female staff,0.9990701,0.00077791256,0.00015201504
Data Protection act breacher They provide wrong reference if you are not on good terms with Senior team,0.9976544,0.0022079544,0.00013767312
While there are different types of managers and cultures in different departments the general experience is that you find supportive and empowering mentors who invest in your growth and development. All tools and softwares you require to work are made readily available to ease your daily workload. Great worklife balance. Group leadership seems motivated to improve the present stage of branch in tern of digitalization and coordination of processes and full accountability and transparency of practices.,0.0006048516,0.0007487041,0.99864644
 The systems and practices are old and not properly laid out. Interdepartmental coordination is lacking. Seems like departments work in silos.  Repeatedly changing project outlines received from SMT hinting at their own uncertainty regarding execution.,0.9991217,0.0007360133,0.00014221876
Competitive Packages as per Market,0.00085969764,0.9977615,0.0013787647
Highly Seasonal workloadNo career advancement,0.9990453,0.0008109858,0.00014362029
More learning Good experience Book lover Learning about academic activity,0.0001946382,0.0005911496,0.9992142
Very low scope Salary is too low,0.99910223,0.00074527285,0.00015257504
Good working environmentstrict compliance and ValuesCompany upholds strong Values,0.00032173912,0.00026025728,0.999418
Limited players in the industry. relatively smaller industry,0.9986272,0.001256687,0.00011624438
Medical Meal Transport Benefits are best,0.002710214,0.40942752,0.5878622
Senior Management Team of Pakistan's decisions are worst.,0.9990421,0.00081282604,0.00014505883
its best company in pakistan for education.,0.0006628458,0.00095847266,0.99837863
no down side at this company,0.9985892,0.001225183,0.00018558679
Good benefits job security stable business,0.0004034017,0.0004990763,0.9990976
Branch is very different from Group in terms of culture leadership and openness to improvements. Also considering its a flat organization and people stay for decades there are not many vertical growth opportunities.,0.99588037,0.003993188,0.0001264812
it is one of the best MNC in Pakistan,0.00043518856,0.0006431088,0.99892175
Slow career progression in company,0.99917406,0.00068728236,0.00013861895
 Better payscale as compared to other publishers in Pakistan (especially if you have spent more than 10 years with the OUP)  Good medical benefits (not common in most of Pakistan's corporate sector),0.0005884512,0.0006407733,0.9987708
 Management is living in decades back time.  Socalled HR organization. Infact it's a oneman show runs by MD.  High rate of professional jealousy and politics among senior management and staff suffers after all.  Several new techbased solutions are being introduced in the name of streamlining the work and better productivity. The reality is they are slowing down the work as many employees are not techsavvy even management knows nothing of technology. Employees are forced to do double work: one on techplatforms and then manual workflows for approval (paperwork).  MD can fire anyone anytime without even issuing notice or serving onemonth notice period.  Lack of decision making authority or ability. Senior management fears of MD and everyone wants someone else in management to take decision to remain on safe side.  Fingerpointing. Everyone tries to blame other.  If you are good at work and one of your team member is incompetent but in good book of MD you're in serious trouble. You would have to work not only yours but also of your incompetent teammate. Your teammate will go on time each day and you would have to do over time to get work done.,0.99812573,0.0017196605,0.0001545407
Good people to work with excluding management and above. Good benefits and decent salaries insurance for parents which is excellent. If you manage to stay under the radar it's a good place to work.,0.000429991,0.00049701554,0.9990729
The Managing Director and the Senior Management Team: the entire SMT is comprised of cronys and flatterers of the MD.  No autonomy of any kind; nothing can be done without the MD's approval Nepotism is flourishing If you're in the MD's good books you'll never do anything wrong. If you're not you'll never do anything right,0.94795746,0.050765153,0.0012774251
Good pay and benefits but that's about all.,0.015929965,0.9684079,0.015662098
No training and no clear expectations set. Poor adherence to basic publishing and English language standards. Poor editorial quality control. Editorial processes are inadequate and lead to embarassing errors in published books. Frequent and dire miscommunication within the editorial department encourages errors. My manager was out of touch with her team. Poor worklife balance. Management slow to act even when faulty processes are evident.,0.9991412,0.0007025265,0.00015625836
Good medical car policy fuel allowance,0.0009255488,0.0014207142,0.9976538
Very limited growth opportunities and very less exposure to international markets,0.99917054,0.00069999625,0.00012950835
Transport Food and .... well I am not sure,0.0002571385,0.99920326,0.000539554
Hmmmmmmmmmmmm Don't have words to begin... Cyao,0.0009933674,0.99875784,0.00024881383
Friendly working environment Informal company structure,0.00016359444,0.00017546283,0.99966097
Informal company structure Vague working guidelines,0.99778545,0.002098783,0.0001157735
Transparency team work best policies good management and Equality,0.00093853753,0.0008309108,0.9982305
Suddenly project closed job insecurity,0.9953088,0.004587592,0.00010360553
Good Organization and has ability to retain staff with all facilitations,0.00040970702,0.00037987783,0.99921036
I don't have any negative aspects to work with current organization,0.00056740653,0.9991456,0.00028687448
There is a very Learning Environment,0.0009956353,0.06463366,0.9343707
there are no Cons to joining Pathfinder,0.00029196023,0.9989784,0.000729657
Great team and environment rewarding work,0.0006106192,0.00043293153,0.99895644
Project based small team so work pressure can be heavy,0.99904245,0.00081305654,0.00014449832
good job enviorment salary  is little low,0.25040206,0.7162772,0.033320814
its a good place for work,0.0003016468,0.00043253682,0.99926585
I enjoyed very working with Pathfinder International.,0.0004690322,0.010834695,0.9886962
I don't think so or ever seen any downsides while working with Pathfinder.,0.0003957049,0.9991153,0.0004890634
translation English to all language copy paste work background remove and,0.00039420163,0.99849606,0.0011097394
remote us job work home,0.0005878357,0.998599,0.0008131697
Best Place to work with best systems,0.0002637781,0.00029311544,0.9994431
Project Based Short term projects,0.0009184668,0.9931861,0.0058953217
Fair competition. Plan provide equal opportunity to internal and external candidates of both gender,0.1403242,0.7439076,0.115768194
Overlapped lengthy process always procrastinating the initiation of projects and lead to hustle.,0.9990879,0.0007455242,0.00016649278
Confident organization. International representation.  Bold thematic areas. Decent HR policies.,0.00022222403,0.0003920926,0.9993857
Micro management.  Decentralization.  Lengthy procedures to follow.,0.0631233,0.935277,0.0015997421
Looking for vast area of experiences benefits easy to work,0.00026016467,0.00037336096,0.99936646
no trainings specific to the finance field not motivation appriciation and work burden have no measurement. .,0.99901783,0.00082531996,0.00015689828
Competent salaries reputable works throughout country,0.035452567,0.040402234,0.92414516
Only management team is involved in decision making. Team work not emphasized upon,0.7565363,0.112590216,0.13087343
great environment good management healthy work delegation career planning visibility.,0.00019892871,0.00019964599,0.9996014
threats introvert closed specific mandate not for profit,0.9972404,0.0026527129,0.00010682759
Flexible environment  great team,0.00018008068,0.00018217684,0.9996377
less learning options with latest tech,0.9987501,0.0011246004,0.00012521063
Great Culture High performance is valued and appreciated Thin and lean team Immediate access to global expertise Lost of local and international exposure,0.00032112855,0.00030462584,0.99937433
