Comment,Negative,Neutral,Positive
Nice teammates at the office,0.0002695225,0.0006074953,0.99912304
There is a social gap between the National staff and expats,0.99843615,0.0014096557,0.0001541671
Room for growth and friendly environment,0.00030295315,0.0004728779,0.9992242
Less pay and benefits for staff,0.99912435,0.000702731,0.00017298716
Great place to grow your career and learn make mistakes as well as get international exposure starting at entry levels of work. High levels of professionalism,0.0019164676,0.0013291374,0.99675435
Pay still needs to be competitive.  Benefits need to be improved for international staff as well as local staff.  You can get into precarious positions if you get involved in the organizational politics.,0.9937757,0.0060363696,0.00018786386
It has a religious Christian background,0.0007180665,0.9975636,0.0017184363
Salaries are a little more conservation little attention given to employee career advancement,0.996906,0.0029355376,0.00015843044
It is a seventhday adventist organisation that give me freedom to worship on sabbath.There are on job trainings that enhance my career and the prompt salary payments,0.00047341603,0.00040095774,0.99912566
There is no career development in regard to climbing up the management ladder. There is few staff motivation and no retention of staff.poor staff welfare,0.9991037,0.0007274423,0.00016879672
It pays salaries on time,0.8000621,0.089394204,0.11054375
it has all decisions taken at the top,0.0010187186,0.9985676,0.00041367745
To improve people's lives,0.9986494,0.0011818085,0.0001688455
Noi think downs for joining the organization,0.00060588965,0.99902,0.00037401807
AHF is great team with so many IT projects to learn from every single year,0.00032016542,0.0004377186,0.9992422
Working pressure can be too much sometimes as the program has over 52 sites in the country that require IT attention,0.9987205,0.0011049104,0.00017455089
Help those leaving with hiv /aids regardless of the ability to pay,0.00073064276,0.9986234,0.0006459869
Probably drug stockouts at the clinic,0.003036676,0.99657035,0.00039303934
They pay in time and the working environment is friendly,0.00048300842,0.0004390948,0.9990779
They end your contract before you know,0.9968803,0.0029685758,0.0001511735
Always get feedback on your performance,0.99763787,0.002219798,0.00014234325
Benefits need to be revised,0.0041689146,0.99533087,0.0005002773
Being able to support the vulnerable,0.0018055935,0.0028631643,0.9953312
Limited exposure in knowledge and growth,0.9988738,0.0010091293,0.0001170922
Transport to and from field locations,0.00056475785,0.988345,0.011090266
Very high staff turnover due to poor management,0.9991411,0.0006907597,0.00016819769
Equal opportunity and good working environment,0.00032395023,0.00022894636,0.99944705
Salary scales are slow compared to the rivals,0.99837756,0.0015100207,0.000112293645
it has the best core values and missions that are for pro people,0.00034404342,0.00080328016,0.9988526
salary is low since the standards of have increased,0.9990502,0.0007872116,0.00016255325
i acquired management skills in multi cultural setting,0.0004910238,0.98495066,0.014558349
The contract ended shortly while more work need attention,0.0033363022,0.99645585,0.00020789124
Good and appealing to continue work,0.00019168943,0.0003744145,0.9994338
Little worklife balance and time to do other personal stuff,0.99799514,0.0018483232,0.0001565593
Great organization with good pay.,0.001134722,0.00065970083,0.99820554
Work overload on staff with too much pressure,0.99908364,0.0007259194,0.00019046589
gd working condition and payment,0.025031235,0.9743333,0.00063539954
workload with no overtime compensation,0.99910164,0.0007111642,0.00018726794
Baylor Uganda Pays well her employees and have well writes systems to support her operations,0.02840007,0.15889432,0.81270564
There is discrimination in staff development. Most units are understaffed which creates a lot of work to staff and ultimately lead to staff turn over. There is no all staff involvement in decision making. Decision made at senior management do not fit the real work environment since people that do the actual work are not included. There is a tendency of working in silos which makes work environment difficult.,0.99909484,0.0007484237,0.00015672387
good work ethic and training,0.010267269,0.008368818,0.98136383
too much work for individual staff,0.9988254,0.0009778187,0.00019677334
Good employer especially for starters,0.00051537296,0.000976154,0.9985084
No development prospects as places are limited,0.99890494,0.0009868201,0.00010827706
because of the vision of giving a fulfilled life for every HIV child and their family in Africa.,0.065263726,0.20657377,0.72816247
no down side of the job,0.0039458736,0.9927961,0.0032579764
Baylor has good processes and systems that helps to improve working experience,0.030670205,0.087594666,0.88173515
Baylor doesn't consider non medical employees as more important in delivery the over all objectives.,0.9983687,0.0014875797,0.00014378139
Flexibility worklife balance benefits growth,0.0006876663,0.026151398,0.9731609
can't think of anything to be honest.,0.00037041842,0.99926096,0.00036850697
BRAC NGO is impacting many lives in Uganda and Africa as well.,0.38453472,0.61401737,0.001447877
BRAC NGO should be expanding more and touching many other lives.,0.0028565906,0.9962469,0.000896573
Am hard working trustworthy honest,0.0017750877,0.9973436,0.0008813624
It will be great working with this organization,0.00058266905,0.001187508,0.9982298
Exciting place to be and grow in your career,0.0001743533,0.0001958106,0.99962986
Tiresome with little time off,0.9991755,0.0006592432,0.00016517035
It's reliable and gives employees room to exercise there skills and grow there career,0.0012604148,0.0011085718,0.99763095
Sofer I have not seen any bad in my bank,0.00049005606,0.99898094,0.0005290168
BRAC has a gender friendly environment,0.00015467248,0.00020890415,0.9996364
Salary structure is a bit lower than the market,0.99892265,0.00094054354,0.00013687876
Free and fair during interviews,0.0017793045,0.007179428,0.99104124
Less than average pay compared to competition,0.9987919,0.0010564697,0.00015168152
After working with brac for at least a period of one yearyou are entitled to maternity leave of three months payable. They also pay and increase salary almost every year and ones salary depend on the time he/she has  worked with the organisation.  in addition there is a bonus for every year. A certain percentage of bonus is calculated depending on your salary.   For those who like field workmost of the work is for the field and you work away from but near your home district. so you travel.  Personally i like sharing experience with the less advantaged in society so brac provided the best plat form for me. I am grateful.,0.0034541208,0.028852439,0.9676934
At first is is very hectic working away from home and in remote areas of the country. Field that is not for the first time facilitated is so challenging. You spend  a lot on transport.,0.9985434,0.0012820296,0.00017462799
BRAC focuses on ensuing that the beneficiaries are the most important.  It offers a large community of likeminded people working to empower women and adolescents.,0.00022028908,0.00044939868,0.9993303
lower salary than average set working hours that are not flexible no set timeinlieu for overtime,0.9991885,0.00063046423,0.0001810945
A good organisation that could do better with some level of cultural sensitivity,0.018149288,0.64052135,0.3413293
Could improve on its deliverables,0.9642183,0.03549156,0.00029007834
A very good Employer. Very considerate pay to employees. :),0.0002978863,0.0002393369,0.9994628
None that i experienced. Everything exceeded my expectation,0.00061434746,0.9991616,0.0002240372
CARE is an equal opportunity employer,0.0094001265,0.0048274067,0.98577243
CARE Could do more around its organizational culture,0.0016387124,0.9979674,0.00039381825
Your company is exceptional and does well in terms of performance both for staff and program delivery which i feel its good for me to  join and continue delivering better services to the intended beneficiaries,0.0010619203,0.0016809088,0.9972572
Downsides is mainly when the team are not working together and supporting each other can lead to program failure,0.9988825,0.000980863,0.0001366557
Innovation and creativity that improves relevance of intervention,0.9979292,0.0019146949,0.00015610765
High staff turnover due to low motivation,0.999143,0.0006910374,0.0001658587
Beautiful place to work engaging work environment,0.00020134576,0.00018802402,0.9996106
Depending on your role it can be a very busy work environment. If you are intentional you will survive,0.011760453,0.9875453,0.00069419853
Good Website for support in URA,0.00016986999,0.00019531694,0.99963474
Questions being so many before you reach to what you want,0.6376408,0.36188713,0.00047211247
Good salary paid holidays and retirement benefits,0.0010302304,0.0005089259,0.9984609
Nothing much I can state for now,0.0003130954,0.998912,0.0007749119
pays employees well and teaches employees,0.06835539,0.52039486,0.4112498
delays payment for employees and do not give enough allaowences,0.9990287,0.0007819548,0.000189394
Moderate pay for middleskilled professionals,0.9988181,0.0010234535,0.0001583083
Poorly defined structure for staff growth,0.9991003,0.000745275,0.00015449725
very reliable organisation to work with.,0.00062338915,0.00068132963,0.9986953
I do not think it is applicable,0.11523371,0.88444006,0.00032624506
During my short time here working with DRC I have learnt that DRC is one of the best organizations in the world with clear codes of conduct policies that protects its staff persons of concern and the reputation of the organization. am happy with the DRC overall environment and staffs (national & International) they are very much supportive honesty skilled and experienced and always give room for mentorship I have learnt a lot in DRC especially In SGBV involving the SGBV community structure in SGBV prevention and response activities case management engaging the community in awareness sessions.  I am well satisfied with DRC Work environment and staff in general.  I would wish to work with you again in more challenging roles and positions.,0.002964339,0.052953355,0.94408226
No physical hand over of cases to the new staff,0.00085919653,0.9987802,0.0003605898
they promote development. peace love human rights,0.002767933,0.015231585,0.9820005
i don't know any yet,0.00032970248,0.99917334,0.0004969863
Capacity building and very good for cv,0.00020586733,0.00028642995,0.99950767
Little pay yet a lot of work,0.9991265,0.00066886056,0.00020460231
Good employee with living and active strategic and operational policies,0.00040925067,0.0004018835,0.99918884
Budgetary constraints attached to donor funding,0.99715686,0.0027087675,0.00013428951
quite responsive and am well with it,0.00049873005,0.9964923,0.0030089652
too much filling of forms,0.9979559,0.001901331,0.00014280612
Working with DRC gave me great experience working with refugees and host communities and have changed my perspectives of my career path I want to have more opportunity to support refugees.,0.015819648,0.17554004,0.8086403
More technical staff leaving the organisation at the time they are needed most Retention plan to be in place from senior management.,0.996651,0.0031648169,0.00018411932
It has the best environment for individuals who are growing career wise,0.0001684322,0.00023111969,0.99960047
The salaries for low staffs i.e cleaners drivers and assistants is too below compared to officers and managers. These  are the people who do a lot of work hence leading them to be demoralized,0.9990245,0.00080501137,0.00017037873
Its really  a nice place for career development and lots of field experience.  Team work is highly enhance.  Smart staff in organisation uniforms,0.00020228303,0.00022818048,0.9995695
Re numeration depends on negotiation power  Senior staff decision in respected,0.0033129607,0.99426657,0.0024205798
the organisation is more on tea spirit,0.00042780276,0.9989649,0.0006073668
Capacity building and promotions are limited,0.9989249,0.0009361001,0.00013901113
Team work and staff motivation,0.011461769,0.01373897,0.9747993
Limited resources which has sometimes frustruated field work,0.99917406,0.0006663308,0.00015962675
Welthungerhilfe optimizes utilization of funds for the intended beneficiaries.,0.0017298184,0.009446794,0.98882335
The decentralization of human resource management.,0.0030415372,0.0026463151,0.99431217
Innovative fastgrowing company with unparalleled opportunities for growth and professional development. Strong emphasis on mentorship. Entrepreneurial environment where you have autonomy to develop and implement new work. Hard work rewarded with flexibility. Strong mission and alignment of strategic decisions to impact.,0.00024301102,0.00021929419,0.9995377
Prospective employees should enjoy working in fastpaced environment with high degree of personal responsibility! (not a con just something to note),0.0053543984,0.8872141,0.10743146
Great place for learning professionally,0.00021330621,0.00022918356,0.99955744
Great place for part timing,0.0009981452,0.0041062636,0.9948955
Great overall  vision for youth with a passionate leadership team at the forefront and dedicated hard working staff implementing the program country wide. Impact is visible.,0.00022088294,0.00022016578,0.999559
Too much focus and passion on company impact in the sector and culture of the organisation. However this passion level does not extend to the staff leaving many demotivated.,0.9981495,0.0015891659,0.00026128467
A great place to start a career in public health with a lot of learning opportunities. The leadership structure is well defined.,0.00018378581,0.00017711242,0.99963903
Work pressure can get out of hand sometimes,0.99899524,0.00082166056,0.00018302558
I am hardworking competitive persistent to work good communication skills and cooperative.,0.0066745286,0.30490136,0.6884241
Lack of trust poor teamwork distrust,0.9989116,0.0009562586,0.00013215317
Build capacity there is team work,0.0034974446,0.7074974,0.2890052
A lot of pressure  but very positive,0.0010230368,0.99702734,0.0019496613
It has good systems with global backup roles.,0.00065178983,0.008687224,0.99066097
The organization is so donor dependent for project work,0.9989367,0.00090179034,0.00016151251
Timel payments and so interesting while in the field,0.0003213972,0.0033278253,0.99635077
Short term project and no resting,0.99852294,0.0013603014,0.00011678814
Diners at work birthday celebrations insurance minimum supervision,0.00039194556,0.9988996,0.00070854096
There is no transparency in this organization most times things occur without you knowing  There is no employee value nor development.   There is a tendency of employing friends former colleagues which can enciyrage fradulent or cindicate kind of behaviour. Some senior managers are inexperienced and make self interest decisions. IThe HR office lacks independency to make fair judgements,0.9989843,0.0008547906,0.00016091029
Good work environment were one can thrive when following the work procedures,0.00031794852,0.00037029848,0.9993118
There's no room for career growth at the ESAMI cluster especially uganda,0.99884796,0.000998457,0.00015358193
It is a very good company,0.00047839715,0.0013787912,0.99814284
there are no cons at all,0.00040975853,0.99908626,0.00050402025
The benefits are numerous including medical insurance bonus for excellent performance.,0.00028570445,0.0003298923,0.9993844
The pressure can sometimes get to you.,0.9960432,0.0037903583,0.00016645368
Good training and all round hands on financial experience.,0.0008546398,0.0008097071,0.99833566
Not advisable to stay long if your goal is career growth.,0.9838219,0.016021099,0.00015697382
Wonderful agenda to help communities,0.00020721136,0.00019685172,0.99959594
loans are too expensive and obiviously  profits have become more relevant than the original agaenda,0.9986583,0.0012021282,0.00013954457
Good salary Team building Good management Good employees Bonus pay to good performers.,0.000468723,0.00032993883,0.99920136
Rumormonger amongst company employees. less transport to the field.,0.99907625,0.00076349074,0.00016016995
International organisation very strong in Corporate Governance and stable source of funding,0.00033984488,0.00031883057,0.9993413
None atleast for the time I worked there,0.0006886942,0.99889755,0.00041368336
people and environment is very nice,0.00081856747,0.029155899,0.97002554
low salary  was working from a developing country,0.9985055,0.0013507265,0.00014374418
Great experience learning loads of support from ghc during the fellowship lots of professional development,0.00027925905,0.0002585208,0.9994622
The stipend is standard regardless of years of experience  only eligible for people under 30yrs of age,0.99769586,0.0021254339,0.00017867758
Private sector / market systems approaches taking root,0.0005833186,0.9887827,0.0106339585
Social capital model not yet entrenched in communities,0.98016787,0.019654058,0.00017810299
flexible in days for salary payment,0.0010912403,0.001073207,0.9978356
no cons realised in salary,0.00083262316,0.99873394,0.00043354725
it provides good learning opportunity,0.00021624034,0.00020023904,0.99958354
you have to be self motivated,0.0024460712,0.99600464,0.0015493814
They are a very friendly company.,0.00027988403,0.00084676186,0.9988733
rigid structures that are not conducive for advancement and innovation.,0.9990299,0.0008195416,0.00015066395
A good place to work with so many policies and strict guidelines.,0.000352068,0.0002918459,0.9993561
No worklife balance. Salary is not commensurate to position consider reviewing salaries especially for Field Managers.,0.9990662,0.0007770934,0.00015678351
You learn quickly and they let you work in a sector you haven't before. Managers understand and give time for problemsolving and give credit for their work.,0.006074527,0.01892977,0.97499573
A lot of work so overburdened most of the time,0.99916816,0.00063646416,0.00019546106
It's diverse ans people have warm engagements. RCTs are the norm and I have learnt to think more critically about change and data quality. A really good place to build your experience in research Impact Evaluation and RCTs.,0.00024220458,0.00096284685,0.9987949
Work load can be to heavy for people resulting into longer working hours in a single day but payment for all this seems to be incomparably low.,0.99912184,0.00069441134,0.00018379078
Dynamic work environment very smart people great for young people seeking field experience diversifying slightly more beyond aspiring econ phds you learn a ton not just with Stata but overall project management skills way more than I would expect in a different position,0.00037789438,0.0009936348,0.9986285
High RA turnover admin not the smoothest safety not as highly prioritized in Uganda as it should be HQ disconnect some PIs are brutal RMs usually stretched thin,0.99898,0.0008740577,0.00014590319
Great exposure to on the ground academic field work and see how randomized controlled trials are conducted in practice. Good opportunity to brush up on Stata skills while managing data flow and good experience to work/live in a developing country.,0.00018178984,0.00020705428,0.9996112
Can be a bit overwhelming managing the data flow process in the field. Learning curve is steep and need to be able to learn fast.,0.9985273,0.0013243932,0.00014834203
Great environment especially the country office where I worked.  The work is very interesting and ranges from office work to in the field experience. Own initiative is valued and it is a wonderful learning experience.,0.00020363307,0.00023064134,0.99956566
Workload can be a lot at times so this should be rewarded. Management from the US/head office is non existent.,0.9989503,0.0008851786,0.0001645626
 Great place to build experience in international development   Wonderful hardworking committed team  Great mission and values,0.00018042045,0.00016609812,0.99965346
 Week financial management systems  Limited staff support,0.999238,0.0006050088,0.00015697388
Hardworking team and good learning environment,0.00025272145,0.00021399236,0.9995333
Low salaries for local staff,0.99912804,0.00069884036,0.00017312182
To build and develop both the company and my career.,0.002429161,0.9771056,0.020465236
Working under pressure to meet deadline,0.9989674,0.0008772178,0.00015538096
 Great place to work if you are interested in the nexus between economic research and policy Opportunity to create real impact and influence policy which can be really rewarding (especially if you are a CE working in your home country) Opportunity to learn from and collaborate with leading academics and development economists  Overall collegial environment that encourages and rewards learning,0.00018371658,0.0001849607,0.9996313
 Roles and responsibilities may vary from highly technical to the very mundane so some flexibility is required Not much career progression internally but experience is a great stepping stone for an academic career or other policy work,0.008701405,0.78693753,0.2043611
You will be supported to reach all kinds of people who need assistance with livelihood and sustainability,0.0026833685,0.2562257,0.7410909
It's a very competitive place to work,0.9988133,0.0009956472,0.00019106701
very wonderful colleagues awesome employee benefits,0.00028061305,0.00024130587,0.99947816
work life balance may be hard to achieve,0.99865544,0.0012252707,0.00011934218
Working for the oppressed,0.99843603,0.0014343554,0.00012957024
Job Security is not Guaranteed,0.999059,0.00078171823,0.00015920323
Great work atmosphere teamwork family friendly good programs,0.00019739722,0.00018111426,0.9996215
Long procedures not autonomous personality driven,0.99729913,0.002554079,0.00014686731
Teamwork Good Systems Accountability Commitment,0.0011854903,0.00250075,0.99631375
Small teams Long Procedures Turnover of Staff Stringent rules,0.011709299,0.98799485,0.00029582897
People work together for a common goal,0.0038127264,0.072404586,0.92378265
Downsizing effects that always leads to people uncertainty,0.9989477,0.0009274339,0.00012488356
Training health workers in infection prevention case management facility management and finances management,0.016819017,0.9738144,0.0093665235
Training health workers in HIV malaria maternal child health,0.002642245,0.9959175,0.0014402716
Great opportunities for career advancement,0.0002802221,0.0002491767,0.99947065
The work environment can sometimes be stressful.,0.999037,0.0007958878,0.00016704635
Positive environmentGreat work place,0.00018677166,0.00018311098,0.9996301
StrictTight and great focus,0.0009406442,0.022223054,0.97683626
Nothing positive at all other than a salary at the end of the month to pay bills,0.56706417,0.43238223,0.0005535714
Management need a complete overhaul,0.91040486,0.08888422,0.00071087
This is Fast paced working environment,0.00085542654,0.0045845886,0.99455994
None it is a great employer,0.0035578252,0.98808515,0.00835698
Excellent work life balance and flexibility. LG's senior management cares deeply about it's people and their well being to make sure they are able to perform at their peak. LG gives a lot of autonomy to employees to drive strategy. The team I am on is nimble with a focus on innovation and iteration. LG has strong impact results and commitment to reductions in child health. These results have led to large incoming funding to help scale up globally. Very exciting time to be working for a growing organisation.,0.00035534153,0.00036070662,0.99928397
As LG quickly grows teams can be at time understaffed and work pretty hard. Roles also tend to be dynamic and changing. This requires a bit of patience and flexibility to trust leadership direction and my team requires each person to take initiative to drive things forward.,0.9978917,0.0019519071,0.00015641429
Flexibility hard working group of people hiring of people from various backgrounds and disciplines,0.004642206,0.0074230963,0.9879347
Although organization is looking to transition to supporting governments and work in the public sector they still operate as a private sector approach. The talk does not match the actions including financial management and hiring decisions. Most of leadership team is not on board with the public sector approach Unclear opportunities for advancement  it varies on your direct manager more than actual organizational ladder Too focused on short term results as opposed to long term sustainable results.,0.9987357,0.0011274331,0.00013684844
Salary paid on time They do try to listen to their subordinate,0.99311864,0.005906705,0.00097472157
Too bureaucratic in decision making Not consulting stakeholders in making policies Too harsh policies Too little salary,0.99916565,0.0006633834,0.00017091744
Good working environment well compensation staff development,0.0005396928,0.0003534666,0.9991068
No much Not much  not much,0.0003660873,0.9987373,0.0008966015
Great environment  The people are helpful to get you acquaintedFair benefits  offer fairly completive benefits package,0.00019676759,0.00021982162,0.9995834
Negotiating for salary increments is extremely difficult.,0.9990308,0.0008122399,0.00015693414
Equal opportunity employer. You can be from anywhere in the world and you'll work with MSH as long as you meet the technical requirements,0.0032378489,0.0061013405,0.99066085
Pay scales are different for different country offices,0.0030600317,0.9962663,0.00067357504
MSH as an organisation provides a good environment for  career development and growth. MSH  believes in core values of builder stronger health systems Greater health impacts,0.00020922457,0.00023442165,0.99955636
