Comment,Negative,Neutral,Positive
Lack of vision for research tracks,0.99883574,0.0010329745,0.00013132163
Of course it is because of my supervisor.,0.0013482491,0.998021,0.0006307539
The university itself is not a reputed,0.9986651,0.00120039,0.00013449404
Opportunity to discover academic research Good atmosphere,0.00016380096,0.00016673084,0.99966943
One month is quite short...,0.9951249,0.004742063,0.00013314615
very good atmosphere brilliant and kind colleagues that share a true passion at work good structure,0.0002074561,0.00018638233,0.9996062
Difficult to maintain a work like balance,0.9988009,0.0010437433,0.00015541744
There was rotation in my type of work. I used to give group and individual counselling for refugees. Photocopy their official documents. I used to be responsible for the hotline and to give refugees appointments,0.00085660146,0.99871707,0.0004263515
There were no cons or something that I didn't like.,0.000422081,0.99918956,0.00038828154
Compelling cause and highly reputed UN organisation putting you at the core of some of the most challenging issues of the 21st century namely humanitarian aid and forced migration. Very good salarial conditions.,0.000736081,0.000985666,0.99827826
very bureaucratic hierarchical and unsocial employment system. There are a lot of constraints with long working hours and poor worklife balance. Also lots of frustrated senior managers who then out their frustration on lower positioned or national staff. Extremely slow if not impossible development perspectives inhouse.,0.9991379,0.0006996704,0.00016251934
Good colleagues and good atmosphere,0.0002136596,0.0002729664,0.9995134
Stressful work environment at times,0.99916816,0.00066073734,0.0001711893
Flexible working with fulltime compensation and opportunity. Great worklife balance.,0.00039638559,0.0002822719,0.99932134
There is no observable cons up to this point of employment.,0.00139006,0.9983228,0.0002871578
salary remote work versatile holiday,0.00043416402,0.019051494,0.98051435
absent supervisors lack of research expertise competitive environment poor management lack of career opportunities after phd,0.9991659,0.0006831439,0.00015108075
good equipment good atmosphere no micro managing good benefits,0.000362178,0.0032727923,0.99636495
salary varies wildly based on your funding computers/laptops are not provided,0.9988349,0.0010258458,0.00013930436
Flexible work schedule freedom to select work hours,0.00042328224,0.0003589685,0.99921775
My boss is a crazy,0.9972838,0.0024852853,0.00023091944
Very good salary by Belgian standards,0.29482922,0.20641181,0.4987589
You need to speak Dutch to get ahead,0.0004944571,0.99873894,0.00076665543
Nice people and work environment,0.00030378957,0.00034151078,0.99935466
No possibility to be hired on a permanent contract,0.99863595,0.0012450605,0.000118923235
independence work environment and holidays,0.016962154,0.22292827,0.76010954
no long term contract possible bureaucracy,0.02413036,0.9752914,0.00057832635
Flexible working time interesting projesct,0.00017819845,0.0002513459,0.9995704
Temporary contracts mostly little possibility for a permanent employment,0.008364792,0.9913283,0.00030693767
have commute allowance medical insurance,0.034266118,0.9292232,0.036510732
low pay not delicious food,0.99888617,0.0009388208,0.0001750697
Great environment to work in,0.00028204394,0.00027290685,0.999445
not any cons registered for now,0.00033600008,0.9990207,0.00064337126
good environment and team work,0.00023013593,0.00021408353,0.99955577
There is no disadvantage to work here.,0.00039573578,0.9987703,0.00083393656
Good place to work in Belgium,0.00017542667,0.00020757213,0.999617
I have nothing to say about this,0.00034132696,0.9990393,0.00061944587
The salary is good and cover the life in Belgium. It is possible to save some money.,0.0012981697,0.0019003904,0.9968014
It is still a young university compared with KULeuven and UGent thus sometimes competition can be hard for funding. But this can also represent a good opportunity.,0.020582616,0.9306953,0.04872207
good environment nice people work life balance,0.00026162097,0.00039560138,0.99934274
no specific disantantage no no,0.00037754435,0.99863064,0.0009918589
The team is so awesome,0.00035732245,0.00061811635,0.9990245
The work hours are limited,0.9991648,0.0006755833,0.00015956636
Freedom of research relaxed/flexible schedule. Nice colleagues,0.00019486144,0.00021268355,0.9995925
Not great time management difficult to get permanent position,0.99915063,0.0006979935,0.0001514154
Senior academics are held accountable for their work this does not happen in all universities Supportive work environment especially for helping new international staff Collegiate atmosphere Good location,0.0018882373,0.00107584,0.997036
Worklife balance can suffer and sometimes the expectations on staff are unreasonably high,0.999084,0.00075276516,0.00016323314
European working conditions i.e. relaxed with loads of benefits,0.00027340476,0.0004443218,0.9992823
Not a top uni some departments sometimes ridden with politics,0.9987853,0.0010596636,0.0001549973
High pay a lot of days of holiday,0.99862623,0.0011974847,0.00017629428
Bureaucratic it can be slow and hierarchical,0.99906677,0.00077242573,0.00016081311
a friendly environment place. Everything is perfect,0.0019092029,0.007944153,0.9901467
there are not too many Compensations & Benefits,0.00043519374,0.99771297,0.0018518502
Lots of benefits (housework transport holidays loans special discounts free parking meal card and ecochecks.,0.00022094908,0.00025719768,0.99952185
The atmosphere is not so friendly when you don’t have a higher education degree.,0.9982356,0.0015610772,0.0002033206
Diverse community Great team Interesting side activities,0.00016879136,0.00032653505,0.9995047
Low salary Competitive environment No company car,0.9991856,0.00064542826,0.00016887655
it is a good place to work. I really enjoy it,0.00027790287,0.00037603301,0.9993461
PhD researcher don't pay taxes which is not a ideal case for foreigners,0.99908316,0.0007510562,0.00016582823
Good compensation and bonus nice working environment.,0.0003967141,0.00028326284,0.99932003
Not much to say good for doing a PhD,0.0006117021,0.99887055,0.0005176818
Was very great to work there got a lot of possibilities to develop myself,0.0005254444,0.0008103364,0.99866426
Big company so hard to get a bigger overview,0.9981306,0.0017550032,0.00011428778
 great and highly skilled colleagues  very well equiped labs,0.00033184153,0.00030514432,0.999363
 it is not one of the top well known universities in the world,0.9983012,0.0015070095,0.00019189593
It is very nice here,0.0009575063,0.038208757,0.9608337
Nothing bad around here really,0.0003185124,0.99895644,0.00072497193
Highest salary for PhD students that I know. Flexible hours and pressure very research groupdependant not extremely high in most of them. Top technology and no budget limitation if your proposals are wellreasoned.,0.2130046,0.08390099,0.7030944
Also research groupdependant I guess but: LOW PUBLICATION OUTPUT if wishing to pursue a career as a researcher in Academia the low number of publications might very well damage your options.,0.99887043,0.0009996146,0.00012986628
Overall nice people to work with. Good teaching culture. Good salary. Good work/life balance.,0.00046508477,0.00066589646,0.998869
Board level direction is missing. Managing finances contracts etc is very tedious as the centralized administration is very slow and often returns documents based on undocumented rules. No research culture. A lot of politics.,0.9990791,0.00076501037,0.00015595419
Once you have access to the University system you are able to look for more opportunities in the school take workshops networking events and salaries are competitive.,0.011014732,0.06042212,0.9285632
Lack of interaction with other professors.,0.99893206,0.0009312664,0.00013669285
 Collegial atmosphere  Often team building activities   Flexible working regime ,0.00023630717,0.00025752647,0.9995061
 Heavy administration that has difficulties to trust its people,0.99904555,0.0008145613,0.0001398612
Highly intensive training courses given by driven professors with good prospects for future jobs.,0.00025070092,0.00022175569,0.9995276
A very frustrating administration to collaborate with in respect to extra curriculars.,0.998978,0.0008508246,0.00017107643
life/work balance city centre location affordable and tasty canteen several good academics,0.0002223999,0.00024548266,0.9995321
no professional/career possibilities an opportunities political environment small research/doctoral budget,0.9984414,0.0014088599,0.00014975805
Excellent direction Excellent relationship with my boss Freedom to create and consolidate a research path Possibility to teach,0.00023601353,0.00020522231,0.99955875
No perspective (very difficult to get a permanent position),0.99829894,0.0015960424,0.00010508479
Nice and motivational atmosphere for research,0.00016162788,0.00020448185,0.9996339
Not well equipped for molecular biology,0.99884665,0.0010265425,0.00012683193
very nice campuses good facilities excellent research,0.00027067008,0.00027732732,0.99945205
not a very international atmosphere,0.9935588,0.0062755747,0.00016561878
Flexible employer great working atmosphere numerous employee benefits,0.0002144557,0.00018282972,0.99960274
Science research facilities need further development young university,0.0008487249,0.9978955,0.0012556895
good social benefit and quality of the city,0.00020686621,0.00023726762,0.9995559
difficulty personal relationship and local language,0.0057440195,0.99386096,0.0003950266
learning how to design catalystworking with Gas Chromatograph,0.0006347431,0.8757317,0.12363352
Limited contract Not job Warranty,0.9990109,0.0008267535,0.0001623204
good infrastructure and located in a great city,0.0002493085,0.00026335265,0.9994873
Bureaucracy can lead to some delays,0.99901557,0.00082571333,0.0001586997
Good climate and living condition,0.00048332798,0.00055548747,0.9989612
Poor behaviour of faculty and staff,0.99901175,0.0008311461,0.00015703504
Good people and lots of work,0.0004960761,0.0005631689,0.99894077
Pay is not commensurate with education,0.99903667,0.00080533524,0.00015807181
good starter job intersting environment,0.00019638184,0.0002675892,0.99953604
temporary doesn't always count as 'real experience',0.9973584,0.002525765,0.00011586175
Good environment nice people flexible hours,0.00021569515,0.00019976337,0.9995845
Students can't get enough attention,0.99400604,0.0057766624,0.00021730721
Learning and experience to learn more.,0.0009381,0.99152786,0.007534054
Salary and experience to earn less.,0.99891543,0.0009127656,0.00017177389
International English environment work/life balance cuttingedge science,0.00031825376,0.99291784,0.0067638527
Limited choice for lunch in the canteen,0.99909866,0.0007601578,0.00014122586
International connected well equipped great research portfolio great staff,0.00022032192,0.00021367372,0.999566
too little office space for lecturers sometimes old and badly lit rooms,0.9991509,0.0006890952,0.00016012267
At Liege University there is a center of research called GIGA science where you can learn and growth if you like academic research.,0.00018564447,0.0010889341,0.99872535
I left just because I was wondering to start a new chapter in the us.,0.0002718519,0.99895203,0.00077608565
Good supervisors. Very professional and kind personel,0.0006735844,0.0006717479,0.9986546
No cons at all for me,0.00032053352,0.99920386,0.0004756583
Good place to work and live,0.00025590707,0.00024142161,0.99950266
Good place to work and live except the weather,0.0022202327,0.0020730027,0.99570674
You are ur own boss u do what u like as long as u can bring new projects to the department,0.0023687475,0.9958406,0.0017906943
No other compenstation than food vouchers,0.00274461,0.996497,0.0007584604
Salary and atmosphere are good,0.002172644,0.020604525,0.97722286
Main language is French but this is not a cons really,0.00046726866,0.99892163,0.00061115774
Good salary for PhD students,0.00045127163,0.0003247665,0.99922395
Bad campus Non speaking English community  Isolation and hard social life in Liège,0.99913126,0.000704102,0.00016462397
Very nice environment good salary,0.0004323818,0.00036162668,0.999206
French is the main language,0.00047527955,0.9972574,0.0022673393
People were nice and friendly,0.0020091399,0.07309835,0.92489254
Chemistry building is very old,0.99867046,0.001201044,0.00012854084
Easy for French speaking people. Individual fellowship might help out for PostDocs.,0.0006018092,0.9870216,0.012376512
French speaking locality hard to navigate with English. Cost of living high compared to Germany but salary is not commensurate to that.,0.99905616,0.0007908393,0.0001530152
Enjoy teaching and researching for a decently paid job,0.0018891416,0.003695632,0.99441516
No car in package and does not benefit from bonuses,0.99916434,0.0006867636,0.00014887474
Salary and university is good.,0.007850467,0.8970622,0.09508738
Gembloux city is little bit boring.,0.0010322615,0.99854577,0.0004220343
As a phd student you develop lots of soft skills,0.0010923306,0.3263333,0.67257434
There was no training and you feel alone to manage your project,0.9991271,0.0007291628,0.00014378635
Flexibility freedom quality of life/work,0.00057114655,0.0009747571,0.9984541
Old fashion hierarchy less opportunity,0.997866,0.0020259868,0.000107977154
Good job environment and care of the students,0.00037619958,0.0002744922,0.9993493
not very international job environment,0.9986533,0.0011799465,0.0001668383
 Best technologies   highly qualified scientists,0.00041623655,0.00048817773,0.99909556
 There is a harsh competition to stay in the academic field,0.99806565,0.0017721724,0.00016212041
Good working with students as an assistant,0.00021333343,0.00024745485,0.99953926
not enough possibilities for research when not doing a phd,0.9986469,0.0012194753,0.0001335486
Good salary relatively cheap housing; A lot of international PostDocs and PhD students; The city of Liege is a nice place for traveling in Europe,0.00019030193,0.00022182088,0.99958783
Almost no career prospects for expats; the contracts are typically 1 year. Depending on lab typically a lot of stress at work. Beurocracy: settling in Liege and extending your residence permit really takes time. The 48th bus that you take in the moring is really terrible.,0.9990368,0.0008062056,0.00015703507
Openness  of the people I worked with lab mentality PI in the lad I was in. HR most of the times was doing its best to help. No real problems with any interaction I had with the University.,0.004167522,0.9021735,0.09365886
Life in the city of Liege for non French speakers is complicated. The same goes for networking and job opportunities.,0.97513264,0.02468113,0.00018625903
 Flexible time  Challenging job  Varied tasks: Teaching managing research projects event coordination communication…  Travelling,0.00019279646,0.0003236255,0.9994836
 Not well connected by public transportation  Difficult to go from postdoc to permanent position  Slowness of academia,0.99914956,0.00068975607,0.00016070915
Good location positive people good salary,0.00038475564,0.00041067714,0.9992046
Infrastructure should be improved certain software licenses are not easily available International journals viewing is difficult,0.99849105,0.0013725514,0.00013643838
cool city cool university with high level colleagues,0.00018301143,0.00038344803,0.9994336
Management is not very efficient at all,0.99917173,0.0006763929,0.0001519205
Good management nice setup and highly recommended,0.000983738,0.0014513554,0.9975649
Nothing as such. I find it nice working here,0.0005705677,0.9977366,0.001692915
Nice colleagues good work/life balance exciting projects (in theory),0.00020561388,0.00076470664,0.99902964
No longterm vision no support from upper management,0.9989862,0.00088734756,0.00012648666
Good university Financial help to partly do research abroad,0.00018097181,0.00020410505,0.99961483
Difficulty to access expensive equipment,0.9988471,0.0010103846,0.000142451
Nice people and excellent research projects,0.00024691437,0.0002869282,0.9994661
Public transport was always busy,0.99683017,0.0030068497,0.00016301764
Cooperative administration and colleagues. Great location.,0.00021691379,0.00026091194,0.9995222
None. Great place to work at.,0.029724354,0.38816863,0.582107
Flexibility calm and personal grow,0.000581491,0.98513967,0.014278945
I don't see any drawback,0.00034975144,0.9991454,0.00050494715
good opportunities to attend conferences abroad,0.0001781411,0.00018902408,0.99963284
I experienced many administrative delays,0.9968311,0.0030644091,0.00010447875
People in my department were truly passionate about science.,0.0009809821,0.0013630203,0.997656
Sometimes not as technical as they could be.,0.030075513,0.9695794,0.00034517466
Interaction with other researcher teams Animal House excellent. Access to technology and collaborations within the hospital.,0.0001686402,0.00019842492,0.99963295
I bit of discrimination in terms of gender and also nationality. I had always the feeling that if you don't speak french you would never get a position on the faculty.,0.9974184,0.002455566,0.00012608127
Warm people pleasant community with great diversity,0.00016737115,0.00018964731,0.99964297
low wages due to legal scales,0.999065,0.00078208384,0.00015288439
 Freedom of research  Interesting projects,0.00020799754,0.0004040059,0.999388
 lack of management  high salary at beginning but limited growth,0.9991823,0.0006623694,0.00015533777
Nice place to work and cool colleagues.,0.00020493606,0.0002091655,0.9995859
Very bad management and poor pay,0.9991879,0.00064293575,0.00016914225
Great opportunities for curious about life sciences.,0.0002393691,0.0004675575,0.9992931
I do not know for the moment.,0.0003386862,0.9991897,0.00047163793
Smart people professionals knowledge and experience,0.002273714,0.5590033,0.43872297
Old buildings mess with administrative questions,0.9982672,0.0015857576,0.00014707902
Flexible good atmosphere challenge Good opportunities to travel worldwide,0.00017321955,0.0001804546,0.9996463
No ways to evolve in different positions,0.9103249,0.089298196,0.00037696448
Networking and teaching at students,0.00024105946,0.0006528054,0.9991061
Too short periods or not many days in the month,0.9806028,0.019236382,0.00016083776
Great place to work friendly easy going people,0.00019101621,0.00018453853,0.9996244
Everything is going slowly and low salary,0.999132,0.0007354276,0.00013259037
international there are good oppurtunities,0.000959856,0.104722254,0.8943179
unorganized bruface program collobration with vub is weak,0.99750465,0.002370764,0.00012459583
Easy and flexible Nice work environnement,0.00024782633,0.00030642765,0.99944574
Actually was a pretty Nice job,0.0021939166,0.9730407,0.024765354
Interesting and challenging projects Open time Very nice team and team management,0.00026014601,0.00032408992,0.99941576
The contract depends on external fonds. If there are no external fonds the contract is over,0.0005806235,0.9990633,0.00035606747
Great enviroment Opportunities Work/life balance,0.00020184432,0.0005360846,0.99926203
Poor organization Paper work Slow support,0.9991775,0.0006719217,0.00015060548
good team and beautiful environment,0.000242843,0.0002406264,0.9995165
salary not heavy and and infrastructures in ruins,0.33897632,0.633597,0.027426707
The atmosphere is really good,0.00043948964,0.0055452283,0.9940153
Sometimes it is less good,0.0022090715,0.99734503,0.00044602147
Nice professors and good quality education,0.0008183845,0.0008197695,0.9983619
Mostly in french and difficult administrative processes,0.9960795,0.0038082837,0.00011220977
Brussels is great post doc salaries not bad,0.0067461445,0.39822337,0.5950305
Salaries although not could be better ;),0.00054232747,0.9973289,0.0021287051
working in ULB provides nice working life balance.,0.00023031185,0.0006700224,0.99909973
More suitable for french speaking person,0.00048188362,0.9988009,0.00071724923
Freedom of time and space,0.00034809668,0.00074707554,0.9989048
Not efficient in administration process,0.99915826,0.00067836116,0.00016345979
Friendly Relaxed Professional Flexibility nice people,0.00016022759,0.00020394531,0.9996358
Old buildings students don't want to be teached in english,0.99782807,0.0020586494,0.00011329345
team work knowledge excelent opportunities,0.0003872307,0.0015160984,0.99809664
no incoveniences perhaps the administrative staff,0.00037535184,0.99918777,0.00043686735
nothing ..i can not say anything good,0.00031536908,0.99921703,0.0004675794
avoid beams dept..avoid avoid save ur career,0.0074210297,0.9920936,0.00048540224
Flexibility Nice Environment Great team work Research learning opportunities,0.00019575372,0.00019310923,0.9996112
Academic salaries No more fund from the university for researchers to complete their thesis,0.99862015,0.0012353989,0.00014439867
work environment people interesting projects Academic life,0.0003371417,0.0014709884,0.9981919
none that I can think of right now,0.00026739846,0.99917233,0.0005602612
Flexible working scheduleNice colleagues,0.00019331819,0.00021170445,0.999595
Lack of managementNo opportunities to grow,0.99918586,0.00067078794,0.00014328366
Professors with different backgrounds interesting classes,0.00041007446,0.9941707,0.0054191924
Too much theory a bit slow in solving administrative problems,0.99778867,0.0020673012,0.0001439987
 Directly apply what you have learned in the previous years   Attractive salary for a first experience as the diploma is highly regarded  Known and pleasant work location to work at.   Work with experts in your field. Always enlightening ! Furthermore if you have landed here it means there is a teacher who appreciates you and will support you ! Good !,0.00030545727,0.00040886085,0.99928576
" Working with other researchers that often are teachers makes you work with experts who sometimes have little regards for your current knowledge or thirst to learn (of course it heavily depends on the person concerned). Actually competition is fierce and not every researcher likes his/her neighbor.   Sometimes working as a researcher means you are working on your own. After a while you lack of ""classical work communications with colleagues"" that you may find in other companies.   Working as a researcher is good but if feels like you are still a student somehow. Is this a real start ?",0.88879055,0.11076985,0.00043960594
Great colleagues a nice environment in Brussels. I'm not sure what to say it's a university.,0.0038176398,0.2798814,0.71630096
When I arrived the university was only just beginning to organize itself for international (nonEU) staff members. I didn't get any help from the university navigating the Belgian bureaucracy (health national ID card etc). They were very willing to give me what I asked for but I had to ask. This may be different now as it has been almost 5 years.    Pay is a little low.,0.99557555,0.004299588,0.00012481122
Wonderful group of excellent scientist with international environment. As a PhD Student you have to follow some lectures (Summer Schools workshops conferences) of your field of expertise which are a lot of fun. Workload depends on your project.,0.00018473713,0.0002252647,0.99959
There is not much of cons here. Maybe if you are on an FNRS grant they wont give you fixed holidays since its a scholarship...,0.00037369068,0.9991726,0.00045374292
Good salary very interesting reduction on food and so on... Quite good environment and nice collegues. Teacher assistant job in brief.,0.00024896394,0.00023536637,0.99951565
No always supported by the school and the teacher you also have to do thing on your own and prepare everything before.,0.99721956,0.0026619807,0.00011839857
Very low tuition fee (800 euros only during registration and submission),0.96923536,0.014040788,0.016723862
Bureaucracy is hard to manage. French is the only medium of communication. Very little support to expats.,0.9991559,0.00070294517,0.00014108453
"The ""free spirit"" is very respected in this university where the life philosophy is great. The research is good and people are friendly.",0.00028111652,0.0006136906,0.99910516
There is no particular drawback,0.00033209784,0.9989537,0.0007142097
Interesting neighbourhood in the European capital,0.00024027408,0.0013069032,0.9984528
French is often required  emails written in English seldom receive a reply.,0.9974964,0.0023929856,0.00011059879
A lot of freedom on research. But this really depends on your supervisor.,0.001032558,0.9976949,0.0012724468
Not quite friendly for English speaker.,0.9982169,0.0016633472,0.00011975701
 flexibility  freedom of reseach,0.0010614485,0.041867614,0.95707095
 limited opportunity  Very few benefits,0.9991339,0.0007433798,0.000122814
good courses related of the interested fields,0.00021357629,0.0014855845,0.99830085
Lack of infrastructures and administrative paper related,0.9991698,0.00066879706,0.00016138358
Freedom money to travel facilities,0.0005362315,0.00055487547,0.9989089
you have to be motivated to finish a phd!,0.02212727,0.97478694,0.0030858137
Nice Campus and Really chill environment,0.00021001256,0.00036240192,0.99942756
Very Rainy all year long,0.0007870927,0.9987186,0.00049436354
Perfect working environment and people.,0.0005469845,0.0005318885,0.99892116
Seriously there is nothing to complain about.,0.0004932657,0.9990584,0.00044827687
research academic flexibility progress friendship,0.00038045231,0.99489814,0.0047214366
low salary temporary location,0.9309408,0.06881559,0.00024355303
friendly colleagues and relaxing atmosphere,0.00015275045,0.00021442535,0.99963284
Not everyone is motivated big turnover of personnel,0.88952345,0.110153615,0.0003229966
Open sfeer vrijheid collegialiteit ..,0.0010191031,0.9953063,0.0036746138
