Comment,Negative,Neutral,Positive
working with RC National Societies,0.00043910567,0.9911356,0.0084253345
slow processes at eu level,0.99842227,0.001440253,0.00013744156
 horaires flexibles  possible de travailler n'importe où,0.00058792176,0.99552166,0.0038904352
 pas de bureau  trop de responsabilité,0.0013100372,0.9940737,0.0046163294
As an employee you have a lot of advantages. The level of healthcare is really high. Teamwork. You get many chances to educate yourself even more. Very new and good infrastructure. Easy to go to with a car bike and/or public transport,0.000305636,0.000347363,0.99934703
You are left with a feeling the management does not appreciate your knowledge. They make you feel your ideas do not matter. Very big hierarchy.,0.9990007,0.0008572628,0.00014204267
flexibility and open dialogue with colleagues,0.00020675166,0.00026095216,0.99953234
 disorganised with regards to visas,0.9974758,0.0023916517,0.00013259005
Passionate people flexibility interesting projects some good leaders in SBUs,0.00018170458,0.00021556132,0.99960274
Management isn't proper poor performance management high insecurity and job satisfaction. Lots of cases of burnout/prolonged sick leave.,0.999172,0.00066746614,0.00016058529
The working culture and flexible hours are what I liked the most.,0.006400344,0.23868418,0.7549155
Difficult to say but maybe compensation.,0.00039210735,0.999106,0.00050187105
Small salary however payed on time good work life balance and fancy delegations,0.008450865,0.018245714,0.9733034
Nepotism Gossiping culture their own theory does not apply in reality outdated technologies and tools. They had good career opportunities but unfortunately after advancing internally even if being among the loyal & skilled employees  management fired me while being pregnant .. this speaks for itself.. so watch out..,0.996651,0.00310901,0.00023997226
Worklife balance Openspace office Learning opportunities Internal mobility,0.00018708549,0.004748867,0.9950641
Salary not matching the work done!,0.9989686,0.00088061654,0.00015074482
I loved working at CCL.,0.0122237345,0.038138393,0.9496379
Nothing I can think of.,0.0003027401,0.99909866,0.0005986513
The research they have done over the years,0.0014006846,0.997905,0.00069434196
Office politics Little mobility within the company They do not apply what they sell,0.99915135,0.00069571764,0.00015295624
work life balance people fringe benefits the content/products,0.00038004457,0.99853075,0.0010891695
Not everyone would fit in the org culture; if you are open minded and resistant to change you will enjoy the work environment as such.,0.0011241449,0.99739206,0.0014837305
Great brand within executive education;  smart intelligent people; lively multicultural environment; access to great research and reference materials,0.0001647333,0.0001739557,0.9996613
Doesn’t pay as well as its competitors;,0.99896514,0.00088922057,0.00014562786
Flexible worktime learning organization opportunities to grow within the organization.,0.0002129892,0.00020625381,0.9995808
Salaries are a bit lower than the rest of the industry,0.9987936,0.001077622,0.0001286585
A good place to work if you are interested in the Leadership area,0.00018258792,0.00027257774,0.9995448
Salaries are not very high but compensated with work/life balance,0.9954021,0.0044433363,0.00015444135
International environment diversity respect family oriented Leadership,0.015672391,0.64590925,0.3384183
Rumour culture gossip  lack of effective communication meetings.,0.99896944,0.00089120166,0.00013934383
Difficult to get fired if you are an incompetent,0.9973902,0.0024145832,0.00019523963
It's a sectefficient people is not welcome,0.99860424,0.0012285969,0.0001671955
Salary checques repas investment plan in house canteen,0.00042589262,0.9985178,0.0010562448
Quick pace or work complex subject,0.00048267888,0.9962685,0.003248829
Nice people Great network Great place to learn Good advantages,0.00018098087,0.00018454039,0.9996345
Limited opportunity to discuss salary,0.9990332,0.0008276077,0.0001391757
work life balance great benefits and salary overall friendly people,0.0009119606,0.0013377497,0.99775034
bureaucratic not easy to progress in your carreer,0.99906784,0.0007752043,0.00015703082
Interesting industry to work in complex policy challenges to deal with nice and supportive atmosphere in the office great location benefits and perks opportunities for professional developments (but rather horizontally than vertically). All previous reviews were correct for the situation several years ago but the organisation has done a really impressive transformation under the most recent leadership over the past 34 years. More young and dynamic people were hired better management processes developed the organisation has become more efficient in advocacy and communications both externally and towards membership. Granted there are still issues and the situation can vary from department to department: some are modern dynamic and try to be on the edge some are still managed by dinosaurs. Good worklife balance employees are really taken care of.,0.000527026,0.0028033417,0.9966697
Upward mobility is difficult but this is the case for all trade associations. If you wan t to move up a ladder every 2 years join a consultancy this is not a place for you. But if you stick around build relationship with key people there are always ways for professional development and horizontal mobility or moving further to a member company.,0.9968424,0.0030075458,0.00015007821
It's a good organisation to start if you have a background in chemistry.  Nice canteen and good location easy to get there by public transportation,0.00017141235,0.00018070926,0.99964786
It's a mature environment. People are working for the same company for many year and they lost motivation.,0.9804034,0.019308913,0.00028766535
good networking and visibility to outside fairly good training packages independence in carrying out your work,0.00023071184,0.00031190342,0.9994574
individualism office politics slim chances of promotions or salary increase,0.99883956,0.0010234736,0.0001370097
This is a great university to work.,0.0002624623,0.00026945572,0.99946815
The weather is cold in winter.,0.96903485,0.030423775,0.0005414701
Amazing Culture in company Brilliant staff,0.00028474894,0.0002763297,0.99943894
Long work hours for part time workers,0.99918133,0.00064010196,0.00017857592
International workplace very nice people to work with,0.00019927332,0.00021560973,0.9995851
Job itself doesn't require heavy/technical skills.,0.001692976,0.9959448,0.0023621586
Mission driven colleagues and an interesting impact driven goal,0.0001858855,0.0004823053,0.9993318
Lack of leadership and career progression,0.9991148,0.0007338915,0.00015122107
Salary conditions general benefits package,0.001074327,0.99582183,0.003103801
 Working atmosphere (verbal abuse by the Director Director overwhelmed by her functions cannot separate work and private life)  no clear administration of tasks,0.99885654,0.000995434,0.00014804689
Good culture collaborative enviroment and opportunity to grow,0.00016856822,0.0001809691,0.9996505
Honestly there isn't anything I can pin point as a con,0.0003879128,0.99925596,0.00035622512
none at all for them,0.00033464725,0.9991842,0.00048110634
wage is low and much lower each year,0.99910504,0.00074169145,0.0001532305
A great learning environment and a positive working environment.,0.00017915726,0.00018853716,0.99963224
None at the moment will comment on this in the future.,0.0002651754,0.99910945,0.0006254444
Good collegues I've learned alot I've enjoyed my work.,0.00049373694,0.0044473335,0.9950589
You're just a number.. we've worked 12 hours a day instead of 8. We didnt get to take our breaks because it was so busy. We had to do work with 2 people instead of 4 or 5 because people got sick all the time.. it was a mess. Got a Burnout and when i got back from a month abscense they fired me.  Wage was low for what we had to do every day.,0.9990681,0.00076528406,0.00016660304
Greenpeace has an open business culture easy to use informationsharing platforms and a transparant policy,0.00031758723,0.00031359517,0.99936885
Two main types of managers are working at Greenpeace. One's that promote status quo and old management practices and Ones that promote growth and selffulfillment within their employees.  I loved the second group and because of that the first saw me as a potential danger for their positions and fired me.,0.18182549,0.8150503,0.0031242208
 Non profit  Global mission and activities  Pays well  Progressive HR  Takes care of employees  Great diversity in potential activities inside organisation,0.00047398507,0.0003730874,0.9991529
 Federation not always easy to manage  Distributed (decentralized) work force can sometimes be a challenge,0.9990158,0.0008289247,0.00015527013
Dedicated and committed people with a strong community feeling,0.00020200317,0.00027308203,0.99952495
Poor management small budgets lots of burnouts,0.9992093,0.00062398193,0.00016670863
 Opportunities to travel globally and connect with people from different countries and cultures.  If you like a job that you do not mind doing the rest of your life this is 'the perfect' place.  International travel  if you are one of the lucky ones.  Company match 401K.  Generous vacation policy.  Company provided mobile phones.,0.00026234577,0.00027205131,0.99946564
 Great place to end your career: if you are the kind who wants to ride into the sunset and really do not care about what you do.  Great place to end your career: if you are young ambitious and stupid enough to think you can make a difference or enhance your career here or that the company cares about you. This place is a career killer.   Great place to end your career: because stress and the general lack of any normalcy will eventually kill you.  Leadership style and culture straight out of the 80s and the company hasn't evolved in decades.   Company is rife with inside politics at every layer and the few people of note hold all the power traveling all over the world in business class fare attending superfluous meetings.   Leadership lacks vision and execution and nothing of note has been achieved in years.   The company is run like a dictatorship and the churn at the leadership level is mind boggling.  Incompetent people managers and a non existent and dysfunctional HR has created a perfect storm for abuse and harassment.     Promotions are nonexistent. Performance / Exceptional abilities does not get you a promotion at this place.  Benefits package is very poor for a nonprofit organization. Nonprofits have no profit sharing plans / ESOPs however they do have excellent benefits and perks. This place has neither.  My advice … stay away and work for an actual for profit / product company that makes a real difference in this world.,0.9988349,0.0009867448,0.000178361
Financial benefits Flexibility and nonformal environment,0.00019538499,0.0003660371,0.9994386
Little opportunity for career growth,0.99916565,0.0006998233,0.0001346513
good university and good professors,0.0005101868,0.0006919772,0.9987978
small university with few international students,0.0021922803,0.99727494,0.0005328275
Great culture and values  flexibility  smooth communication with hierarchy,0.00037186398,0.00040427787,0.9992238
Career evolution opportunities are not presented to foreign researchers and students,0.9989706,0.00089920213,0.00013014526
Good research environment. Good allowance and benefits.,0.000206413,0.00020506897,0.99958855
Limited contact time with professors and supervisors.,0.99911684,0.0007406605,0.00014244745
Opportunities to learn and study new subjects,0.00023429639,0.00031556544,0.99945015
New building is expected but not quite yet,0.0003385532,0.9991379,0.0005235947
High salary and Good environment,0.0043197824,0.002535121,0.9931451
Guidence and communication could improve,0.0065188697,0.9930871,0.00039395635
Enough autonomy possibility of individual growth through workshops,0.0012661874,0.09709386,0.90163994
Low job security due to low permanent job positions,0.999196,0.00063628337,0.00016771774
Friendly environment International Up to date tools,0.00017418792,0.00018173913,0.99964404
No cons until so far,0.00040852558,0.9986834,0.00090808
Dynamic university with a drive to grow and excel in both research as education. Small in size so short reporting lines and open for new initiatives.,0.005289722,0.006060357,0.98864996
Due to its small size and young age a disadvantage in competitive funding applications and political decisions.,0.99895966,0.0009016984,0.00013866587
Flexible time stimulating environment interesting collaborations possible,0.00018166729,0.00032457954,0.9994937
hierarchy slow and poorly flexible structure,0.9991359,0.00072090514,0.00014320725
Excellent place to develop your academic career,0.00030116932,0.0003217242,0.9993772
Somewhat remote location in Belgium,0.00038339305,0.99847335,0.0011432503
Chill approach at the office,0.00041850717,0.9983864,0.0011951166
Unqualified people in high positions due to being friends with staff rather than actual merit,0.99848795,0.0013551904,0.000156918
Great office and colleagues in Brussels flexible work environment good staff care.,0.00020667001,0.000190737,0.9996026
Low promotion and career development opportunities. Atmosphere and quality not equal between projects management not always clear and sometimes disorganized.,0.99917185,0.00066920865,0.00015905031
People are nice to work with it offers great flexibility since COVID in terms of working from home arrangements there is good worklife balance,0.00034234262,0.0013559208,0.99830174
Limited job progression and growth opportunity,0.99913365,0.00072348077,0.00014292327
Great colleagues international environment interesting context,0.00017798772,0.00025892394,0.99956304
Worklife balans is not the best,0.9987601,0.0010920452,0.0001478224
Wonderful peers great reputation some industryleading teams good HR small organisation,0.0002432538,0.00027524208,0.9994815
Autocratic untransparent management disconnected Board occasional intellectual bullying,0.99906653,0.00077408034,0.0001594083
One pro is that the reputation of the organisation seems to be positive at least for those without direct experience.   Looking at the other reviews it strikes me that only interns have positive feedback while those with longterm experience do not. Take heed.,0.0010650434,0.9980861,0.0008489217
Staff come and go quite quickly and anyone who survives for more than two years is rare. New staff are talented and enthusiastic at first but gradually become disillusioned and leave  often not by choice creating a truly toxic work environment as people you respect leave in questionable circumstances. Those left behind wonder when their time will come mostly without any warning creating an uncomfortable environment.  Management and HR can and should better manage talent with transparency in all departments and actively discourage cliques and the tyranny of a few. People are currently judged not on the quality of their work but on who likes (or doesn't) like them. Put in fair and transparent guidelines as well as a system for promotions (rather than relying on department heads HR should design a career path).   Anyone considering taking a position here should read these reviews carefully and aim for other options.,0.99425924,0.005394091,0.0003467202
 Tremendous intellectual freedom to set research and advocacy agenda  A lot of flexibility in how to do your work  Name opens doors to get access  Good benefits package  Overall good atmosphere in organisation despite some trouble in the past,0.0004903959,0.0004934688,0.99901617
 Very virtual decentralized organisation  Workload is very heavy  Not a lot of guidance or support very lean organisation  There were management and financial troubles in recent years but these appear to be resolved  Relatively few opportunities for career advancement,0.9989686,0.0008908818,0.00014056244
This is the best place I've ever worked in. Very recommendable you'll learn a lot and make excellent connections. Very knowledgeable staff great atmosphere at work. Highly interesting subject.,0.00020500335,0.00021472697,0.9995803
The most junior staff doesn't have great salaries.,0.9991266,0.00070049573,0.0001729869
Great mission some great colleagues,0.0003010169,0.00062254915,0.99907637
Catastrophically poor management has led to a financial collapse massive lay offs the eradication of two major programs in Europe and Asia. Management is focused on a tiny selfinterested clique who act in a personal vindictive manner towards anyone who expresses any dissent. Louise Arbour a supposed liberal lion is actually secretive authoritarian barely versed in international issues and incapable of inspiring staff.,0.9990075,0.0008477459,0.00014480861
Brilliant colleagues  Interesting topics to work on (field research report writing)  Highlevel and highquality of the work Demanding challenging and stimulating work environment  Professionalism and flexible working culture  Career advancement  Solid reputation,0.00019777355,0.00019872209,0.99960357
There are none it truly is a great organisation to work for,0.031386934,0.410696,0.55791706
Once an amazing organization now ruined by incompetent management,0.9972167,0.0023852992,0.00039797224
Dismal management headed by Louise Arbour a Canadian judge who knows nothing about how to run an organization or about conflict. A terrible record of financial crises and internal squabbling while she concentrated power in a little clique of UN people around her. Worst possible strategy of managing … organization is now in terminal decline.,0.99907196,0.0007766771,0.00015138138
Exciting work content and analysis and some great intellects and people to learn from / work with,0.00018523107,0.00020768691,0.99960715
Limited opportunities for growth high turnover limited interorganizational  cooperation neglectful management,0.99916244,0.00068580155,0.00015169395
Great experience to add to your life,0.00024091387,0.00037225144,0.9993868
Not well paid too much segregation,0.9990085,0.00083855924,0.00015304935
 International environment  Possibility to learn in an independent way,0.00027300368,0.00039648978,0.9993305
 HR management is catastrophic  Lack of internal communication,0.9991534,0.0006916947,0.00015497356
This was my first professional experience. The location is Brussels Belgium. I had really horrible expectations because I thought the interns were really at the bottom of the corporate ladder. However in the team I was greeted with full respect I was treated equally with all other employees my ideas were appreciated and I managed to learn a lot in a short time.,0.95511514,0.043602604,0.001282219
At the end of the internship I was forced to work from home due to the pandemic and did not consider that period very productive.,0.9989316,0.0009080562,0.00016037069
The location and the atmosphere are great. Cool trips foreseen. Great time in universiade but busy! Great challenges but a bit political sometimes,0.00065968867,0.0025002367,0.9968401
The challenges are sometimes not under your control as the international environment limits you in diplomatic ways. But you can get over it.,0.78042585,0.2191275,0.0004466114
Dynamic teams Remote work International work environment Good vibes They're concerned with their people,0.000214184,0.00026724229,0.99951863
Pay could definitely be better good starter salary but raises are very uncommon,0.23252644,0.7667314,0.0007421673
personal development projects building internationalism and csr large network development,0.00017279512,0.0015247777,0.99830246
various possibilities to attend congresses for all over the world no time enough to attend all,0.9988656,0.0009910648,0.0001433174
Well paid good and open communication between employer and employer.,0.00036013807,0.00026558616,0.99937433
The work is pretty routine so it can get a bit boring.,0.9674339,0.032348655,0.00021736581
Dispute processes and listen to employees,0.9987729,0.0010427227,0.00018429586
Sometimes inner cultures can be a barrier to integration but possible to overcome over time.,0.0020353105,0.9949757,0.0029889832
Everything really loved my stay there,0.0013708709,0.9957432,0.002885861
Nothing I can think of in all honesty,0.00030147002,0.9992136,0.00048492124
Great Place to work Helpful colleagues,0.00018234015,0.00017460155,0.9996431
None that i can think of,0.00026611835,0.99923444,0.00049949466
Working for Humanitarian and serving needy peoples,0.0023855232,0.0021821558,0.9954324
So far I do not see any bad thing,0.00044919061,0.9990533,0.00049744913
Good employer working for a cause,0.0003552982,0.00029258916,0.99935216
No cons at all in here,0.00055432087,0.9989569,0.0004887195
Good work/life balance multi culture environment,0.00018533437,0.00026893208,0.99954575
Old way of working not following the agile technique. IT sector is a bit out dated.,0.9989046,0.00093833153,0.00015707676
Good commitment and nice place to work,0.00021387183,0.00020988683,0.9995763
Nothing to declare about this,0.00039232933,0.99859494,0.0010127067
 Mission with a social impact  high good perception  Professional,0.00025121294,0.0004630549,0.99928576
 specific work environment  few options to keep growing,0.9623706,0.03747228,0.00015716387
 International environment  Nice colleagues  Young and active ONG  Canteen at democratic price  clean and modern environment. Everything works.,0.000190984,0.00024633657,0.9995627
" It is full of social climbers people who would do anything to have a management contract where they can ""coordinate"" colleagues in front of the coffee machine.  Career opportunities are very limited unless you are Belgian.  In case of emergency you work much more than 8 hours a day   The salary is low compared with other NGOs even much smaller.",0.99902344,0.00081664405,0.0001599019
You know you make a difference every day for literally thousands of people. Proximity to operations,0.0010427495,0.0022867045,0.99667054
Weak and messy governance.,0.9990414,0.0008158496,0.0001428237
Multicultural and provides necessary support,0.011816698,0.25779888,0.7303844
Organization is not well structured.,0.9991123,0.0007478646,0.0001397812
Exciting policy area high profile campaigns.,0.00015688907,0.0002244034,0.99961865
No concept of worklife balance; several big egos dominate verging on harassment at times; the organisation sometimes struggles to retain credibility on issues of substance. Very stingy benefits package.,0.9991448,0.0007032831,0.00015191887
Commitment to unpopular and controversial causes.,0.9325979,0.06704699,0.00035505256
Faddish and unstrategic leadership with dominance of New York thinking.,0.99889886,0.00095076545,0.0001503967
good place to work with friendly colleagues,0.00018046398,0.00017938673,0.9996401
salary remains under sector average,0.9972529,0.002614121,0.00013304014
None whatsoever. There was only a negative experience,0.00031392285,0.99927455,0.00041153163
Communication was difficult as phones went unanswered emails go unanswered for weeks I need to chase them for any response whatsoever. I was not informed that on the day of intyerview a test would be organized as well. It impacted greatly on my personal schedule for that day. I was offered a job so i made arrangemlents  quit my previous job moved to a different country with my partner. The Thursday before my expected start I received a call to RETRACT the job offer..... The excuse was that they were sorry but couldn't afford it.... I find it ghross misconduct that a charity that has solidarity in the name puts monetary achievements before people that were promised jobs.,0.9983937,0.001460648,0.00014556787
great team very professional global,0.002277315,0.008053454,0.98966926
complex organisation high internal transaction costs,0.9989254,0.00090181286,0.00017281293
"Very engaging and ""handson"" internship in which you work with a very open minded team. A very professional and rewarding nonprofit organisation.",0.00019918651,0.00019752093,0.99960333
There were no major negative aspects.,0.00032674038,0.99908745,0.0005858962
Cause : animal protection Great international Team,0.0002586075,0.0008666591,0.9988747
Disadvantages of remote work conditions,0.004841596,0.994477,0.0006813778
Team of experts with interesting international backgrounds!,0.00015870048,0.00031196425,0.99952936
Living in Brussels is not great and ultimately boring!,0.9991074,0.0007313416,0.00016123414
Good atmosphere and great people,0.00021511511,0.00023437334,0.9995505
Not enough room for growth,0.9989304,0.0009280239,0.0001416423
Work time is very flexibility.,0.00383582,0.20581397,0.7903502
There are less permanent positions.,0.00049730024,0.99882287,0.00067971396
freedom to choose in your research,0.0006992004,0.98920715,0.0100937085
low balance between private life and work,0.3865127,0.61286795,0.0006193644
Interesting and friendly environment place,0.00015255666,0.00019564523,0.9996518
Distance traveling daily travelling to get to work,0.9741554,0.0256371,0.00020757674
Small working teams and easy access to facilities.,0.00052022096,0.00057165185,0.99890816
Not high ranked university in the field of Rock Mechanics.,0.9982559,0.0016099373,0.0001340991
good place for making a postdoc,0.00016962433,0.00023327819,0.99959713
no chance for any career development,0.9990277,0.00085639366,0.00011587927
 Good Company. Good salary for stater.  Good colleagues and competent supervisors/Professors.  Very good for Private/Professional life management.,0.00029955784,0.00031242653,0.999388
 Right now not that much opportunities for a career there after your PhD. The university will face a big (and necessary) restructuration soon.,0.9981579,0.0017265924,0.00011552241
Freedom to research Best salary around (compared to foreign countries),0.00065758044,0.0026870097,0.99665534
