Comment,Negative,Neutral,Positive
Wonderful work environment great colleagues,0.00020448653,0.00019594832,0.99959964
Sometimes the organization doesn't seem ambitious,0.9982205,0.0016398993,0.00013963405
Very health culture with highly creative and professional colleagues,0.00029596448,0.00074895105,0.998955
Everything seems so perfect and it’s hard to think otherwise,0.0052347123,0.99274784,0.0020174761
Good Benefits. Opportunities to travel,0.00016642694,0.00018505791,0.99964845
Poor Coaching Inchoate Process and complaints that within some teams African staff get harshly judged when working with HQ (Canada) Staff,0.99907863,0.00076822727,0.00015315924
Great benefits. Conducive work environment,0.00018847352,0.00017830568,0.9996332
Customer management. Complexity of structure,0.9984654,0.0013560363,0.00017850361
It is very reliable and comfortable,0.0011240795,0.0059843175,0.99289167
It is not stressful to,0.00095777976,0.9970325,0.0020097552
You get to meet a lot of interesting people and HOPEFULLY get to interact with them,0.0003877276,0.0020746072,0.9975376
You encounter a lot of equally nasty individuals,0.074140996,0.92542815,0.00043085884
it is a breeding ground for young talents,0.98773044,0.011790009,0.00047959195
you must have to work and work and work,0.92236936,0.07722823,0.00040242888
Mercy Corps promote career growth and opportunities,0.0002961999,0.0004270309,0.9992768
They has a Poor staff welfare,0.99914837,0.0006897924,0.00016186458
Inclusiveness equality  value preparedness and integrity.,0.0073525477,0.024978517,0.96766895
Consideration promoting training opportunity and safety.,0.00088788493,0.0015419205,0.9975702
All inclusive work culture system,0.00060516165,0.0011426851,0.9982521
Contract duration is usually short,0.99430037,0.005582588,0.000116969866
Fast paced environment. Demanding and multiple programming,0.019157805,0.87309605,0.10774618
You need to be intentional to achieve Work life balance,0.0005293944,0.99884355,0.0006270404
The pros are Good ones,0.0007132261,0.99394953,0.0053372933
There are currently no cons,0.00035179403,0.9990701,0.0005780864
Good office settings. average pay,0.049853563,0.34845123,0.60169524
Poor leadership at the Northeast regional office.,0.9989661,0.00089389435,0.00014009234
The organizational structure and leadership,0.22705549,0.7135593,0.0593851
Staff welfare in the deep field needs to improve,0.27185464,0.7266028,0.0015425464
Culture Career Development Exciting projects Research,0.00016448113,0.00030142925,0.99953413
Salary Bullying at Field Level Gender Bias,0.99910694,0.00073558703,0.00015743556
Mercy Corps is a great place to work. Friendly Hardworking Structured Equal Opportunities Great learning opportunities,0.00018203957,0.00016249949,0.9996555
Could be quite fast paced depending on what you are working on.,0.00042614367,0.99914825,0.00042559026
Improve technical skills and multitasking,0.9986247,0.0012228457,0.00015254531
Extreme financial procedures and approval,0.9988048,0.0010519517,0.00014327286
Vision and Missionvaluable Humanitarian interventions,0.00064778153,0.00093204866,0.9984201
poor management capacityrely on Intern staff more than expertsrelationship influence the selection of expat roles,0.9990094,0.0008394482,0.00015114673
Supports work life balance and promotes employee career growth,0.04222864,0.10486648,0.8529049
Lots of travels to unsafe places,0.99894994,0.00091533957,0.00013485648
Relaxed working environment with appropriate facility that enable results,0.0002026765,0.00019470068,0.9996026
Compensation is poor; Operations management needs strengthening,0.99896634,0.00088084885,0.0001527514
Handson  field based research experience,0.0005442797,0.9949338,0.0045219488
work can become routine sometimes.,0.998259,0.0015633897,0.00017752561
A good platform to develop in the humanitarian sector,0.00016318356,0.00017184134,0.999665
Organization's work rate is highly demanding,0.9990797,0.0007463275,0.00017397672
good pay and oppurtunity to grow,0.0005712854,0.00033518157,0.99909353
Lots of work and long hours,0.99919635,0.0006343281,0.00016941618
Cool colleagues and conducive work environment,0.00020643299,0.00024274782,0.99955076
Long hours of work most of the time,0.999203,0.00061242847,0.0001845295
To improve my skills and experience,0.9983492,0.0015067757,0.00014404044
I have learned a lot about it,0.00032509392,0.99871004,0.00096480467
Good work culture and staff inclusion,0.00024732892,0.00021131411,0.9995414
Salary not as big as other NGOs,0.9926804,0.0071581956,0.00016138382
I had very supportive managers,0.011141181,0.06854153,0.92031723
You will have to work for your money,0.997352,0.002497585,0.00015037735
Excellent organization and humanitarian work,0.000462545,0.00040063352,0.99913687
No downside noted during last 6 years experience,0.00030893675,0.9990864,0.0006047274
Your family is covered in the medical policy.,0.0010378427,0.9984915,0.0004705862
No promotion as a guard,0.9987865,0.0010889575,0.00012451333
Friendly work environment good staff training and opportunities,0.00018881209,0.00017707796,0.99963415
New colleagues all year round,0.00048016384,0.99257576,0.0069441297
Nice workhumanitarian organisation striving to save lives across the globe...promoting accessibility and affordability of quality health care services bringing quality health care to the less privilege,0.0004883891,0.00034084648,0.9991708
Not available in some statespublicity of advert not nation wideprovide more drugswaterfood clothing and so on to less privilegeppl are still looking up to the organization,0.99895275,0.00089396,0.00015322526
Good working environment and Career Growth,0.0002660345,0.00021882023,0.9995152
Low pay and discrimination of Staff by hierarchy,0.9991787,0.00065044896,0.00017076294
Exposure to humanitarian workTravels to a lot of locationsMulticultural and multiracial environmentUnderstanding the insurgency situation in Nigeria,0.0008339144,0.006770868,0.9923953
Outdated processesSome untrained staff in certain positions just because they have worked there for a whilePoor supervision of coordinators who do what they want to do unchecked,0.99906415,0.00078034616,0.00015553329
Fair enough and good enough,0.00080848683,0.9976539,0.0015376962
Nil Nil nil nil nil,0.0004963159,0.9973289,0.002174776
International standard protocols Multinational environment  Broadens your horizons,0.0020982688,0.92689866,0.07100308
Salary not commensurate to other international organizations  Frequent international staff turnover results in adjusting to different leadership styles ever so often with conflicts that arise as a result  Subtle racism,0.9990036,0.0008521448,0.00014433224
A chance to serve humanity,0.00036592252,0.0003834382,0.9992506
Less exposed people at leadership levelPoor pay and travel allowanceSpain section treats national staff with a level of disregard,0.9990915,0.0007514074,0.00015709102
Dedicated in putting smile on the faces of poor masses in the remote communities,0.3075125,0.10428595,0.5882015
Strategies to sustain valuable players,0.0016349985,0.9388604,0.059504572
Because they capacity of caring of humanities is more hire than the other organization Train people very well,0.01677664,0.97064596,0.012577339
despicable characters with the resulting good it does overridden by the downsides,0.98911405,0.010521777,0.00036427763
Learn build relationship and communication skill,0.0018457243,0.9708783,0.027276056
Low salary so I lack motivation,0.99917847,0.00065985625,0.00016162635
Team work and staff budding exercise,0.0023321363,0.6510854,0.34658253
Like every work environment it has its challenges,0.028615046,0.9703773,0.0010076547
Your time at NDI is determined by your manager and country director. If they are progressives you will be allowed to bring in ideas and be promoted if you put in the work..,0.0057428423,0.99313617,0.0011209901
Hardly any opportunities for staff development.,0.99899167,0.0008803756,0.00012790646
Career development in the area of how to design project,0.0007994553,0.92672837,0.07247217
Hard to get promoted as most of their roles are stagnant,0.9990841,0.00077887555,0.00013699793
Nice place to work solid grounds,0.0002752482,0.00028394084,0.99944085
Overtime more hours than expected,0.99765104,0.0022223014,0.0001266272
Good company that pays well,0.0009399467,0.0005180221,0.9985421
The work is highly demanding,0.9987048,0.0011160728,0.00017912936
• Great work ethics • Amazing colleagues • Growth opportunities • Zero tolerance for discrimination,0.00045985702,0.00033793368,0.9992022
Be open to visiting field locations in remote areas  it's fun sometimes.,0.00041937534,0.003850027,0.9957306
Highly structured and well organised systems.,0.051352285,0.22837964,0.7202681
Not seem any to say yet,0.0003144781,0.9991184,0.00056721974
A healthy work environment with a thorough regime towards work and life. A good place to learn as you will be working with loads of bright minds.,0.00019198477,0.00018886542,0.9996191
The growth here is slow and very rigorous.  Possibility of growth is somewhat limited.,0.9988979,0.0009896316,0.0001124569
Great place to work particularly in Nigeria,0.00031161204,0.00029591398,0.9993925
Limited opportunity to move within the ranks internally,0.99899834,0.00087429426,0.00012746856
Competitive pay Fastpaced environment Healthy work environment,0.00066659175,0.001040173,0.9982932
I can't think of any for now,0.0003030283,0.99925095,0.00044603832
Transparent system which enable staff to focus on core duties,0.00048176915,0.00034450437,0.9991737
long process before placement on projects,0.99840564,0.0014648708,0.00012952824
great learning some great support staff,0.0002680985,0.0002808116,0.9994511
there is alot of work pressure,0.99878913,0.0010429932,0.00016792162
Its a global organisation so you can earn from different countries,0.00076114904,0.99759007,0.0016488562
Does not allow promotion of staff. O ce you get in you can't be promoted.,0.9986871,0.0011485945,0.00016430444
Great organizational culture it is motivating to work for a charity course,0.00019804011,0.0001906061,0.99961144
challenging in terms of meeting targets you work outside and walk a lot,0.001419981,0.66150194,0.33707803
You would get the opportunity to grow and develop yourself. Small team so everyone is hands on,0.011766585,0.9877437,0.00048970943
Limited training opportunities. Small team so may be at the same position for a long time,0.9991818,0.0006794707,0.00013881052
The culture is very positive and amazing colleagues .,0.00022291111,0.0030707289,0.9967064
Nothing negative just great place to be,0.0023895446,0.97300816,0.024602283
Good diversity & culture Inclusive and open communication is encouraged,0.00015869245,0.00019302251,0.99964833
Too much work to do. Time is never enough Lack of proper structure High attrition rate Pay not so competitive in the industry,0.9991685,0.00066877384,0.00016267238
Diverse inclusive and non discriminatory and colleagual environment where .work life balance self and collective care are encouraged.,0.0003772175,0.000422628,0.99920017
Too much of bureaucracy that hampers efficiency. Non competitive salary,0.9991216,0.00069456326,0.00018383212
Great place with diversity and good ethics,0.00025458014,0.0002438017,0.9995016
contract term defined and renewable,0.001519278,0.95432866,0.044151973
Friendly work place and good,0.00017742004,0.00018864233,0.9996339
no growth for a long period,0.9990004,0.00087334384,0.0001263433
Lots of benefits ... awesome worklife balance .... good for women ... global synergy,0.00018479736,0.00021487814,0.99960035
No reward for hardwork cabal system of management people easily get redundant not good with technology unstable company culture,0.9991635,0.0006709758,0.00016557558
Plan International provides a work environment where talent is maximized and growth is achieved,0.00052082026,0.000500375,0.99897885
The workload at Plan International can sometimes be overwhelming,0.99900836,0.0008291007,0.00016260117
there is working well together here,0.0006485873,0.99344,0.005911419
staff usually work for a single project 100%,0.0008813038,0.99788314,0.0012354581
great great great great great,0.003235127,0.44241685,0.554348
Non NOn NOn Non NOn NOn,0.00034999807,0.99705327,0.002596686
You get o learn a lot with considerable opportunity for job security,0.00360306,0.79397416,0.20242274
Poor worklife balance. There isn't enough opportunities for growth for certain roles.,0.99896324,0.0008918465,0.00014491797
Happy to see myself working with them,0.00027919552,0.0011576995,0.9985631
Discouragement by tired coordinators at work,0.9990858,0.000753681,0.00016053913
Full of some brilliant people. Doing some good work overseas in some of the poorest countries.,0.00052532397,0.000692538,0.9987821
Little opportunity for growth,0.9991285,0.000742206,0.00012918418
not a lot of pros to be honest,0.00040128987,0.99911445,0.00048429525
cons also not a lot,0.00034384936,0.998993,0.00066317455
Indirect learning opportunities One of the least paid organization No career progression Values aren't promoted Least benefits,0.9992181,0.00062465994,0.00015723504
No direct learning opportunities Change theory is implemented though  GE is good with the organization's strategy Good people within,0.0019479032,0.050311025,0.9477411
Appreciable Work Life Balance Support/Training /Learning and Development.,0.00024836094,0.00030719565,0.9994444
High Demand required from staff members.,0.22344667,0.77518535,0.0013679208
Some good people who are dedicated to still achieving results despite the cons of working here.,0.0052265376,0.029678218,0.9650953
Poor staff welfare inhumane HR policy lack of opportunities for career growth Lack of trainings,0.99920315,0.0006240929,0.00017283559
Great and supportive CEO to work with,0.00023305816,0.00019694516,0.99956995
organization culture was still evolving,0.0005600424,0.99874216,0.00069784134
A great place to work. The teamwork is one of the best I have seen especially between the projects. The family setting makes it easy to grow professionally.,0.00021318282,0.00023661031,0.99955016
Not much for cons we have a lot of improptu projects but then again this occurs rarely.,0.0005911269,0.99914443,0.0002644001
The team work as a family result oriented.,0.03701195,0.26433465,0.6986534
Getting things done on time,0.03938131,0.33362484,0.62699383
Good worklife balance and opportunity for career progression,0.00022285849,0.00021758761,0.9995596
Medium work load highly competitive,0.015672293,0.98400784,0.00031984664
Regenesys Business school offer its staff: Neat and comfortable environment to work in Provides quality equipment for all the staff to work with and has a very friendly staff.,0.0002653735,0.00026006132,0.9994746
At Regenesys individual staff suggestions on running the office are not welcomed easily.,0.9988281,0.0010182164,0.00015372217
Working in Regenesys gives you the opportunity of working with a global team; Initiatives and ideas are encouraged; The financial performance of the business is made known to the staff; The flow of communication on the office is smooth; Open door policy is adopted by the managers.,0.00030250926,0.0003231303,0.99937433
In some cases decision making is centralized and this could slow down on deliverables.,0.99875534,0.0010839545,0.00016071668
Timely payment of salaries provision of adequate training for staff Good working environment Good communication channel between staff and management Allows for carrier growth.,0.00035561566,0.0002469523,0.9993974
Needs to provide medical insurance to staff. Needs to Provide staff bus to employee working in Lagos.,0.39249104,0.60415274,0.0033561317
Regenesys Business School offer you premium studies and gurant student international certificate and a minimum cost and a t a good time frame,0.0005608446,0.0006056715,0.9988335
they don't have other branches across other states aside lagos,0.00051978626,0.99907994,0.00040034755
 Salaries are paid as at when due  There is opportunity for growth and promotion There is opportunity to study while working,0.00037508682,0.00035767152,0.9992673
 There is work related stress,0.7371929,0.2624455,0.00036151984
very nice working environment with chance for personal growth,0.00019087284,0.00018126916,0.9996278
incentive criterias should be reviewed,0.03067864,0.9683575,0.0009638608
Not bad a place to work,0.005900291,0.032993823,0.9611059
It can be better with bonuses,0.0007867647,0.99876404,0.00044926102
Staff motivation Training good remuneration promotion Team work.,0.0010750985,0.0008218455,0.998103
No accommodationfeeding staff transportation lack of break room and poor health insurance,0.99919707,0.0006359813,0.0001670078
Working with this highly rated Orthopaedic centre give an opportunity to work  with best of hands in the speciality and it's thus encouraging enough.,0.00085022213,0.0023322694,0.99681747
There may not be enough opportunities for the younger doctors to improve on their skills though this can be by encouraging younger doctors to going into residency training,0.99662364,0.0032274977,0.00014887862
In Lennox Hospital they tend to take good care of their staff,0.0071704607,0.05749676,0.9353328
Physical environment is not well in order,0.9987368,0.0011395569,0.00012370008
wondrful Good favorable adorable lovely,0.00026783245,0.0011167092,0.9986155
Good Hard work hard easy going,0.005735811,0.22703151,0.76723266
Working with good team players,0.00033791768,0.00068400824,0.99897814
workload can be so demanding,0.9991321,0.00068042515,0.00018749702
Prompt salary payment every month,0.99849236,0.001300333,0.00020737578
Lack of career progression. Staff often remain in one location for too long,0.99914384,0.00068915874,0.00016693729
One learns on the job,0.0066171126,0.98329425,0.010088679
None for now. It has been awesome,0.00078721385,0.9973591,0.0018536869
Good compensation plan for staff,0.0024423036,0.0010108572,0.9965468
Nosy staff expecting to know your personal business,0.015782816,0.98386836,0.00034883883
 Work life balance  Friendly environment  Children oriented,0.00026822687,0.0007266911,0.99900514
 No clear career path  Remuneration needs improvement,0.9983473,0.001540063,0.00011275864
Good and nice people friendly environment to work,0.00018753164,0.00018900681,0.9996234
Some times need to work under short deadlines,0.89334476,0.10615982,0.0004953802
All staff are treated equally including the drivers,0.11953278,0.864475,0.015992245
No consideration for another role while your project is ending. This happens to most staff.,0.998872,0.0009982153,0.00012978812
It cares about your wellbeing 100% pension borne by the organisation casual dressing healthy and user friendly work environment global organisation,0.022485495,0.050145455,0.9273691
Huge dichotomy between expats and national staff,0.995314,0.004534564,0.00015145421
Health insurance pension consumables Travels,0.0002991482,0.9946918,0.005008968
Poor pay complex structure Lack of promotion,0.9991566,0.00068701414,0.00015640222
 Full pension contribution  Good severance package  Creche for nursing mothers  Great place to build a career in development and humanitarian programs,0.00021393225,0.00018193874,0.99960417
 Work is highly demanding,0.99898726,0.0008333492,0.0001793982
Great work culture Employee focused flexibility,0.00033646508,0.00038780906,0.99927574
low salary slow implementation of processes,0.99912065,0.00071154244,0.00016781819
Meet cool people from different backgrounds. It’s a well known organization so it’s a great opportunity to get better jobs after or get to work and go to other country offices for work. Conducive work environment.,0.00018678982,0.00035393966,0.9994593
Moving up internally is not financially rewarding you get put on the lowest bandwidth as an internal employee when you get promoted. So you’re much better leaving then getting rehired as a new staff. There’s only one bonus and it’s an education allowance that’s the same amount only paid in a particular month a year gets taxed and if you leave less than 6 months after it’s paid you have to pay back.,0.9983328,0.0014826399,0.00018458732
They give opportunities to take up leadership roles that are recognised. Travel opportunities within and outside the country. They encourage internal recruitment especially when projects are coming to an end. They pay 100% of your pension contribution and provide compensation when leaving the company. They have a daycare for new mums. ALways share information on the business outlook and makes such discussions inclusive.,0.0011969598,0.0008730973,0.99792993
No 13th month. I can't think of any other con.,0.00032015564,0.999126,0.000553881
Extended opportunity for growth and professional development,0.00022966256,0.00023456353,0.9995358
They focus on developmental and humanitarian industry,0.0010821121,0.9829585,0.015959375
Good staff welfare packages and defined support system.,0.00035207355,0.00026362957,0.9993843
Except for some few interpersonal clashes among staff it is a nice place to work,0.0039245677,0.95201933,0.044056132
Passion for children and the organization take care of 100% of it's staff pension contribution and pay one of the highly competitive wages in the industry. Encourages work and life balance. A place to work!,0.0006488398,0.000394271,0.9989569
Primarily a women lead organization but is that really one of the cons? Not sure especially as we need to encourage gender equality. Somehow gender balance is an issue here.,0.9746334,0.025192767,0.00017376106
Growth within company humanitarian response can be fast There are opportunities for learning on the job and capacity building There are stretch roles and responsibilities available,0.00036333015,0.00042039854,0.9992162
Project based employment Internal beaurocracy can delay implementation or some opportunities,0.99463415,0.005216248,0.0001496795
I would have preferred being transferred to another opportunity which was not available as at the time the project ended,0.38106072,0.6185636,0.0003757229
I enjoyed the protocols and policies guiding the conduct of staff and external employees,0.0019483016,0.9544521,0.043599635
Professional growth and staff welfare prioritized,0.30028793,0.6100845,0.08962757
In house politics and power struggle,0.008300016,0.99143887,0.000261086
Good team spirit Idea oriented Good structure and systems,0.00020931837,0.00028199147,0.99950874
Opportunities for upward career advancement are limited,0.9990625,0.0008008135,0.00013669088
Child friendly and highly reputable organization,0.00021916785,0.0003120572,0.99946874
My Experience is not well tapped due to my limitation to a certain job description,0.9987551,0.0011113201,0.00013363175
Great Coworkers who work extremely hard,0.015711328,0.01234948,0.9719392
Bad line managers who are very vindictive,0.99904865,0.00079564203,0.00015562642
Help humanity and gain experience.,0.0014215496,0.070361175,0.9282173
Excessive team work amongst the employees,0.9991503,0.0006677185,0.0001819795
Fairly good and encouraging place to work,0.00018452365,0.00019635023,0.9996191
Poor system of growth and promotion,0.99912816,0.00071329996,0.00015851324
The work is noble and the staff are great/friendly,0.0008594569,0.0025997483,0.9965407
The pay is poor and few opportunities for growth,0.9992046,0.0006345506,0.0001609252
Good programs and well designed strategy documents.,0.00036372695,0.00036609132,0.99927014
The management is not in tune with modern reality. A big disconnect between management and field teams. Nepotism and personal interests rife in the workplace. Staffs are poorly remunerated. High turnover of staffs. Frivolous spending's yet no funds to run the programs.,0.99912876,0.0007067472,0.0001645209
UEC International school pay their workers on time,0.11130875,0.0202911,0.8684001
Frown at not taking your job seriously,0.9988587,0.00094305153,0.00019822319
Team spirit Lovely colleagues willing to help passionate colleagues inspiring leadership.,0.00018231808,0.00019637815,0.9996213
Tasks can be physically demanding.,0.9989687,0.00085986033,0.00017148451
Friendly environment capacity building taken seriously. rewarding work with great impact on beneficiaries,0.00019612785,0.00017261883,0.9996313
Work may be limited by the time span of projects.,0.99877375,0.0010905381,0.00013576806
covers 50 percent of disease burden in Nigeria. Operate also a social enterprise section marking them to generate revenue to remain in operation,0.99537826,0.004433704,0.00018809091
Operates like government and hence takes time to make decisions,0.9987637,0.0010784644,0.00015790749
Great for starters because you get to learn a lot. Great for nursing mothers because of a creche within the office,0.0003742087,0.0012660356,0.99835974
Poor salary which pushed many to leave the company. Heard they later adjusted their salary,0.9990707,0.0007950114,0.00013429637
Awesome and highly skilled program staff with great diversity and experience. SFH Nigeria is arguably the biggest and most proactive NGO in Nigeria.,0.00017751116,0.00020064377,0.99962187
Executive Management can be sometimes insensitive to the genuine performancerelated needs of operations staff. Below the Director cadre remuneration is poor and incomparable to other similar stake organizations in the industry. There is also tendency to overwork staff unduly.,0.9989365,0.00091115717,0.00015247875
Already said above.  Opportunity to  show innovation supportive work environment and child friendly policies for working mothers.,0.0002670821,0.0004207,0.99931216
Like every organizations SFH needs to strengthen staff exit process,0.019264758,0.9800628,0.0006724354
Good platform for starters in development,0.00016277583,0.00019921716,0.99963796
Minimal opportunities for staff development,0.9991893,0.00065149047,0.00015911393
Nice place to work. Pleasant coworkers,0.00021194176,0.00022295474,0.99956506
