Comment,Negative,Neutral,Positive
Bureaucracy HQ is practically cut off from Country offices and whenever they visit they are like lords. Rapid changes the organization is too dependent on funds from PEPFAR/USG and so are easily swayed by what they want. No innovations not competitive just too reliant on a single stream of donor funds which is really drying out as PEPFAR is pulling out/reducing investments in countries like Nigeria where the organization's structure and workforce is huge= no job security.....well jobs are project based anyway.......,0.9987503,0.0011107629,0.00013899479
Working at FHI 360 gives you the edge over other top NGO. Its a learning field which create a good step to a great carrier path.,0.00018853784,0.00025562037,0.99955577
The management has not really understand that good  staff are great need for organisation.When you have spend alot on a particular staffits advisable not to allow them go if you can really control it.The Nigerian factor has not really made the organization  thrive as much as it should have.The policies do not favor NGO's in Nigeria,0.99750996,0.002296671,0.00019340018
Fair pay. Lots of great experience. Opportunity to actually make a difference where it matters most,0.0005164906,0.00033744148,0.9991461
Very demanding place to work. Always on the move travelling. Also projects last an average of 5 years and you are out of job at the end of the period unless you get another opening. However experience is very valuable in the NGO/Aid industry so you have good chances of securing another engagement,0.9948291,0.0043189116,0.00085192145
Familylike team yet professional. The structure of interaction between the management and others in the organization is great. The pay and benefits for the employees are also very awesome; arguably better than many nonprofit organizations competing with FHI360 for status.,0.0004515901,0.0010834303,0.99846506
Rapidly changing policies that largely depend on the desires of fenders,0.9973133,0.002542905,0.00014371476
FHI 360 is enormous with the way it successfully manage the PEPAR project in NIgeria and the follow up SIDAS. I feel great to be part of the team that manage such a big project.,0.0002090362,0.00037791618,0.999413
The issue of Nigeria factor is not making the Organization to achieve it full potentials.,0.99556124,0.0042951354,0.00014360381
The the only organisation that i have worked in my whole life where your job description is given to you on the first day and everything you do is within your job description.,0.106100276,0.6630958,0.2308039
they are too strict on salary scale. which is a good thing from the HR angle,0.0013852083,0.008097465,0.9905173
Employee friendly policies and welfare. Excellent technical team. Merit is recognized and rewarded.,0.0003813296,0.00025815083,0.9993605
Locals in countries outside US called Foreign Service Nationals are paid in local currencies rather than the Dollar value of the salary scale. This is a bit of a disadvantage,0.9950582,0.0048230933,0.00011869554
The learning the camaraderie most importantly the great work done all over the world,0.00028440976,0.0004517734,0.9992638
Long hours can sometimes get difficult particularly for those with families. The bureaucracy from DC delays work in the field,0.9990614,0.0007886251,0.00014991994
A lot of opportunities to learn everything from field experience to paper work to managing people,0.0006757298,0.0012805664,0.99804366
You are not exactly sure what your job description is. So much time is wasted on meetings. Pay is awful,0.99910045,0.0007412291,0.00015843674
This place can be very great for learning on the job. There are so many projects that are interlinked.,0.00038584883,0.0008402878,0.9987739
I worked in an office in West Africa. There is a lot division between different tribes which makes the work counterproductive,0.9986494,0.0012183269,0.00013224743
Fhi360 is well known for its Technical expertise,0.0003708145,0.99178493,0.0078442795
Job opportunities are mostly tied to projects with period of performance so always comes to an end,0.99895227,0.000928189,0.00011960055
They had a very professional Environment,0.042849127,0.68217534,0.27497557
Work environment appeared to be uncertain. I was the newest member of the team and always felt like an outsider,0.9966118,0.0032988833,8.934208e-05
There is an avenue for career growthjob satisfactionhighly of satisfaction & motivation,0.00034601524,0.00033763514,0.99931633
One will always miss working with FHI360 at the end or expiration of his contract.,0.9937722,0.0061123893,0.00011539529
Well designed and coordinated programs. Good program systems for staff welfare.,0.000258232,0.0002148214,0.999527
Laying off of staff on project close out,0.99879223,0.0010682711,0.00013958671
Very competitive and fast paced,0.004708372,0.99437827,0.00091330806
Very lean staffing and poor staff working conditions,0.9991998,0.0006338276,0.0001664292
Good pay. Structured system,0.008030173,0.0040692394,0.9879006
No work life balance. Policies not family friendly especially for women in child bearing age,0.99911743,0.00072890264,0.00015362352
Challenging work culture and exploited staff,0.5488778,0.4474999,0.0036222578
Stressful and r enumeration not equal to work done,0.9989114,0.0009299452,0.00015876247
Conducive work environment and supportive staff.,0.00026743245,0.0002275365,0.99950504
I have not seen any yet.,0.00031947764,0.99926597,0.00041451972
It's a good place to gain experience,0.0001849461,0.0002694242,0.99954563
Builds up integrity and honesty,0.05616385,0.050470352,0.89336574
Impactdriven work done. The focus is on people at the bottom of the pyramid.,0.05201994,0.8023412,0.1456389
Overworked staff. Salary is not commensurate with the level of effort—no opportunity for worklife balance.,0.9991437,0.0006909509,0.00016533278
Working in GAIN  helped my career development .,0.00035068748,0.0026283488,0.9970209
One of the best in the Nutrition sector .,0.0003932489,0.0007510642,0.9988557
They had great staff rapport,0.001220109,0.0047600195,0.99401987
The salary was not attractive,0.998992,0.00086589257,0.00014204592
All the best I will do it good,0.0025828846,0.9893115,0.008105521
Good job and good money,0.0054719215,0.005060177,0.9894679
They treat very everyone good,0.0029546334,0.9809203,0.016125051
Excellent experience working with them,0.003309689,0.017305128,0.97938514
Promote the organization and the challenges of the employees,0.0051073316,0.9900463,0.0048463317
Yet to starting on the time frame if all works right,0.00039328632,0.9990056,0.00060121814
Satisfactory employee warfare which enhance stability,0.96620417,0.033560995,0.00023484146
Nothing to say for now,0.0004220911,0.99844676,0.0011311547
Best place to work and upgrading in job career,0.0009832822,0.0014166165,0.99760014
Refresher of six moun in every traning,0.0006926558,0.99555945,0.0037478742
Great desire to be better some nice people made a friend learnt resilience,0.0010228008,0.007800625,0.9911766
The management is bad. Don't care about the staff don't keep to policies bullying is at it's peak professionalism is lacking,0.9991416,0.00068586017,0.00017262118
You will get opportunity to learn and build your capacity,0.0027602224,0.18527949,0.81196034
Some Supervisors are quite toxic,0.99263316,0.00721821,0.00014867034
The organization provides several opportunities for trainings and capacity building so you can be rest assured that you will keep learning.,0.00050387275,0.0005945809,0.9989015
Few people for the amount of work that needs to be done.,0.95609957,0.04360286,0.00029763626
I love working because of their Capacity building,0.001297395,0.0016876734,0.9970149
No down side though but the work is too hectic.,0.9958003,0.004055782,0.00014381771
Great opportunity for career growth and capacity buildings. Staffs are given the opportunity to benefit from several trainings.,0.00021363176,0.0001897583,0.99959666
The workload can sometimes quite hectic but still nothing that can't be handle due to the flexibility of the job.,0.22825639,0.7708282,0.000915419
Fair salary rate at the company,0.9989743,0.0008306003,0.00019510472
Bureacratic nature of the company,0.9963437,0.0034701119,0.00018623825
Very well organized and cares for its workers,0.04292172,0.022109063,0.9349692
Staffs get better paid than volunteers,0.9577779,0.02951131,0.01271078
Good working environment flexible work hours,0.00023453607,0.0002016655,0.99956375
Great environment Great environment Great environment Great environment Great environment,0.0004180674,0.0038726395,0.9957093
Positive work environment and strong bonding among the workforce,0.00017344514,0.00017571442,0.99965084
Salary not very competitive as well as improved training opportunities,0.998816,0.0010464212,0.00013761225
Good pay and staff welfare,0.029866848,0.008558225,0.961575
No job security much dependency on project,0.9990748,0.0007920501,0.0001331045
Great for capacity building and experience on the job.,0.00031339805,0.00031719392,0.99936944
Management listens to all manners of gossip/false allegations and takes drastic decisions without listening to the accused party.  Processes are not well organised.,0.9989323,0.00092601223,0.00014165987
The family work environment is superb.,0.00037000145,0.00049585995,0.9991341
Career Growth is slow for staff,0.99907947,0.00077748374,0.00014305487
none that I am aware of,0.0002487296,0.9991722,0.0005791581
great place to work i must say,0.0104720015,0.018604651,0.97092336
Offers a highly competitive payment package with good job security and positive working environment,0.0006717333,0.00048479624,0.99884343
No down side working with Helen Keller International,0.000829225,0.98039997,0.018770836
Superb career growth opportunities capacity building is top notch.,0.00057812204,0.00091735856,0.9985045
Some supervisors can be too demanding but it's all for capacity building,0.014673747,0.9845403,0.00078595395
Good work/life balance and conducive environment,0.00024533106,0.00035480998,0.9993999
Very low chances of career progress,0.99908996,0.0007862719,0.00012380215
Being an Employee gives respect and honour,0.04118604,0.07723872,0.8815752
Not being able to pay when month ends,0.99917585,0.00066657254,0.00015755743
Quality driven early payment of salary and provision for professional development,0.014657498,0.0059653036,0.97937727
Shortage of manpower amidst huge workload,0.9991462,0.00069053867,0.00016319053
Howard University Global Initiative Nigeria offers employees enabling environment to grow,0.00022744988,0.00027054528,0.99950194
The workload to the staff strength ratio is enormous,0.9989706,0.0008870232,0.00014226059
You learn on the job,0.004544406,0.99338406,0.0020714733
As a nonstaff no benefits accrue to you,0.9987319,0.0011097549,0.00015835323
Pathfinders International exposes one to life and work experiences.,0.0010173736,0.997981,0.0010015873
Lack of job security and low staff welfares.,0.99916935,0.0006690108,0.00016168297
Good place to gain experience on air cargos,0.00019281378,0.00021937504,0.99958783
There is no work life balance,0.9989681,0.00088415045,0.00014780104
Friendly innovative environment with good remuneration and a chance to work on impactful projects,0.00019394547,0.00018160856,0.9996244
Employment may be project based,0.00041189854,0.99838054,0.0012075498
Very cool. Very very cool,0.0015434836,0.094556384,0.90390015
Not so bad. Good place,0.0009102745,0.9951585,0.003931261
Good place to develop professionally.,0.00020800167,0.00023831912,0.9995536
Work load can be overwhelming sometimes,0.99909425,0.00070930447,0.00019648326
Incredible opportunities for learning  lots of responsibilities technical skills development management opportunities. Wonderfully interesting and exciting projects that add value to a CV!,0.00018223234,0.00018149836,0.9996363
Ridiculously long hours low pay lack of support and respect from management unrealistic expectations put on employees and generally poor working conditions,0.9992244,0.0005956913,0.00017987666
Good working environment to grow,0.00020528065,0.00019195837,0.99960274
No bad thing so far,0.00047345465,0.9987859,0.0007407443
No growth path. Low pay,0.99918014,0.00067218405,0.00014770994
Same team and helpful colleagues,0.0012224453,0.9655796,0.03319799
 Gain a lot of project cycle experience from proposal to initiation implementation and closing,0.00084735046,0.96446943,0.03468315
 Still growing office in Nigeria (could also be a positive),0.0006328234,0.98284173,0.016525544
Good flexibilty Fair Benefits Very informative,0.00015601522,0.00022416111,0.99961984
Career growth can be difficult,0.9990619,0.00080295093,0.00013520928
Good organisation to work respectfully,0.00036234292,0.00046430415,0.99917334
Too many work loads and files but can manage,0.9984863,0.0013169728,0.00019675097
Less pressure at work I had more of great line managers.,0.05052601,0.80052364,0.14895037
Limited career growth. They select whom they feel they want to promote. And it's based on loyalty. This is based on my own experience. I will recommend the organization to early career graduates.,0.99880683,0.0010604206,0.00013279243
Flexibility and Job Security in the organisation,0.011821118,0.006321426,0.9818574
High Taxes are discouraging staff,0.99909854,0.00071883784,0.00018264343
If you love travelling if love assisting people if you are compassionate then it's the job for you. You will feel fulfilled.,0.0055952193,0.1465076,0.8478972
They tend to pay local professionals poorly below the average salary for similar positions elsewhere. And of course I had a terrible superior who was not compassionate and would smoke in our shared office space even when I was pregnant,0.9989668,0.000884748,0.00014852965
ICRC is a very good employer. Although it is not without issues I generally feel its a nice place to work. I don't feel like leaving the organization anytime soon. It is a place where job description are clearly spelt and the appraisal system very SMART. I must also acknowledge my line manager who has really helped me settle,0.0035783786,0.056367345,0.94005424
Growth seems doesn't seems likely because it has plenty staff that have stayed for many years and may likely be more considered for growth than someone just coming in,0.92533576,0.07443547,0.00022873291
Ability to work without being supervised,0.0072932756,0.05352159,0.93918514
Not much growth for National staff,0.99889416,0.00096696126,0.00013896999
Flexible working environment quality team mates strong staff support system reasonable pay,0.00039692761,0.00025419943,0.9993488
Limited possibility for resident staff growth and the gap between the resident staff and mobile staff is too large even though they execute the same task on a daily basis,0.9989504,0.0009030257,0.00014660154
Great to work at always,0.00086478883,0.0006598622,0.9984754
Vacancy is not always available,0.9991026,0.0007480715,0.00014935258
Great employer and encourages capacity building,0.0004017119,0.00030164144,0.99929667
No clear upward career path,0.99596775,0.00393833,9.389913e-05
Reliable and you can upgrade your self in education,0.0019084455,0.019451024,0.9786405
It's an international organizationthat can decide to live at anytime.,0.05206372,0.21641979,0.73151654
Great place to work open ended contract in most cases,0.000655215,0.000531192,0.9988136
A bit slow career growth,0.99902594,0.00084441213,0.00012963304
Expose to big operations in humanitarian sector,0.0007626882,0.0121205365,0.98711675
Only working in volatile places,0.0005857086,0.9985827,0.0008316337
Best humanitarian organisation to work with.,0.00025616167,0.0002718624,0.99947196
None that I know of.,0.0003055024,0.9990075,0.000687001
Administrative structure is responsive and adaptive to change.,0.0015833987,0.0065313387,0.9918853
No growth prospects for finance job roles.  Wide discrepancy between remuneration career growth and benefits for national and international staff,0.9990074,0.0008493384,0.00014322298
Rewarding. You learn along from different people.,0.00072654523,0.94696444,0.052309047
Very exhausting if you end up having to establish a team from scratch.,0.9990815,0.0007774293,0.00014106084
Meeting people from different works of life,0.0004922427,0.99874604,0.00076170237
Not much growth especially for the national staffs,0.9988035,0.0010619641,0.00013459878
Great company to work in.,0.00054771715,0.00048004193,0.9989723
Non for now but though.,0.00047113863,0.99768555,0.0018432917
Great diverse colleagues Decent pay compared to local NGO scene You contribute to making lives better  Solid internal mechanism to avoid harassment and ensure accountability of managers,0.0006794977,0.00033536548,0.9989851
Bureaucratic almost like a civil service Relies on archaic technology an obsession with Microsoft tools when better tools now exist Huge pay disparity between local staff (resident staff) and foreign staff (aka mobile staff) Terrible compensation policy for overtime and travels. Per diem can't get you a single meal at a decent hotel.,0.9990557,0.0007702736,0.00017403196
The opportunities for a fulfilling  career abound,0.0003319114,0.00035960437,0.99930847
It's important to have strong diplomatic skills to navigate relationships with people from very diverse backgrounds  especially those who have supervision over your work,0.0035334534,0.9947582,0.0017083398
Decent salary Nigerian standard. Work that makes you feel good about yourself. Great colleagues.,0.0008445154,0.0006642074,0.9984913
Local staff as second class citizens. Over specialisation of roles. Career ceiling is too low and hard to break for local staff.,0.9991221,0.00071452424,0.00016340509
Want to go more higher in another working environment to aquire more knowledge and skills,0.00058287475,0.99884206,0.0005751585
It will improve me more higher,0.008267483,0.99145144,0.00028109114
Active involvement in Positive humanitarian activities that improve lives.,0.00021480893,0.00023606776,0.9995491
Limited room for innovation or procedural improvement based on context realities.,0.9962488,0.003634429,0.00011671032
Great work relationship and flexible,0.00052846054,0.00047115548,0.9990004
Career growth is not guaranteed with academic qualification,0.99899215,0.0008706847,0.00013724121
Possibility of studying further in any institution of choice,0.0003913598,0.99367636,0.005932254
Centralised power among top colleagues,0.0011772442,0.9194307,0.07939204
A challenging environment to work with,0.9989905,0.00085743965,0.00015202367
Working to help the needed becoming the order of the day,0.021089919,0.97170085,0.0072092633
Availability of funding to support personal educational development (iDevelop),0.004281416,0.010854191,0.9848644
Rigid salary scale and Unclear standards of annual salary increment,0.9990859,0.0007425627,0.00017148565
the multi cultural background and the great team work,0.00042487998,0.0010070215,0.99856806
less Mobile staffs from Nigeria,0.9961079,0.0037718117,0.00012032702
great place to work in,0.00028083153,0.0002771297,0.99944204
unsociable hours but a fun place,0.01171998,0.23491149,0.75336856
I Pas is an NGO company that love to take the welfare of their staff as there first priority,0.9899811,0.0072420067,0.002776833
The contract finished at time I still want it to still continue,0.0012756997,0.9983791,0.0003451508
working condition is good everyone is important,0.00076499465,0.99710244,0.0021325108
Organizational policies needs to be clear on area of promotions and disengagement of staff,0.9392987,0.060095936,0.00060536666
Good experience fine working environment and all,0.011329441,0.5649632,0.4237073
Workers get laid off easily,0.9990422,0.00078287756,0.00017479605
Quality of workmanship and coordination,0.3699675,0.48215118,0.14788136
Non adherence to best practice will bring down the company rating,0.9989089,0.00094662904,0.00014442264
Great environment with exceptional leadership,0.00024784473,0.00023312628,0.999519
not that i am aware of,0.0002599722,0.9991721,0.00056793494
They have a lot of projects,0.0011141798,0.9983449,0.0005409595
Salaries ain't competitive compared to what other local NGOs and INGOs pay.,0.9969489,0.00285681,0.0001942866
Great learning culture and growth opportunities,0.00020400161,0.00019125307,0.99960476
The salary is not so competitive,0.86864847,0.12115329,0.010198262
Great work environment Great leadership,0.00025103666,0.00023258117,0.99951637
Pay overtime and EOY bonus,0.6703504,0.3276884,0.0019612077
They train their staff well and pay salary on time.,0.09677342,0.03126694,0.8719596
They can terminate your employment anytime if there's no funding.,0.9986004,0.0012696143,0.00013003725
Growth is highly encourage and chances of growing on the job is very high,0.9986045,0.0012595174,0.00013612436
salary packages are relatively poor compared with other organizations,0.9990096,0.0008602672,0.0001299912
There is room for career growth,0.00493651,0.9115838,0.08347975
Has a Fast paced work environment,0.00046243437,0.0006759631,0.9988617
Jhpiego is a nice place to work with and they give equal opportunity to all,0.00024440975,0.0002539715,0.9995016
i would like to have a different experience with humanitarian Organizations.,0.0005759129,0.999054,0.00037002366
Probably a slight opportunity for growth,0.00056085334,0.9990891,0.00035005243
Poor pay for bulk and multitudes of tasks,0.99917066,0.00065782043,0.00017156107
There is opportunity for growth,0.00035254288,0.0012806673,0.9983668
Sometimes office politics get in the way,0.9890031,0.0107469335,0.0002499169
The working environment in Jhpiego is good,0.0002837571,0.0019189402,0.99779737
There is need for human resource improvement,0.5501207,0.44760787,0.00227143
Good working hours and bonuses,0.0007458286,0.00048197687,0.9987722
not organised at work and schedule,0.99908984,0.00073667726,0.0001734735
Great preaching/teaching Flexible work schedule Christian faith,0.00021159557,0.00020153941,0.9995869
Was to close minded  Not youth friendly Not very good team leaders and that is what keeps a movement rolling,0.99883395,0.0010186987,0.0001474498
Good place to work and learn,0.00021323717,0.00019821922,0.99958855
Poor salary especially for people with experience,0.99901927,0.000834998,0.00014574829
A great organization with strong work system and culture.,0.00024418157,0.00024691646,0.99950886
Had issues with a colleague the HR and leadership took longer time than expected to investigate into the issues and cushion whosoever is at fault.,0.9988175,0.0010438871,0.00013859708
It is a great learning environment.,0.00018444184,0.0002106348,0.999605
There is limited engagement with staff,0.9990458,0.000809954,0.00014426939
Focus on staff professional development,0.5305473,0.46452475,0.004927978
Majorly Projectbased jobs based on donor funding,0.00047044136,0.001151686,0.9983779
Great environment to learn and build career,0.00022457611,0.00021618209,0.9995592
Could improve on salary structure,0.48880854,0.51029766,0.0008937448
Flexibility good working environment committed staff and staff development,0.00019475548,0.00019492494,0.99961036
Working overtime travelling regular staff meeting,0.95995533,0.039678868,0.0003658996
Great work environment good management,0.0005334657,0.0003866171,0.99907994
Project based and sometimes unpredictable,0.0052623046,0.99413353,0.0006041895
A good place to work,0.00023072505,0.00022023456,0.999549
So much to do within a limited time frame,0.9965538,0.0032285752,0.00021764368
Great place to work in,0.00026369744,0.00025947703,0.99947685
Nil consequences working at this organization,0.99870765,0.0011335455,0.00015881534
Great work environment to work in,0.0003168821,0.00030630603,0.99937683
Home office influence sometimes slows down pace of work,0.156508,0.843164,0.0003279419
Good interpersonal relations and communications,0.00017960806,0.000281344,0.999539
Often rigid policies and reluctance to adapt to local context and needs,0.99862695,0.0012460683,0.00012707726
Was fun and friendly everyone is respectful,0.0036177505,0.15646614,0.83991617
A little bureaucracy should make reporting lines clearer,0.04211906,0.9570195,0.00086151215
Everything is perfectly Good no complain,0.0011113423,0.9982261,0.0006625618
No one for now we are enjoying it,0.00034974903,0.99894506,0.0007052287
Great team but they get top management hire wrong sometimes especially in Africa.,0.9890133,0.01015275,0.000833849
Management in the HQ  Boston  see dissenting voices in Nigeria office as trouble makers. They have very thin skin and management does not know how to convert feedback to opportunities.,0.99840504,0.0014384273,0.0001565531
Sound theory and practice for leadership management and governance development Huge resources available to staff for the job Well respected organization to work with,0.00039200424,0.00026358935,0.9993444
Poor decision making processes Opportunities for engaging in projects are dwindling Too dependent of US government funds Too projects oriented,0.9991672,0.0006733141,0.00015952853
Great learning environment with opportunities for career growth and development Strong internal controls and strict adherence to donor regulations and compliance expectations,0.00039086724,0.00027111298,0.999338
Not very responsive to the changing landscape of global development Talent management and retention not prioritized,0.9990565,0.0007901133,0.00015341079
Supports staff  growth and development Open to innovation,0.00020963211,0.0002449939,0.9995454
Not necessarily the best paying organization,0.9987274,0.0011339951,0.00013853042
Staff capacity development and growth opportunities,0.0005120035,0.000722352,0.9987657
Local staff not supported to fill TCN positions,0.9990133,0.00083826715,0.00014836343
Great organization with a superb structure,0.00041129725,0.0004584573,0.9991303
Work in progress there's room for improvement,0.0009850053,0.99837327,0.0006416772
