Comment,Negative,Neutral,Positive
Heavy organizational structure bureaucracy too many institutional changes revised salary scheme that bring disincentives to staying longterm having to apply through the 'Compendium' process for next missions that disregards years of service to the ICRC.,0.9991246,0.00071270345,0.00016263995
International Diverse challenging nice people experience,0.0003956365,0.9939499,0.0056545017
Not much room to move up,0.99827397,0.0016076857,0.000118314056
Nice environment and a good place to strength your CV,0.00021663567,0.00024052263,0.99954283
Salary is not that much and there is no way to improve yourself.,0.99903107,0.00079571304,0.00017330654
Positive working environment and a great opportunity to work in the humanitarian field help people and support a cause,0.00016652954,0.00016475022,0.9996687
Difficult or no promotion is the main challenge for many employees,0.9951946,0.0046987995,0.000106546126
It was the best thing that happened to me....the friendships that I've made are timeless...I haven't seen such team spirit as the one among my colleagues we were just like one soul...everyone is watching for the other...the experience acquired is very unique taking into consideration the particularity of the country that we worked in and the surrounding circumstances.,0.0016607039,0.09015755,0.9081818
Media coverage has always been poor...and it should be repetitive and not just for a certain period of time.,0.9987469,0.001122684,0.00013035956
Clean offices nice colleagues water and coffee are always available 1 hour daily lunch break.,0.0004901566,0.0006659514,0.9988439
No matter how hard you work your work goes unnoticed and unappreciated grading system is not fair salaries are little compared to the amount of effort we put into our work break time is not respected daily and endless interruptions HR and management do not respond to complaints working environment is tense.,0.9991848,0.0006461211,0.0001691143
Multicultural people coming from around the glob,0.00040480803,0.99625045,0.003344715
very demotivated work place no limited opportunity to advance the career ladder very boxed environment where you cannot use any creativity and your efforts unappreciated,0.9991425,0.000696266,0.00016109519
A monthly salary with benefits including (13 salary medical coverage training opportunities and social security scheme) The opportunity to practice your profession in an international humanitarian and multicultural environment. Support you through ongoing learning and development opportunities.,0.00023253518,0.00021149662,0.999556
weakness in HR and administration,0.99901783,0.0008262102,0.00015593837
Very professional up to date and committed to results. Provide direct assistance to the vulnerable groups rather than to interlocutors,0.860791,0.10766618,0.03154282
a certain separation between mobile and resident staff,0.0009199737,0.9987949,0.00028504647
IRI Takes care of their employees and grants good Salaries,0.0020138554,0.0009285404,0.9970577
Sorry for not answering that!,0.0011251331,0.99841154,0.00046330545
Their work is for a noble cause.,0.0007541749,0.0013352416,0.99791056
Their HR practices are not transparent often vindictive and incompetent.,0.99918145,0.00065866025,0.0001597991
they are very positive and having a great tolerance. Its really like a true family and nice environment,0.0007405702,0.004312017,0.99494743
Not paying a good salary or a competitive salary. Not providing training. The coordination between HQ to Iraq office is poor at least till now. There is no staff motivation at all I could say its zero. It has a lot of gaps that HQ should pay attention to for the betterment,0.99907935,0.0007688013,0.00015186748
good organization for fresh graduate,0.00019219401,0.00022670819,0.99958116
low pay salary comparing to other orgniztion,0.99869883,0.0011741462,0.00012704438
Because it is just working here to help the most volunerable people and it is working as one family,0.0065533514,0.12054811,0.8728985
Going to all the location that there is volunerable people,0.0014444232,0.031306207,0.96724945
Flexible regarding duration of employment with good HR support and well established policies and procedures. Hi Quality work and commitment to excellence.,0.0007472454,0.00045002697,0.9988028
Centralized control at international HQ Expat heavy seem hesitant or reluctant to promote national staff to manager level.  Dedicated to relief only as opposed to transition to development phase after relief is over.,0.99719775,0.0026756038,0.00012662532
It is my desired job,0.0004887798,0.9987016,0.0008095282
Boring job and need to improvement,0.9986634,0.0011837726,0.00015281566
Big company is big reasons,0.0011054553,0.9846185,0.014276006
Work or job is a challenge for me,0.99726653,0.0026137116,0.00011966809
Nice environment and nice people to work,0.00024634032,0.00025202727,0.9995016
Nothing to declare on Mercy Corps,0.00032254303,0.9990127,0.00066480873
the supervisors are usually very supportive,0.006550564,0.95506823,0.038381193
no room for promotion and international learning opportunities,0.9987362,0.0011218736,0.00014195917
staff care and the benefits,0.026342764,0.7718321,0.20182513
Development of the employees careers,0.003030183,0.9957125,0.0012574117
Impactful organization. Benefits are good.,0.00019583234,0.00023870336,0.9995654
A little too much depends on personal relationships both in the office and when seeking new work. Very top down in nature.,0.8235059,0.17615816,0.00033597034
Pay well lots of training and employees capacity building,0.020193622,0.020070147,0.9597362
none                                        ,0.00027512855,0.9987159,0.0010090155
A very strong well known international NGO good communities of practice if you know how to benefit from.,0.00029588313,0.00032143117,0.9993826
Ruined due to the bad management of the country office so much office politics and gossip. High turnover.,0.9991447,0.00069292885,0.00016233177
It was professional organization and had many different kind of projects,0.0008175722,0.99721956,0.0019628955
the wok was always depend in the fund and when there is no fund they leave their employee.,0.99721956,0.0026703107,0.000110079585
Stability friendly professional support accountability,0.00031236673,0.00048711328,0.9992005
training workloaddocumentation database compensation busy,0.0002804668,0.99854004,0.0011794941
Amazing work atmospher within MC,0.00084372895,0.004371287,0.994785
Lower salary than other Int. NGOs,0.9968329,0.0030207096,0.00014640579
capacity building and time mangment,0.007558831,0.976275,0.01616615
work load and work hard,0.95044786,0.04876492,0.00078718085
an international organization doing the humanitarian mission in all around the world and being the part of the team who serves and helps the community.,0.00039726088,0.0004901724,0.99911255
stress expatriate staff turn over and management changes,0.99888235,0.0009636138,0.00015407706
Space to innovate and develop freedom to own salary and perks are good working environment is enabling and conducive HQs and Management is supportive,0.00029015087,0.00027359973,0.9994362
Retention fixed salary system succession/career management,0.9955415,0.004285788,0.00017271304
humanitarian cause  you will provide the help for the needed people,0.0002891706,0.0007411141,0.9989697
no cons for them personally,0.0004869685,0.99889576,0.0006172177
Meanningful work pays well opportunity to progress quickly .,0.00042690063,0.00045058527,0.99912256
Depends on your team and the leadership (that changes all the time as is the case with all int NGOs),0.0009383131,0.998483,0.0005787493
A good working environment for newcomers.,0.00015569411,0.00019710412,0.99964714
Low salaries and not enough benefits,0.9991585,0.00065908243,0.00018247994
1transparent 2hard working 3respect for the rules of medical ethics4team working 5eual chance for everyone,0.006036665,0.055496164,0.93846714
1Low salary2Difficult promotion 3more expat staff4salary in cash,0.99911684,0.00071610144,0.00016712297
1 not reciest 2hard worker 3Honest Speaking  4Have sole of humanity 5Giving aid to all they need it,0.0061400817,0.9888843,0.0049755177
1staying in the same position for long time without any Development 2Bias for some staff without the rest 3they are working more than the staff can handle 4over flexibility 5the punishment is very rare there,0.9979463,0.0018851352,0.00016861982
you will get professional experience and training,0.00059685716,0.9980756,0.0013275793
the projects are normally in emergency and hard work conditions,0.07597594,0.9236312,0.00039284266
Humanitarian assistance in warzone areas,0.12111024,0.84138066,0.037509147
looking for new environment learning new things,0.00041314436,0.99543494,0.004151807
To be part of the solution and help  victims of natural disasters and conflicts.,0.13936734,0.8520994,0.008533135
It's hard for people who has families and kids to work in long  missions outside their own countries.,0.99878293,0.0010401438,0.00017697524
i like to work with NGO  there is a meaning to help people,0.00097590144,0.008890435,0.9901336
nothing to say all things good for me,0.0004850206,0.9988808,0.000634243
Fair experience in non profit organizations.,0.0065234927,0.87927806,0.114198506
Very slow response to the needs,0.9955615,0.0043296074,0.00010889138
for salary and helping poor patients,0.99890494,0.0009526523,0.00014242758
for helping those people with disease,0.010053121,0.91994596,0.07000096
Meet and work with different cultures contexts,0.0007202183,0.9967314,0.0025484252
No control for the expats management  No control for the money expense  Expats abused the NATIONAL staff  Expats didn't respect the staff cultures  Abuse of power and misbehaving by the expats to NS,0.9991455,0.00068494095,0.00016952651
it's working in terms of humanitarian with equality for gender,0.0038298008,0.4645244,0.5316458
Promotion from Oxfam a little bit delay,0.010339708,0.9894722,0.00018806811
good for job seeker and for those would liked to help others,0.00077414716,0.034800477,0.96442544
Not professional staff working in groups not in a team,0.9991009,0.0007340702,0.00016502215
Great work environment and very supportive management,0.00042172577,0.00029416953,0.9992841
Nothing to mention as it was a nobel job assisting needy people,0.22702886,0.77264875,0.00032237385
Great Environment  Good Pay Excellent Health Care,0.00037035265,0.00027365758,0.999356
time off policy needs updates,0.0005621962,0.9986823,0.00075555465
Open University  good culture and value sound work life balance,0.00023934334,0.0002511317,0.9995096
Focus on quality  and monitoring,0.018911663,0.9780465,0.0030419314
Good work enviroment  average salary,0.009789647,0.49759495,0.4926154
Too complicated hiring procedures and documentation system.,0.9990854,0.00074290164,0.0001716582
Flexible Friendly environment working on employee knowledge through RI Academy,0.00015436138,0.00017213327,0.9996735
No health insurance No Social Security No support for any visa or international activity,0.99918324,0.0006550038,0.00016173828
Meaningful work likeminded colleagues great benefits!,0.00016244117,0.00017859518,0.99965894
It’s hard to be away from family but you build relationships in the field that feel like family.,0.13767812,0.75289047,0.10943139
Great incountry team support; good development opportunities,0.00018978245,0.0001758919,0.99963427
Limited professional development opportunities incountry.,0.999094,0.00075467257,0.0001513215
Strongly committed to Evangelical Christian beliefs and ethics Generally kind and supportive staff and mentors at all levels Ample opportunity for advancement,0.00023725713,0.00019670732,0.999566
Can be promoted to positions that you are not qualified or adequately trained to take Strong disconnect between culture of HQ and most country offices Very tight financial and procurement policies that can hamper field agility and response times Leadership is generally homogeneous in demographics and approach to work Very arduous working hours and conditions can be given in field with RR schedules and compensation that is well below industry standards even for faith based NGOs. Considered lone rangers among humanitarian implementers (often for valid reasons),0.99801505,0.0018075112,0.00017740169
Try to help God's son's,0.0020528066,0.9918899,0.0060573593
Helping on language issue and nursing,0.0024189623,0.8895654,0.10801558
Area for growth and good working environment,0.0002286002,0.00021819174,0.99955314
Nothing in particular working with SCI is very beneficial.,0.0003233397,0.99920386,0.0004727434
good place to work with,0.00023543616,0.00021460517,0.9995499
average salaries low managment in some sub_offices,0.99895287,0.0008862093,0.0001608793
It is  wonderful to know that thae job you are doing helps people in need and work with a great team will always be a positive career objective.,0.00025796704,0.00030133643,0.9994407
It is not a fixed job you dont know when the budget will close and you will lose the job you love.,0.9985232,0.0012747825,0.00020214067
Loving children and struggle to get their rights back best NGO. Works for children. Love to work a humanitarian job.,0.0011508381,0.000620939,0.99822825
Miss connection with other NGOs. In Iraq in 2005. Following street children juvenile justice ( crimes) the government faked documentation...etc,0.9959369,0.0039724223,9.0749585e-05
The reason to work with save the children international is that i need to improve my CV by working with international NGO and of course to take a new challenge in my working.,0.21840076,0.7810267,0.00057247246
The position and salaries that I'v got is not fit with my experience and qualification.,0.99902964,0.0008136834,0.00015676596
To diversify my area of work and expertises,0.0006135837,0.99617505,0.003211293
Good experience great Org and very supportive.,0.00020383418,0.00025429192,0.9995419
Good values and strong management,0.0012004939,0.0012454877,0.997554
There are no cons that I can think of.,0.00035952457,0.9992335,0.00040699047
Children allowance is given. Salary is fair. Staff welfare is improving. Processes are improving,0.05954942,0.37862077,0.5618298
Low staff retention. Few opportunities for career growth.,0.9991773,0.0006704238,0.00015218351
Their salary scale is good,0.012560486,0.15308857,0.83435094
Not appreciating their employees at work.,0.99914265,0.00069052726,0.0001668074
Skills are learned ProfessionalismRespect of Employees Great Management,0.0023818016,0.0022767854,0.9953414
no trainings are conducted in the past months at least for me but regular mentoring is here and it is great.,0.003501253,0.3364204,0.6600784
working for children in need all over the world.,0.038389646,0.9495455,0.012064836
Terre des hommes aims to provide aid as quickly as possible to children and families affected by natural disasters and armed conflicts,0.12248465,0.85346115,0.024054166
It will offer you Health Insurance,0.002372448,0.87693274,0.12069485
Not getting promoting soon on yearly basis.,0.9988851,0.0009875278,0.00012737769
Salary Colleagues  Funds Location ,0.00039669898,0.99766797,0.0019352234
Abuse of Power and Non professional Management,0.9991447,0.00067814335,0.00017712869
Work challenges gave me a strong experience in short period,0.002761555,0.04846558,0.9487729
Many things should be addressed,0.010292097,0.989116,0.000591962
To support society and the development and manufacture of women leaders that can have a clear impact on democratic processes,0.00048328724,0.0005512196,0.9989655
Lack of targeted numbers in the humanitarian programs for women in the slums compared to the regular areas,0.9989945,0.00086234254,0.00014316021
Small organization and easy to set yourself in,0.9258032,0.07250299,0.0016939115
Not open for change,0.99334335,0.0065003615,0.00015630091
Excellent opportunity to work secure good working environment good code of conduct,0.00023631181,0.00018440791,0.99957925
Away from home not more than this.,0.0028955515,0.99678755,0.0003168766
Learning opportunities advancement and benefits,0.0002885131,0.0010036549,0.9987078
Bureaucracy relations unfairness nepotism and discrimination,0.9990207,0.00082944473,0.00014977466
Improve humanitarian work experience and encourage team work.,0.99868196,0.0011583924,0.0001596647
Working under stress to meet the deadlines,0.9991079,0.00071053964,0.00018153862
1.communication skills 2. Office skill 3. Good administration,0.0018694022,0.010141548,0.98798907
I will work on my cons to be better,0.0007963652,0.99839395,0.00080962933
Good learning experience and exposure,0.00028938617,0.00028791535,0.99942267
Fatigue and no time for myself,0.99915004,0.0006837392,0.0001662512
Professional environment wellpaid good entitlements great room for promotion,0.00064941234,0.00038050328,0.99897015
Hectic too much work case management,0.9989544,0.0008752109,0.00017043421
The organization's mandate is clear and requires a lot of challenging work to acheive,0.99670756,0.0031348467,0.00015751993
Similar to many big UN agencies bureaucracy is everywhere.,0.99626476,0.0036441186,9.110418e-05
I have very great time working there.,0.0035946937,0.027143512,0.96926177
I developed my career with UNHCR.,0.00049907976,0.9976961,0.0018048325
First of all Honorable mandate. Pride working for the organization Good salary and benefit structure. National staff know what they are doing. No opportunities to travel.,0.00070729933,0.0006070794,0.99868566
No bonus policy so no matter how hard you work salary will not change much. Slow career progression difficult to get a promotion.,0.9991351,0.00071923545,0.00014564485
Because I worked with UNHCR and UNICEF in Iraq exactly in the south of Iraq as a team leader and social worker and expert with them.,0.00078412023,0.9976827,0.001533145
Positive to work hard with the team especially in the field.,0.00076905463,0.0033921152,0.9958389
Very Friendly working environment you meet people from different nationalities and cultures. Plus the humanity side of working with UNHCR by helping other peoples.,0.00019051215,0.0002629579,0.99954647
Not following the safety procedures specially for those who work in the field may lead to series accidents.,0.9988636,0.0009768282,0.00015955795
Promote human rights Humanitarian act Organized,0.00025732597,0.00038973597,0.999353
There is no downside of UNHCR for me.,0.0003758276,0.9989574,0.00066681264
International humnatarian organization involved in children problems and suports worldwide. Very dedicated sincere staffs in higher management specially.,0.06319979,0.09252349,0.84427667
Long time require for selection of new international staffs.,0.9987306,0.0011256004,0.00014380032
experience practical and support people,0.0016814893,0.06014417,0.93817437
some administrative issues in handling the work,0.99453014,0.00532556,0.00014424445
good communication skills and IT skills,0.00047294796,0.0005826893,0.99894434
over 6 years in the Humanitarian fields,0.00272815,0.9965739,0.00069792185
a great and friendly working environment,0.00018252443,0.00018469886,0.9996327
units in WFP are limited therefore experience and opportunities are limited too,0.99879336,0.0010820902,0.00012457953
Integrity professionalism fairness equality transparency,0.061804246,0.8909769,0.047218885
downsizing in some parts of the world,0.9943071,0.0055551385,0.00013772631
Good Place to learn Mixed nationalities,0.00014909974,0.00022771861,0.9996232
Nothing I can think of,0.00029478918,0.99918336,0.0005218656
