Comment,Negative,Neutral,Positive
Possibility to grow continuation internal mobility easy to move between departments,0.00048729562,0.0017548498,0.99775785
not the best paid in the industry,0.99897575,0.0008724632,0.00015185274
Not Many Pros to be shared about working there except some Job growth but it depends on who is your manager,0.00040205,0.9992281,0.00036987785
ACTED barely offers any benefits for employees who are under a national contract.,0.99906117,0.0007895475,0.00014932503
 good learning environment  good team,0.00019645001,0.00020265761,0.99960095
 very bad salaries  limited promotions,0.99917454,0.00066778465,0.000157674
Get additional per diem housing and education allowances,0.36787757,0.5644186,0.06770381
Work/Life balance is tricky to manage,0.9987987,0.0010623034,0.00013891274
Entry to NGO field.  Opportunity to work in diverse countries.,0.00026096165,0.0002884739,0.9994505
below average salary range. Poor inexperienced management. A PD lady promoted to CD!! non technical expat GF of DCD put in charge of WASH project over WASH Engrs. crazy.  Poor experience leads to poor project management waste of donor funding and sometimes poor beneficiary experience. Senior management to keen on taking selfies on project site rather than ensuring camp fit for IDP's.  3 months in operation and no fire prevention measures contributed to death of a 2 year old. Management didn't care or want to know. move along nothing to see.,0.999079,0.0007669813,0.00015399266
Great place to work everyone is very friendly professional and passionate about the NGO cause.,0.00020037816,0.00018726866,0.9996124
There are no team building activities understandable as this is a nonprofit NGO.,0.9957575,0.0041202344,0.00012226179
Good experience for fresh graduates or gaining NGOs experience the salary rate is acceptable and good donors like UNHCR OCHA,0.0005040989,0.0010672781,0.99842864
No system each department is independent they don't care about the work quality nor quantity no respect to working time hours,0.9991128,0.00072148844,0.00016568153
Much more freedom to develop your own projects.Great people to work with.Good reputation in the industry.,0.00021527047,0.00024374595,0.99954104
The salary is below average.Lack of support from Head Office.Workload can be very high sometimes,0.999204,0.0006193205,0.00017678142
Systematic and care about the staff,0.9968772,0.0029447153,0.00017810361
I don't remember any bad point in ACF,0.00038566097,0.9990639,0.0005504946
Offer benefit set for the Local and International staff and strong technical tools,0.00024109162,0.00024126364,0.9995177
you need to work hard and manage a big project with additional tasks,0.0034306075,0.9959099,0.00065952016
Place to grow. Respectful environment. Decent salary,0.00032235187,0.00025091268,0.9994267
working on weekends and holidays,0.94857883,0.051013205,0.00040794187
The campus of AUIB boasts beautiful greenery flowers and trees that provide a peaceful atmosphere away from the hustle and bustle of city life. The university provides free bicycles and buses allowing staff to take full advantage of these tranquil surroundings. Another unique aspect of AUIB is its architectural legacy. The campus includes repurposed palaces from the era of the Ba'ath party which have now been transformed into educational spaces. The exterior architecture of these former political palaces is visually striking. The aim to uplift the educational standard in the country is indeed a laudable mission undertaken by the owning family. The intention to provide an international standard of education in Iraq is an admirable objective which brings hope for the future of the nation's youth. The campus has serene lakes and an abundance of birdlife providing a serene environment conducive to reflection and creativity. The harmony of nature amidst the educational structures makes for a unique blend of tranquillity and scholarly pursuit. The institution's reputation and practices are rooted more locally diverging from those typically associated with American academic institutions.,0.00029641713,0.0012157867,0.99848783
Unfair sudden decrease happened in all salaries. The announcement of a 20% salary reduction due to new taxes was not only poorly timed but also unjust. Unlike many international organisations AUIB passed the tax burden onto its employees directly affecting their income. The lack of prior notice left many employees stranded unable to make timely decisions about their employment status.  At AUIB rumours and gossips often serve as the primary mode of communication rather than direct professional exchanges. It is disheartening to discover changes concerning one's employment status from hearsay rather than an official communication. This lack of transparency is bad planning.,0.9990503,0.0008002664,0.00014939762
Lovely location greenery lakes beautiful scenery,0.00025314378,0.00029942743,0.9994474
Not good staff relationships between academic side and site management,0.9988586,0.0009976475,0.00014381751
AUIB's vision is to transform education in Iraq This needs a dedicated and experienced team. The Founder and President are always supportive to any project that will realize the vision. What makes AUIB a wonderful place to work at is the that 99% of faculty and staff are committed to AUIB's vision they are team players and work with dedication. The students are the bright young minds of Iraq. Many times I hear  our students are fantastic from faculty and ELA instructors. As employee: no stone is left untouched to make life easy and enjoyable. The safety of expats are given priority always in armored vehicles and with wonderful security team. Traveling out of the country the security team take care of you until you are booked in. Everyone get VIP treatment. Health insurance: fully staffed clinic on campus insurance for outside and inside Iraq in times when emergencies happened the bill was paid by the Founding Family. Every employee is treated as a family member. Housing: top of the range modern housing. All utilities are paid for by AUIB. Maintenance issues are taken care of within hours of reporting. Furnishings and finishings are high end no costs were spared. Gym: excellent fully equipped gym with table tennis darts billiard tables etc. Airconned free water supply free membership. Food court: variety of food outlets traditional Iraq food fast foods. Grocery store: stocks everything you need from international and national brands. Fresh vegetables and good cuts of meat. Health foods organic vegan supplies as well. If you need anything the staff will gladly order and deliver to you. AUIB club: luxurious setting with swimming pool excellent food you get discounts of up to 45% theme nights quiz nights. This is where everyone meets after a long day. Management: as a start up changing educational landscape merging American Style educational style with Iraqi education is not easy. There are many challenges from legislative to logistics merging enrollment methods aligning curriculums hiring according to prescribed registration rules in Iraq etc. The management team has to be light on their feet to address external as well as internal issues. The team therefor has to be well educated global experience team players and team builders. Not everyone that was hired could adapt to these challenges. Add covid and world recession and only the best will survive. The President is the Founding President the Founder and his family is the sole supporter of the project  they have what it takes not only to make it work but to make it success. The business structure: policies and SOPs are in place the Iraqi labour is followed to the T. Several approval steps have all checks and balances in place. Personal development is encouraged many events are held on campus for participation. Further studies are encouraged supported and approved. The success of AUIB is possible because the Founder and President has a balanced working relationship they compliment each other professionally. To have a good sense of humor is very important. The President keeps the team in a light heart the is excellent for creating a good work environment. You always leave a meeting at the President's office with a smile on your face.,0.3298889,0.42429742,0.2458137
There are always a small group of people that could not make it at AUIB. These are the ones that did not have what it takes to operate in a fast changing high pressured environment. Your work place is your choice: not a good fit find a good fit.,0.9988563,0.0009928389,0.00015091241
Great People Beautiful campus! Great experience!,0.00019939458,0.00019469169,0.99960595
As a new institution there are still times of confusion and duplicaiton,0.99713314,0.0027492237,0.000117710246
Exceptional environment AUIB will get Iraq back to its golden age. Very promising for the Iraqi students who will definitely be the greatest leaders in the future.,0.00027858146,0.0009370553,0.99878436
Everything is great so far,0.0007991632,0.9983621,0.0008386763
New and challenging environment. The chance to really make a difference.,0.04740136,0.77868855,0.17391013
Any new university will have growing pains at times.,0.99591076,0.0039767874,0.00011246308
Due to my current work in the American University of Iraq Baghdad I have seen that it is one of the best innovative university in iraq which is focusing about Extracurricular activities. Research facilities. Financial aid. Campus size. Campus location.,0.00018575625,0.000331327,0.99948287
I donot see any negative sign.,0.00039611463,0.9990363,0.00056755624
Beautiful campus great security who were polite and friendly as well as the  head of security very nice garden and construction workers very skilled colleagues who were quite helpful a couple of great IT staff that were helpful and of course the students!!,0.00023436398,0.0002187748,0.9995468
"Rude colleagues disorganized upper management that confused you rude President no medical facilities disaffected sponsor who seems to be out of touch as after a colleague supposedly died on campus suggested they take staff to a museum to get their mind off of ""negative"" thoughts. It was an incredulous and unbelievable atmosphere. I would not advise anyone who wants to keep some morals and positivity in their life to go to work there. I am glad for the experience as it was nice to see Iraq and meet a few people at the shopping mall but the University does not seem safe in many ways. Enter at your own risk!",0.98933864,0.0100984005,0.00056305766
 Friendly Environment Supports Iraq's young students 100% one of the best Universities in the middle east,0.00020415196,0.00022111382,0.9995747
Nothing bad to say! really good place,0.0016815315,0.98133355,0.016984966
A new university with outstanding facilities. Very attractive campus. Helpful people. Good academic programs.,0.00018889047,0.00019001393,0.99962103
I really can't think of any!,0.0003962302,0.9992607,0.00034305785
This reported income is free of Income taxes so it has the buying power of over 100K. A fabulous new apartment is included with all utilities that would be likely be $2500 a month if one rented it in the New York area. Contrary to popular opinion it is very safe here Security is like having the secret service protect you. (and a thousand soldiers),0.0062068566,0.04931573,0.94447744
The medical benefits are next to nothing here. They currently have a middleeastern insurance company that pays for nothing stateside.,0.99875784,0.001098345,0.00014384017
Pay when they managed to pay it on time,0.08160365,0.90307194,0.015324422
Quite literally everything else. That place is a dumpster fire who treats their employees awfully! The great salary wasn't worth it.,0.9987674,0.0010778758,0.00015476707
IntelligentHard worker Team spriteWorking under pressure Problem Solving English proficiencyMS proficiency,0.00044907728,0.9969921,0.0025588092
Helping others often makes it a burden,0.9983333,0.0015091072,0.00015764419
A professional environment collaborative staff and faculty. A management that goes out of its way to make sure employees are taken care of. Very engaging community,0.00030774408,0.00024541467,0.9994468
Personally there is nothing that is not good.,0.0006039202,0.99883515,0.0005609359
Great environment an amazing addition to your resume,0.00020390344,0.0001928747,0.9996032
brand new University it will be tierone University in Iraq and Middle east,0.00030203833,0.9984876,0.0012102798
Strong vision for the future clear mission goals dedicated team of Iraqis and Expats strong commitment from the sponsors and an amazing campus.,0.00024648494,0.00024858522,0.9995049
While the campus is still under construction it gets better every week! COVID is making planning difficult but that is true everywhere. Summers are very hot but you now that before coming here right?,0.033389673,0.963039,0.0035713224
It was a wonderful organization and it was great honor for me to working with them and gained many experiences with them,0.00024126207,0.00023143715,0.99952734
There was a lot of risk because of terrorist acts,0.9985266,0.0013516977,0.00012162692
Many great colleagues wishing to make a difference. If company values are actually guiding HQ leadership it could be a nice place to work.,0.0057301465,0.9651635,0.029106269
Internal power battles at HQ makes project life very difficult. Too often the company wants to portray stories that have nothing to do with realities on the ground. This leads to high staff turnover and spoils the work environment.,0.9990638,0.00078923337,0.00014693075
Good company in the employee management system and powerful company standards and policies,0.0002728366,0.0002316612,0.9994955
the salaries depend on the donor and the project fund.,0.003874682,0.9951866,0.0009388202
Working from home is good,0.002749367,0.9361145,0.061136242
Working more than 8 hours sometimes,0.99883646,0.00097091525,0.00019259941
Great experience working with minimal supervision Average salaryComfortable teamwork environment Close to beneficiaries Strong in mobilization and community based protection approach,0.00033773153,0.00025905788,0.99940324
Lack of clear policy and procedures Lack of monitoring on the treatment of staff by seniorsLack of strong documentation Lack of follow up on staff leaving the organization and the reasons for thatPoor management structure,0.99912196,0.00071573845,0.00016228502
1 Not very good Salary but better than many other NGOs. 2 Friendly environment. 3 Managmnet is helpful with employees. 4 Flexiblity.,0.0010187763,0.0046324073,0.9943488
1 Unprofessional administration system. 2 Not paid overtime. 3 Working far from the job description. 4 No health benefits. 5 Lack of technology and tools. 6 Very weak monitoring and evaluation system.,0.99922335,0.00061884726,0.0001577822
Good salary and also work environment,0.0010631562,0.00063147355,0.9983053
Less worklife balance and long hours,0.99914575,0.0006986418,0.00015556601
Cares about mission and employees,0.9418315,0.05769289,0.0004755565
Lots of internal politics and internal hires even when employees are not well suited for management roles. Also every region has a very different management culture.,0.9975025,0.0023825308,0.00011500864
the humanitarian work is the best in this world because you are going to help the people who are really in need. the work with such movements and getting experience of leading and management its extremely interesting. the french red cross is like a school teaching you how to lead and manage a project.,0.0003811524,0.00069563265,0.99892324
the turnover between the expat actually have an impact on the project and it needs to have a long term of a real strategic without many changes. the second things is that the salary is not good.,0.998336,0.0015345234,0.00012951327
good work environment and good cause to work for,0.0002324545,0.0002019047,0.99956566
hiring of relatives even among expats,0.99858546,0.0012853842,0.00012911925
flexibility in work and good practice,0.00034656803,0.0005264318,0.999127
salary is always not as expected,0.99875903,0.0010841719,0.00015678092
You get to see some of the worst situations in the world  and you get to help solve them.,0.9972344,0.0025926167,0.00017302456
Long periods away from home.,0.9987369,0.0011342407,0.0001288447
great environment great management friendly team.,0.00020784792,0.00019973029,0.9995925
no cons can be addressed about this organization,0.9981654,0.0016910539,0.00014346943
Fairness/teamwork/Family/Humanity/good work areaDRC is an amazing place to work I hope that I can work again with you in higher positions in the future,0.0002473245,0.0002873346,0.9994654
I hope that DRC takes more care of the staff especially the staff who are worked with DRC for more than 2 and 3 years,0.39441225,0.60460764,0.0009800759
Social Cohesion Project Manager in Diyala/Iraq,0.00036319077,0.9959423,0.0036944558
Working on Dynamics system for procurement and management,0.005808212,0.9044138,0.08977798
Got experience and learn how to work in the humanitarian sector.,0.004402574,0.9638293,0.031768158
Try to promote the deserving employees.,0.016955672,0.98083353,0.002210764
Good system A place for self development,0.00020523267,0.00019117225,0.99960357
Salaries and wages for employees,0.9389046,0.059254717,0.0018407181
Collaborative Flexible Friendly space Capacity,0.00021950142,0.00025375126,0.99952674
no any cons just there are no any up of level,0.00035802167,0.99916446,0.0004775435
steady employment compared to other workplaces,0.00067227666,0.9989096,0.0004181339
low paying wages compared to counterparts,0.99891233,0.0009425093,0.00014519083
Very good salary and benefits,0.020603733,0.0071603074,0.9722359
Could focus more on their staff wellbeing,0.0533822,0.9459216,0.00069616595
Very flexible structure You are empowers and independent as a manager allowing you to take action and adapt quickly. You really se the effect of your work,0.0009603577,0.010110832,0.98892874
Sporadic support from HQ on field work in the shape of global guidelines implementation.  IM management global guidelines are yet to be developed,0.993891,0.0058155027,0.0002934555
Growth Opportunities for national staff,0.00023479003,0.00024073757,0.9995245
Lacking in diversity  gender race,0.99885356,0.0009920014,0.00015448531
Works as a team activities,0.0018623333,0.116149224,0.88198847
Big stuff and many people I don't know,0.0012427676,0.9983771,0.00038010065
Not much positive to say. Maybe the fact that danish demining group is a part of the company. Works in vulnerable areas and provide assistance mainly to refugees/,0.0009817461,0.9986125,0.000405721
Lack of support from head quarters and home office. Very poor management makes people leaving organization in short period of time. Low salary and benefits.,0.9992367,0.0005916547,0.00017161397
Better career development/improvement in all aspect,0.1379166,0.8557105,0.0063728695
 Only external factors. Security issue like proxy war IS activity government polices and current COVID19 disease,0.97541624,0.024453238,0.00013046934
Working within humanitarian sector joyful and makes you fell you are doing something great to effected community’s/people,0.00032071344,0.00133793,0.9983413
System keeps change and no integration between DRC&DDG,0.99652416,0.0033263515,0.0001494273
I will be happy working with DRC because as I worked  for 3 years with DRC  and I get more experience  about logistic and fleet management.,0.0014882464,0.990875,0.0076367464
Nothing downside working at DRC,0.0003932854,0.99893314,0.00067356543
Try to develop work continuously,0.0006157605,0.9980269,0.0013572964
In the team protection and ways to live complain of team leaders,0.9978416,0.0020193309,0.00013910294
Engineer and mapping and software,0.0025541715,0.98675764,0.010688315
I everyday is happy in this world,0.008215334,0.70550394,0.2862808
Help people. I would like to work in the humanitarian field,0.0024391836,0.99688584,0.0006750283
Don't care about their staff very well,0.9990403,0.00082113076,0.0001384968
Because of the great gob they do in the humanitarian aspects,0.0014947759,0.041140858,0.9573643
I haven't seen any downsides during my job,0.000730716,0.9986519,0.0006173837
Very good management and overall relations.,0.026463764,0.06523578,0.90830046
No movement between levels and career prospects.,0.98609924,0.013779473,0.000121283236
its encouraging learning and there is lots of capacity building,0.00027284492,0.0004995685,0.99922764
I didn't find any cons in this organization,0.96607435,0.0337402,0.00018541132
team work good salary  respect,0.0623346,0.072733566,0.8649318
hard to  get  the job there,0.9987087,0.0011450027,0.00014637526
it works for helping IDPs in my country,0.0013924446,0.020949421,0.97765815
I think there was no downsides to work on RC,0.00037825332,0.99895084,0.0006708771
Good Environment and Well reputable Humanitarian NGO,0.00020851872,0.0002108405,0.9995807
Overload and dynamic work demand to respond to the emergencies.,0.99867946,0.0011462459,0.00017433013
Procurement is my core function,0.0015658918,0.9108698,0.08756429
very recommended to work with,0.022968804,0.66751045,0.30952075
Stability compensation and Benefits work environment,0.00058628793,0.00046367207,0.99895006
Bureaucracy nothing more to add nothing more to add,0.02999348,0.969611,0.0003955897
The working environment is a casual environment,0.99705267,0.002727002,0.00022039066
The organization is very bureaucratic,0.9990829,0.0007695537,0.0001476146
Help Communities through ICAP  Program ....... gave Hundreds of people  the to progress in living batter,0.0002801664,0.00070046505,0.9990194
Dangers environment ...Only experts in the Iraqi coulter can work in,0.9974942,0.0023848002,0.0001210217
Highly motivated team and professional work context,0.0029798918,0.010300021,0.98672014
Short termed projects and a slightly complicated internal financial system,0.9985568,0.0013079614,0.00013522111
Loyal to employees that stay longer,0.00063393795,0.0010505558,0.9983156
The hierarchical culture is irritating and not pleasant,0.9989743,0.00086426275,0.00016144697
good salary flexible respectful understanding development management,0.0021675501,0.0013364756,0.996496
capacity building needed environment quality,0.0049019866,0.9896102,0.0054877605
The staff of Heartland in Iraq believes strongly in the work they do. They tackle difficult topics with determination perseverance.,0.004570347,0.015095657,0.980334
Systems are very weak particularly from US headquarters to national offices which can slow or stymie project success.,0.9991247,0.0007361324,0.00013917344
You feel you are really contributing to the work of human rights.,0.029224237,0.1201547,0.85062104
Pay is not great! And you can get overloaded with work,0.9991792,0.0006374522,0.00018332711
Like to work in hospital and help people,0.0030985626,0.99164784,0.005253491
I would like to work with hospital staff so I don’t have cons.,0.0012574687,0.99820125,0.0005413025
Good. Active. Honest. Ambitious,0.0011597193,0.9285318,0.0703085
Hard working. Without medical insurance,0.9992186,0.0006207562,0.00016072886
Family environment friendly working culture,0.00019066024,0.0002126216,0.9995968
Lack of structure and procedure micro management very disappointing priorities in programming and implementation lack of staff welfare structure i.e. proper insurance,0.9991303,0.00070949853,0.00016015832
Communication was a challenging position at iMMAP but also exciting,0.0041922713,0.9708193,0.024988487
The Communications team was at its infancy when I started lot's of changes in strategy projects and personnel,0.99341387,0.0064726784,0.00011344016
Very good in experience and technical,0.0044258717,0.8753145,0.120259605
Very bad in salary and behavior,0.99903643,0.00080300664,0.00016055154
Friendly environment good pay professional management,0.00024511915,0.00020835892,0.99954647
Hardship locations no pensions or social security,0.99917334,0.0006611288,0.00016549023
VERY GOOD AND EXCELLENT WORK ENVIROMENT AND PERFECT HR SYSTEM AND WONDERFUL STAFF,0.0003072074,0.0002749289,0.9994179
Humanitarian workplace and wonderful staff you can show your ideas and express yourself very good,0.00022200475,0.00021522034,0.9995628
We are working on the missing people globally,0.0010533471,0.9974941,0.0014526593
Good please to enhance skills,0.0016234745,0.6828604,0.3155161
Friendly environment fair opportunity and good salaries relatively,0.00042383108,0.0003410444,0.99923515
a lot of working activities,0.00036801017,0.9976902,0.0019418831
Multinational and multicultural work environment opportunity to live in countries another way you will never visit. Comfortable installations good work environment. Equilibrated work/rest balance.,0.0007088549,0.0007492199,0.99854195
Working in a very complex context. Corruption fight is a major challenge at all levels. Management support is poor. The institution is weak and stakeholders and contracts try to take control of the projects.,0.99904054,0.0008181306,0.00014121525
Good environment and good colleagues,0.00020443604,0.00019876851,0.9995968
Nothing relevant to comment on that,0.00028653233,0.9990528,0.0006606186
a good start to work with,0.00025783907,0.0003788814,0.99936324
they do not respect their staff only mobile staff is important,0.9981645,0.0016671689,0.00016837574
Humanitarian mandate making a difference for the lives of people affected by conflict and other situations of violence wellestablished structure and way of operating across contexts additional benefits on hardship missions many opportunities within the organization to be exposed to a variety of programmes and activities as well as opportunities for career mobility within and across departments.,0.00048058352,0.00039922594,0.9991202
